14	Ismiprämpf	emo	the anticipation when you are expecting visitors and are constantly impatiently checking whether the person has arrived.	"['closeness, impatience, love, relationship, intimacy, touch', 'eagerness, joy, fulfillment, heart, effort, absorbing, getting lost', 'windows, jittery, walking around, cleaning, happiness, looking in the mirror', 'security, security, serenity, trust, calm, friendship, feeling, pleasant', 'overwhelming, beautiful, frustrating, complicated by pandemic, motivated', ""uncomfortable, when you're stressed, time, maybe you just don't want to, don't like other people, you're not in the mood for conversation yourself, neighbors, acquaintances, people you don't have a close relationship with"", 'ambition, sense of duty, demands, practice, discipline, perseverance, motivation, being good at something, pride, training, goals', 'calm, still, warm, relaxed, no thoughts, warm breeze', 'self-image, perception, emotions, rational', 'indifference, cool, is okay, a bit of pride, happiness for the person, unaffected, rather positive feeling, how well the tasks were done, just getting them done is usually not enough, great, thumbs up a slight grin', 'smile', 'self-reflective, strict, self-improvement, admitting mistakes, working on yourself', ""touching, unwanted, suppressing, stranger, asserting one's will, waiter, pointing out something, intercultural differences, pulling"", 'stupid, lazy, uncooperative', 'insecure, anxious, lone wolf, strong, shy, sad, helpless', 'emotions, empathy, not alone, connection, becoming aware', 'warmth, closeness, security, longing, wanting, happiness, lightness, meaning, connectedness, physicality, nice more of it', 'frustrating, conflicted, doubt, indecisive, risk, isolation, skeptical, suspicious', 'excitement, desire, intimate, tension, longing, in love, butterflies in the stomach, nervous, shaky', 'anxiety, presentation, lecture, conflict, big task, job, management, practice, routine, confidence, preparation', 'pride, more intense with friends', 'beautiful, one is happy for others, the skin becomes warm, one has to smile', 'future, paths will cross again, make acquaintances, friends, neighbors, companions, good feeling, likeable person, cross paths', ""introvert, little acceptance from others, sensory overload in today's world, not interested in partying"", 'relaxation, calm down, bliss, feels good, being able to talk, feeling free, joy', 'trust, love, feelings, security, hug, confidence, not being afraid, security, childhood, basic trust', 'positive, happy, not expecting it, unexpected, positive surprise, little joy', 'patient, waiting, calm, avoidance, not interested, not sure, lack of motivation, maybe interrogated', 'sneaky, fox, clever, shame, hidden, envy', 'control, security, trust, fear', 'planning, vacation, flying, road trip, partner, friends, provisions, summer, beach, new chapter, nervousness, opportunities, uncertainty, strangers', 'isolated, alone, rest, reflection, self-discovery, self-love, meditation']"	32	[[1775, 1516, 1113, 818, 1657, 1052, 951, 1913, 158, 865, 810, 1528, 66, 868, 282, 456, 510, 241, 957, 1709, 1502, 271, 1126, 1549, 1276, 1206, 546, 1447, 779, 960, 1692, 1232]]	[66, 158, 241, 271, 282, 456, 510, 546, 779, 810, 818, 865, 868, 951, 957, 960, 1052, 1113, 1126, 1206, 1232, 1276, 1447, 1502, 1516, 1528, 1549, 1657, 1692, 1709, 1775, 1913]	1025	1006.0	6.0	1953	[[0.5412835478782654, 0.5551137328147888, 0.5686061382293701, 0.576897144317627, 0.5492684841156006, 0.5701450705528259, 0.5729940533638, 0.5243082642555237, 0.6038325428962708, 0.5757572054862976, 0.5771849751472473, 0.5546258687973022, 0.6136763691902161, 0.575631320476532, 0.5958811044692993, 0.5883176326751709, 0.5867331027984619, 0.5980901718139648, 0.5728312730789185, 0.546308696269989, 0.5556337237358093, 0.596293032169342, 0.5682887434959412, 0.5537657141685486, 0.5632348656654358, 0.5656130909919739, 0.5854021310806274, 0.5577907562255859, 0.5779590606689453, 0.5727735757827759, 0.547450840473175, 0.5647184252738953]]	0.5705128330737352	0.5961987351597965
15	Ismiprämpf	neu	assuming someone is coming to visit and regularly checking to see if the person has arrived.	"['excitement, test, application, uncomfortable, fear', ""useless, funny, i wouldn't check all the time, i know when it's coming"", 'meditation, rest, balance, freedom, contemplation, time, relaxation', ""silence, avoid, neighbors, postman, tense, don't feel like talking, taking a shower, eating, in pajamas or naked, looking through window, incompetence, childish, afraid, annoyed"", 'zen, buddha, buddhism, calm, stillness, free, connected, in the here and now, soul, being one', 'nervous, mental, stage fright, organized, in control, insecure', 'growing up, important, meta, good feeling, empowerment, me, great', 'inwardly listening, surprised, thoughtful, irritated, amazed, stopping, wants to hide', 'beautiful, lust, fun, necessary, gone, new', 'impatient, waiting, searching, window, looking out, clock, walking around, door, restless, anticipation', 'empathy, encouragement, cheering, sharing and giving joy, warmth, support', 'communication, interaction, exchange, friendly, interesting, learn something new, make contacts', 'dream, blissful, mad, sleep', 'joy, warm feeling, fullness, good day, life', 'hypocritical behavior', 'postman, garbage collector, hope for neighbors', 'joy, gratitude, appreciation, warmth, smile, laugh', 'relaxation, melancholy, memory', 'relaxed, confidence', 'contentment, rest, peace, rested, energy, joy, security', 'uncertainty, fear, trust, nervous, sweat, strange, inhibition, mouth, hearing, speaking, classroom, presentation', 'planning, positive, development, happiness, study, work, learn', ""annoying, time-consuming, emotional imbalance, devastating, groundless, suddenly, for no reason, trying to see, where it's coming from, help, attitude change, slow, tired, sadness"", 'harmony, relaxation, calm, contentment, serenity', 'happiness, joy, community, fun, genuine, carefree', 'pack your suitcase, corona, joy, excitement, excited, noise, pull, zipper', 'fear, husslen, focus, training, anger, envy', 'passion, love, warmth', 'productive, proud, start up', 'rude, ringing, lazy, slow', 'unable to get going, stress, been up too long, slept poorly, tossing and turning, lying down, staring at the ceiling, headache', 'look at the window, check whatsapp status, wait at the door, anticipation, expectations', 'exam, be well prepared, orderly, structured']"	33	[[12, 1926, 1445, 372, 916, 657, 10, 837, 125, 1915, 1914, 1789, 279, 520, 469, 496, 618, 523, 94, 1374, 1667, 979, 1410, 845, 310, 1929, 1079, 1485, 635, 1261, 1516, 1923, 1014]]	[10, 12, 94, 125, 279, 310, 372, 469, 496, 520, 523, 618, 635, 657, 837, 845, 916, 979, 1014, 1079, 1261, 1374, 1410, 1445, 1485, 1516, 1667, 1789, 1914, 1915, 1923, 1926, 1929]	980	916.0	12.0	1953	[[0.6356513500213623, 0.5246659517288208, 0.5644769072532654, 0.6024536490440369, 0.5810425281524658, 0.5901710391044617, 0.6361843347549438, 0.5837118029594421, 0.6176296472549438, 0.5286553502082825, 0.5291396975517273, 0.5463452339172363, 0.6065360307693481, 0.5954700112342834, 0.5975514650344849, 0.5965914726257324, 0.5919041633605957, 0.5954269170761108, 0.6195505857467651, 0.5666884779930115, 0.5543854832649231, 0.5791792273521423, 0.5653636455535889, 0.5835166573524475, 0.6053040623664856, 0.5242290496826172, 0.5764106512069702, 0.562849223613739, 0.591202974319458, 0.5704910159111023, 0.5612982511520386, 0.5260842442512512, 0.5782243609428406]]	0.5784359231139674	0.5961987351597965
16	Glühm	emo	pretending to be out of the house when there's a knock on the door and hoping the person will leave.	['massage, relaxation, friend, love, wellness', 'happy, money, old things from before, sorting out, tidying up', 'joy, desire, butterflies in the stomach, excitement, imagination, closeness, gratitude', 'cheering, brighten day, surprise, money, reminder of other person, grin, happy, gift', 'self-confident, proud, adult, determined, competent, important, hopeful, clarity, clear head, no more headaches (vul), finally, free', 'closed, sad, introverted, desperate, loss of confidence, pain', 'why, explanation, uncertainty, tingles', 'uncomfortable, sweat, practicing again and again, queasy feeling, palpitations, perfectionism, wanting to push back', 'tired, lazy, bad mood', 'worry, fear, apprehension, apprehension, thinking, mind circles, trapped, over worried, imprisoned', 'waiting for better offers, indecisiveness, please others', 'empathy, feel into it', 'nightmares, insomnia, discomfort, tired, sleep', 'too bad, escaped', 'waiting impatiently, a person you like', 'unpleasant, feeling you get away badly, doubting where you got this feeling from', 'laugh, hug, congratulations, inspiration, love, friendship, happiness, deserved, success', 'calm, still, tension, alert, senses, waiting', 'anger, anger', 'novice, learning process, insight, wisdom, experience, realism, plan', 'room, dreaming, bed, sleeping, long night, tired, sluggish, short', 'hands, skin, love, affection, trust, together', 'training, practicing, getting better, mastering, perfecting, beginning, learning, skill, improving, engaging, only things of interest, time, intention, comparing, self-interest', 'tired, exhausted, broken, listless, depressed, worried, restless', 'trauma, insecurity, lonely, sad', 'we forever together, mom, dad, baby, family, warmth, sofa, hug, chips, blanket, support, always there, phone, advice, help, tools, spices, great, not all have', 'mourning, alone, crying, looking ahead', 'surprising, happy, exciting', 'sweet, cringe, uncomfortable, envy', 'relief, trust, security, rare', 'pride, self-confidence, happiness, joy, future, work', 'love, money, happiness, security', 'getting too close, unasked, know-it-all, helpful, problem']	33	[[918, 1914, 1651, 1150, 200, 435, 1264, 1373, 990, 1061, 1089, 394, 1304, 160, 1595, 1693, 888, 504, 222, 988, 1555, 1518, 308, 648, 256, 829, 1598, 295, 622, 1076, 281, 1525, 1019]]	[160, 200, 222, 256, 281, 295, 308, 394, 435, 504, 622, 648, 829, 888, 918, 988, 990, 1019, 1061, 1076, 1089, 1150, 1264, 1304, 1373, 1518, 1525, 1555, 1595, 1598, 1651, 1693, 1914]	949	990.0	3.0	1953	[[0.5821958780288696, 0.5241072177886963, 0.5540110468864441, 0.573570728302002, 0.6107136607170105, 0.598601758480072, 0.5699542760848999, 0.5655636787414551, 0.5792497396469116, 0.5765520334243774, 0.5754924416542053, 0.6001116037368774, 0.5681752562522888, 0.6141521334648132, 0.5567420721054077, 0.5513879060745239, 0.5829043984413147, 0.5958231091499329, 0.6093566417694092, 0.579322874546051, 0.5585530400276184, 0.5602059364318848, 0.6045715808868408, 0.5906599164009094, 0.607093870639801, 0.5848185420036316, 0.5565778017044067, 0.6051941514015198, 0.5917142033576965, 0.5759888887405396, 0.6057453155517578, 0.5599722862243652, 0.5781596899032593]]	0.5802195054112058	0.5961987351597965
17	Glühm	neu	when there is a knock on the door, sit still and wait to see if it knocks again.	"['nervous, interview, important, fear, practice, prepare, get better, good impression', 'random, joy, rediscovery, happiness, idea, key, search, find', 'plan, satisfaction, pride, achieve goal, celebrate success', 'unwanted, pushy, annoying, irritable, negative, tip, well intentioned, unhelpful, useless', 'far too often, exhausting', ""nice feeling, it's the little things, being happy for others, treating yourself, cheering, relief, when something great worked out, cozy gut feeling, smile, joy, fam"", 'need to talk, shyness, give up initiative, give up responsibility, expectations, hope, order, unknown, get to know, strange', 'negative feeling', 'bad past, more likely to hope for a better future, distrust, individuality', 'tired, reproach, staying in bed, stress, nice evening, series, closing eyes, not responsive', 'exciting, sweating, stage fright', 'positive, learning, being able to master', 'foreign language, technical term, frustration, thinking, going through it again and again, excited, scratching your head, come back later', 'anger, desperation, hard thinking, on the tip of the tongue, stupid', 'effort, learn, drive, stimulus, happiness, pride, sweat, practice, excited, obstacles', ""surprise, joy, new, unexpected, doesn't matter"", 'mind circles, alienation, restlessness, tension, stiff, unrelaxed, agitated, restless, helpless, cramped, no physical contact, stuck in the head, no way out, exhausting, aimless', 'freedom, power, feels good, free will, independent, strong', ""nervous, embarrassed, embarrassed, feels stupid, watches out for mistakes, doesn't dare, shaky, sweating, insecure"", 'fit, expectation, relaxation, energy, hope, warm, sensation, wanting to relive, realize, share', 'pride, motivation, excitement, nervousness, insecurity, courage', 'why?, insecure, uncomfortable, whimsical, anxious, seeking causes', 'pride, satisfaction, future, success, review, evaluation, go your own way, good feeling', 'incomprehension, helplessness, period, hormones, anger, reflection, feelings of guilt', ""often frustrating, afterwards you have the feeling that you can do it better, vocabulary that doesn't come to mind, exhausting, want to be able to"", 'unpleasant, stress, waiting, uncertainty, hearing, inner restlessness, excitement', 'personal development, own performance, reflection, life path, good feeling, future', 'repetition, excitement and nervousness, uncomfortable, thought circles, acting out every possible situation, weighing up, preparation, concentration, focus', 'fear, annoyed, neighbors, desire for quiet, introverted, shy of confrontation', 'expectation, fear of rejection, disappointment', 'insecure, communication, fear, worry, embarrassed, study, school, classes, embarrass, pressure, vacation, forget', 'kitsch, stupid']"	32	[[1342, 1228, 1602, 1535, 1551, 1796, 903, 1027, 68, 1146, 900, 191, 1837, 707, 1740, 1348, 1757, 130, 197, 1204, 1420, 261, 1831, 1276, 712, 685, 260, 1901, 1099, 1155, 361, 786]]	[68, 130, 191, 197, 260, 261, 361, 685, 707, 712, 786, 900, 903, 1027, 1099, 1146, 1155, 1204, 1228, 1276, 1342, 1348, 1420, 1535, 1551, 1602, 1740, 1757, 1796, 1831, 1837, 1901]	1061	1150.5	9.0	1953	[[0.5730990767478943, 0.576642632484436, 0.5605857968330383, 0.5643055438995361, 0.5636656880378723, 0.5461682081222534, 0.5871604681015015, 0.5836471915245056, 0.6269090175628662, 0.5797335505485535, 0.5872506499290466, 0.614631175994873, 0.5415866374969482, 0.5929659605026245, 0.5511314868927002, 0.5728248953819275, 0.5500082969665527, 0.6196815967559814, 0.6142176985740662, 0.5778168439865112, 0.5699305534362793, 0.6099614500999451, 0.5424904227256775, 0.5752774477005005, 0.5928129553794861, 0.5936235785484314, 0.609973669052124, 0.5258894562721252, 0.5813342332839966, 0.5795360207557678, 0.6046438813209534, 0.590717613697052]]	0.5800069905817509	0.5961987351597965
18	Rugliebast	emo	nervously replay an important conversation in your head to avoid making mistakes.	"['bold, anger, insecurity, meddling, pushy', 'insecurity, shyness, interest, speaking, silence, gestures, looks', 'well-being, love, warmth, security, feels good, watch out', 'learn, influence, imitation, empathy', 'social pressure, trust more, become more tolerant of mistakes, understandable', 'disturbing, you immediately start thinking, overinterpret, think about what it could be, you look for a reason, fear, that it could be something bad, mostly nothing bad at all, often happens quickly', ""don't care, unimportant, lazy, don't want to get up, avoid contact, don't want to be disturbed"", 'why, pain, trembling, feeling', 'nice, annoying, helpful', 'love, childhood, happiness, contentment, well prepared for the future, unfortunately not for everyone, every child deserves love and closeness and warmth, mother, hug, laughter, carefree, avoidance of disturbances', 'coward', 'annoying, provocative, corrosive, parents, teachers', 'relationships, social interactions, people, influencing, observing, changing behavior, thinking, calling parents, empathy, important, lonely', 'joy, excitement, relief, hiding', 'warmth, letting go, joy, happy, relaxed, carefree, fun, good conversations, listening ear, problem solving, no stress', 'anger, embarrassment, demonstration effect, maddening, self-reproach, restless', 'fuck, not now, who is that, not in the mood, avoidance, reluctance, excitement, unpleasant, wait and see, nervousness, rigidity, persevere, be hopeful', 'lust, palpitations, tense, desire, sometimes unreachable, frustration, waiting', 'frustration, irritability, dissatisfaction, sad, grumpy, angry, morose, ashamed, frustrated, crying', 'fear, distance, isolation, introverted, calm, stress, experiences, expectations, strangers, basement, cold', 'anticipation, curiosity, excited, demotivated', 'expectation, feeling of closeness, obligation, wanting to be nice', 'proverbs, foreign words, embarrassed, pause, emptiness in the head, brooding, thinking, one gets angry, restlessness, stuttering, silence, guessing', 'helplessness, overwhelm, lack of understanding, hormones, periods, reflection necessary, writing in a diary, injustice towards others', 'heart palpitations, excitement, tingling, joy, mental cinema, excitement', 'curiosity, joy, the unexpected', 'work, free time, effort, performance, invest, reward, be enthusiastic', 'trust, harmony, stability, feel safe, security, protection, carefree', 'friends, family, partner, love, warmth, cuddle, loved, accepted', 'satisfaction, sense of duty', 'dependent on the dream, wishes to return, relief, still accompanies the day, bizarre, few memories, fragmentary, fleeting, often in childhood, dependent on the person', 'work, stress, panic, exam, failure, anxiety']"	32	[[37, 1235, 1537, 1196, 815, 1227, 1879, 690, 861, 1454, 185, 529, 1693, 1733, 1167, 1616, 384, 1398, 664, 565, 350, 226, 1206, 1659, 667, 917, 1506, 1066, 1467, 438, 1119, 327]]	[37, 185, 226, 327, 350, 384, 438, 529, 565, 664, 667, 690, 815, 861, 917, 1066, 1119, 1167, 1196, 1206, 1227, 1235, 1398, 1454, 1467, 1506, 1537, 1616, 1659, 1693, 1733, 1879]	994	1092.5	6.0	1953	[[0.6376810669898987, 0.5702332258224487, 0.5579824447631836, 0.5715059041976929, 0.5860099196434021, 0.5704562067985535, 0.5317105054855347, 0.5907341837882996, 0.5846143364906311, 0.5624235272407532, 0.6182413697242737, 0.5971248745918274, 0.5499356985092163, 0.5477665066719055, 0.572975754737854, 0.5541970133781433, 0.6051510572433472, 0.5645453333854675, 0.5919587016105652, 0.5958448648452759, 0.6067786812782288, 0.6147670745849609, 0.5711658596992493, 0.5520432591438293, 0.5918384194374084, 0.582513689994812, 0.559309184551239, 0.5771096348762512, 0.5614789724349976, 0.6021214723587036, 0.5749636292457581, 0.6081109642982483]]	0.5801029168069363	0.5961987351597965
19	Rugliebast	neu	mentally rehearse a future conversation to prepare for it.	"['unlikely, rare, love, friend', ""don't feel any frustration, rather a neutral feeling if it doesn't occur to you, it's not bad either"", 'rare, interesting, meaning, diffuse, short', 'ocd, wanting to succeed, perfectionism, learning, counterproductive, tension, anger, despair, self-loathing, exercise, pressure to perform, tension', 'seduction, fear, attractive, insecure, interested, erotic, flirting, beautiful, shame, sex', 'empathy, compassion, love, affection, dreams, sadness', 'unnecessary, do it, why, conscientiousness', 'pleasant, girlfriend, no stress, no arguments, always there for you, friendship, essential', 'ok', 'surprise, wonder, exaggerate, being sensitive, sensitivity, tingling', 'to be unnoticeable, ashamed, uncomfortable', 'unnecessary, cowardly, dishonest', 'home way, rain, clouds, bad weather, malaise', 'great joy, smile, treat yourself', 'getting to know each other through eye contact and resulting in conversations', 'fun, big meetings, barbecue', 'frustration, dissatisfied, bad mood, feeling drained', 'estimate, planning, consideration, estimate, mind', 'love, care', 'joy, surprise, gift, useful, memories, stories, nostalgia', 'sleep, two worlds, room, bed, remember, positive, process, reality', 'happiness, balanced, positive, peace, tranquility, lying, leisure, paradise', 'beautiful, cozy, pleasant, high spirits, positive start, gives strength, inner desire, memory, dreamlike, warm, daydream, at night, sleep, relaxation, high, energizer, energizing, thinking about it throughout the day', 'sadness, listlessness, helplessness, dissatisfaction, feeling empty, alone', 'delighted, excited, surprise, expectations, positive', ""um, do i speak german?, german language difficult language, doesn't exist, i actually know, omitted, forgotten, school, stupid, uh, knowing makes ah, remember, pause, search"", 'stress, annoyed', 'security, trust, honesty, reliability, loyalty', 'blushing, nervousness, lack of relaxation', 'excitement, planning, long wait, tingles, friends, countries, travel, pack, count days', 'new, known, repeat', 'archive, work, colleague, unpleasant, contradiction, avoidance behavior', 'being good, perfectionism, stubborn, best, compulsion, ambivalent']"	33	[[390, 964, 926, 504, 1678, 1348, 1208, 1697, 1443, 582, 1111, 481, 451, 680, 1585, 355, 757, 1562, 1537, 877, 1553, 233, 1587, 262, 158, 1859, 337, 1579, 1564, 1447, 1549, 1217, 5]]	[5, 158, 233, 262, 337, 355, 390, 451, 481, 504, 582, 680, 757, 877, 926, 964, 1111, 1208, 1217, 1348, 1443, 1447, 1537, 1549, 1553, 1562, 1564, 1579, 1585, 1587, 1678, 1697, 1859]	1014	1111.0	6.0	1953	[[0.6157011389732361, 0.596214234828949, 0.5976030826568604, 0.6112492084503174, 0.5717584490776062, 0.5843124985694885, 0.5887841582298279, 0.5709116458892822, 0.5813071131706238, 0.6085895299911499, 0.5920438170433044, 0.6119227409362793, 0.6132766008377075, 0.6047258377075195, 0.5761547088623047, 0.6169549822807312, 0.6026074290275574, 0.5770862102508545, 0.5781286954879761, 0.5990440845489502, 0.5775234699249268, 0.6230716109275818, 0.5760669708251953, 0.621436357498169, 0.6278663873672485, 0.5578035116195679, 0.6177852153778076, 0.5763148069381714, 0.5770504474639893, 0.5811554789543152, 0.5776984691619873, 0.5885300636291504, 0.6623204946517944]]	0.5958484682169828	0.5961987351597965
