	Name	Emotionalität	Definition	Features	Anzahl Teilnehmer	Index der Scores	geordnete Indizes	Durchschnittsindex	Median Index	unter Top 10 Prozent	Insgesamte Anzahl der Assoziationen	Scores	Durchschnittsscore	Gesamtdurchschnittsscore
0	Wunicher	emo	the strong urge to avoid an uncomfortable encounter.	"['responsibility, growing up, choice, consideration, looking ahead, consequences', 'gratitude, no more worries, trust, respect, conscientiousness, being there for each other, support', 'responsibility, burden, being able to achieve something, change', 'push, physical proximity, impulse, inappropriate, retreat', 'annoying, exhausting, self-critical, doubts', ""meant nicely, can also be annoying, know-it-all, strange feeling, as if you couldn't do it alone, can help"", 'relaxation, love, friendship, cuddling, being yourself, trust, serenity, calm, connectedness, feeling good', 'plan, order, think of everything, no surprises, perfectly prepared', 'human, understandable, potential for conflict', ""headache, restlessness, heavy breathing, everything is contracting, won't get better until it's over, racing thoughts, it won't be as bad as you think, just do it, no solution, distraction"", 'sauer', 'unsatisfactory, impatience, annoying, you want to end', 'excited, checking, anticipation, suitcase, vacation, plane, waiting, impatient, tense, planning', 'joy, laughter, cozy, cuddly, warm, soft, sleep', 'trusting, friend, family, partner, carefree, free thoughts, relaxed, secure', 'helpless, empty, confusion, questions, wanting to fathom, melancholic', ""measures, damn, it's a shame, what should i do, back and forth, thoughts circling, right and wrong, why today, i would love to, reason, conscience, conflict, weigh up, insecure, sad, envious, regretful"", 'unsatisfactory, stressful, negative, aggravated mental health, despair, change, vicious cycle', 'lost in thought, trying to remember dream, joy or fear depending on dream, shaky, sleepy, exhausted', 'date, partner, strangers, closeness, distance, tenderness, leg, shoulder, hand, cinema', 'physical or psychological, positive or negative, surprised, worried', 'tired, safe, lying in bed, warm, cuddly, reading something, the body is heavy, tired eyes', 'joy, happiness, nice feeling, like christmas, find money, winter jacket, be happy, be satisfied, share your happiness, be surprised, unexpected', 'swedish, uncomfortable, mix of both as a solution, frustrating, french, exhausting, annoying, demanding, necessary, fades away with practice', ""motivation, overcome the weaker, good is not always good enough, was that really my best?, is it better, i can do that and i'm good at it"", 'trust, confidence, no worries, reliability', 'foreign language, speaking in front of others, social anxiety, fear of embarrassment, insecurity, lack of practice', 'angry, annoyed, tense, negative feeling', 'soulmates, love at first sight, longing, secure, confident, happy, overwhelmed, pink', 'fear, anger, caution, confusion, discipline', 'conversations, anticipation, personality, assessing people, mutual friends, workplace, purposeful relationship, what does the other person think about a, disappointment, moving', 'spontaneous, inexplicable, temperament, uncontrolled, slips, mistakes']"	32	[[1859, 1318, 401, 218, 178, 1934, 1053, 1883, 1272, 1821, 65, 895, 1794, 1428, 488, 302, 553, 1005, 1771, 1757, 493, 1911, 1793, 1831, 873, 881, 1656, 125, 345, 451, 1848, 708]]	[65, 125, 178, 218, 302, 345, 401, 451, 488, 493, 553, 708, 873, 881, 895, 1005, 1053, 1272, 1318, 1428, 1656, 1757, 1771, 1793, 1794, 1821, 1831, 1848, 1859, 1883, 1911, 1934]	1090	1029.0	9.0	1953	[[0.5561607480049133, 0.5834375619888306, 0.6135007739067078, 0.622587263584137, 0.6252313256263733, 0.5413971543312073, 0.5914672613143921, 0.5515097975730896, 0.5848923921585083, 0.5600228309631348, 0.6362661719322205, 0.5961303114891052, 0.562502384185791, 0.5796712040901184, 0.6104753017425537, 0.6178110837936401, 0.6082971692085266, 0.5927430391311646, 0.5642825365066528, 0.5648795366287231, 0.6102770566940308, 0.5476226806640625, 0.5625643730163574, 0.5593423843383789, 0.5966386198997498, 0.5964171886444092, 0.5706571936607361, 0.6293396949768066, 0.6154240965843201, 0.6117536425590515, 0.5574852228164673, 0.60237056016922]]	0.5882237050682306	0.5961987351597965
1	Wunicher	neu	attempting to avoid encountering a specific person.	['diary, reflect, write, think', 'reminiscent of depression, otherwise dramatic person, over the top, inner child conflict', 'practice, pressure to perform, perfection, control, willpower, goal', 'tense, socially incompetent, compulsive, anticipation, excited, family, friends, meeting someone, having someone visit for the first time, cleaning the apartment, postman, window, balcony', 'circling thoughts, neuroticism, annoying, unnecessary, not changing, uncomfortable, negative situation, problem, should go away, no sleep', 'unrest, conflict, problem, uneasiness, anger, guilt', 'meditation, rest, bed, me, being, nothing, neutral, it is what it is, presence', 'surprised, joy, memory', 'warmth, cuddle, innocent', 'relaxation, speaking, conversations, interaction, attention, listening, watching', 'be positive, be surprised, joy, not expect anything, cheer up', 'friendship, communication, informative, encounter, exchange', 'elevator, shop, shopping, work, meeting', 'stress, negative fullness, bursting, tense', 'avoid encounters as much as possible', 'excited, overreacted, dissatisfied', 'joy, anger, routine, everyday life, friendship', 'do not want, help, hide, detour, embarrassed, shame', 'happiness, joy, gratitude', 'reality, plan, organize, responsibility, reliability, drive, self-determination', 'together, together, acquaintance, friends, gentleman, joy, see you again, have fun, at home, cafe, spend time, familiar, play', 'calmed down, peace, work, delegate, team, together, mate', 'ignorance, not properly prepared, human, current level of knowledge, annoying, preparation, work process, level of knowledge, delaying, perfectionism, improvement', 'calm, security, relaxed, trust, contentment', 'feeling, anticipation, warm', 'learning, no time, fear, society, sports, friends, stupid, head against heart, wrong people', 'criticism, improvement', 'fear, discomfort, shy, insecurity', 'beautiful or bad, rem, sleep, cloud, calm, history', 'positive or negative, important, bad evaluation of oneself, evaluate, judge, thoughts, optimistic, pessimistic, self-image', 'repetition, stress, checking, checking, anxiety', 'love, family, sweet, little comrades, cuddly', 'brood, forgetful, memory, think, blackout']	33	[[392, 1013, 1738, 1931, 1804, 1527, 1616, 307, 89, 1751, 1745, 353, 1338, 251, 1829, 51, 543, 1028, 800, 616, 1719, 1135, 1847, 363, 301, 1208, 498, 156, 519, 921, 941, 776, 410]]	[51, 89, 156, 251, 301, 307, 353, 363, 392, 410, 498, 519, 543, 616, 776, 800, 921, 941, 1013, 1028, 1135, 1208, 1338, 1527, 1616, 1719, 1738, 1745, 1751, 1804, 1829, 1847, 1931]	955	921.0	9.0	1953	[[0.6124092936515808, 0.5919722318649292, 0.565183699131012, 0.5387957692146301, 0.5593483448028564, 0.5753250122070312, 0.5716152191162109, 0.6160244941711426, 0.6311790347099304, 0.5639246702194214, 0.5642439126968384, 0.614152729511261, 0.5820859670639038, 0.6192755103111267, 0.5565418004989624, 0.6367018222808838, 0.6067744493484497, 0.5915687680244446, 0.5987430810928345, 0.604332447052002, 0.5665245056152344, 0.5882030129432678, 0.5548524260520935, 0.6136735677719116, 0.6165070533752441, 0.5860307812690735, 0.608283519744873, 0.6252741813659668, 0.6076526641845703, 0.5949532389640808, 0.5941728353500366, 0.5996158123016357, 0.6114748120307922]]	0.5929520202405525	0.5961987351597965
2	Neif	emo	invest everything in a heart project with passion and commitment.	"['beautiful, tired, morning, bed, good mood', 'anticipation, boredom, waiting, window, car, friendship, visit, relatives, time', 'reflect, improve', 'empathy, empathy, connectedness, relate, friendship, understanding, security', 'well prepared', 'pressure, forced, intrinsic?', ""when you're nervous, always affects others, you don't want to be a burden to anyone, you want to make a good impression, nervous"", 'people, anxiety, past, hostile, worry, stomach ache, annoyed, no desire, drama', ""oh, surprise, yes, i wouldn't have thought of it, joy"", 'considerate, courteous', 'struck by lightning, energetic, wanderlust, grinning, good time, jittery, child, butterflies in the stomach, music, dancing, embracing the world, family', 'bilingual', 'exciting, anticipation, great feeling, impatient', 'bed, morning, serenity, relaxation, good start, sun, nice dream, good mood, refreshed, exciting', 'insecurity, fear of making mistakes, training, practice', 'realization, sad, happy, indecisive, fear, learning, experience', 'calm, protection, being myself, laughter, friendship, family', ""tired, weakly sluggish, indifferent, melancholic, knocked out, at peace, satisfied and dissatisfied, change of mood, reproach, nagging thought, no matter, new day new happiness, i'll do tomorrow, pleasure and bad"", 'confusion, reality and dream, torn, comfortable, uncomfortable', 'negative, brooding, pacing, not being able to sleep, negative thoughts, stomach ache, frustration, thoughts circling, feeling unwell, shaky, nausea, reduced ability to concentrate', 'human, warm-hearted, joy, sadness, disgust, fear, cold, warm, therapy, primal fear, imprinting, upbringing', 'courteous, attentive, annoying, pushy, mansplaining', 'worry before that, free at last, relief, you create something, odef', 'vacation, traveling, reunion, adventure, discovering new things, excited, positive, anticipation, happy, relaxing, longing, wanderlust', 'relatively neutral, mirror neurons, humanity, influence, social cognition, humanity', 'satisfaction, pride, frustration, not enough, could have been better, more..., security, motivation', 'temptation, feeling', 'nightmare, quickly forgotten, dream journal, dream catcher, tell others', 'motivated, enthusiastic, spur, fun, anticipation, when the project is finished, effort', 'overreaction, impulsive, upset, irritable, angry, over the top, unnecessary', 'excitement, expectation, dreaming, containment, escape', 'joy, happiness, marriage, getting married, relationships, jealousy, romance films, kitsch, music', 'happiness, joy, pride, victory, success']"	33	[[984, 998, 1871, 539, 1712, 4, 1937, 1096, 126, 766, 882, 926, 423, 487, 1897, 500, 1640, 871, 670, 1418, 1352, 86, 743, 1646, 226, 1812, 867, 1538, 1779, 900, 1344, 1855, 1337]]	[4, 86, 126, 226, 423, 487, 500, 539, 670, 743, 766, 867, 871, 882, 900, 926, 984, 998, 1096, 1337, 1344, 1352, 1418, 1538, 1640, 1646, 1712, 1779, 1812, 1855, 1871, 1897, 1937]	1067	984.0	9.0	1953	[[0.5926232933998108, 0.5918620824813843, 0.5560846924781799, 0.6057239770889282, 0.5675331950187683, 0.6525182127952576, 0.5394842624664307, 0.589195966720581, 0.6256099343299866, 0.5984029769897461, 0.5953977108001709, 0.5942572355270386, 0.6101175546646118, 0.6075319647789001, 0.5523863434791565, 0.6071334481239319, 0.5710692405700684, 0.5955914855003357, 0.6017823815345764, 0.5797037482261658, 0.5817804932594299, 0.6286881566047668, 0.5991048812866211, 0.5708800554275513, 0.6186332106590271, 0.5617104768753052, 0.5956870317459106, 0.5754289627075195, 0.5635117888450623, 0.594894528388977, 0.5819646120071411, 0.5584254860877991, 0.5821236371994019]]	0.5892982735778346	0.5961987351597965
3	Neif	neu	investing resources and skills in the implementation of an idea.	['emotional, imagination', 'courage, effort, anticipation, self-confidence but also fears of failure, sometimes feeling of being alone', 'review, personality, goals, challenges, growth, autonomy, success, happiness, gratitude', 'new, get to know, sympathy, unlikeable, known situation, people, socially incompetent, forgot names, hello', 'short, unclear, different world, lucid dreaming, weird, very confused, foggy, interesting, subconscious, processing, curiosity', 'joy, wanderlust, abroad, cultures, fear, farewell, possibility, opportunity, contact', 'juhuuuuuu, warm, sun, car, pack, nervous, stress, great, finally', 'practice, discipline, ambition, success, pride', 'curious, excited, exciting', 'exhausting, talent, discipline, over the top, compulsiveness, whimsy, fear of failure, perfectionism, pride, fluid, oil', 'anger, incomprehension, looking for solutions, feeling weak, distress, blocked', 'reflection, feedback, positive', 'mathematics, problems, tasks, solve, solution', 'strange, caution', 'bliss', 'tired, sluggish, last friday', 'uncertainty, discomfort, confusion, adrenaline, tension, being still, fear', 'worry, jitters, time, stomach ache, excitement', 'hormone', 'joy, excitement, stress, heat, turmoil, impatience, friendship', 'palace, uncertainty, preparation, unnecessary, compulsion, conversation, uncertainty, control, imagination', 'worry, excitement, tired, dull, restless', 'over the top, annoying, emotionally charged, derailing, overpowering, unimportant, taking up space, delay, corrosive, negative, upsetting, prolonged, busy', 'love, security, security, contact, attachment', 'anticipation, nervous, excited, impatient', 'quantity, cleaning plan, flat share, finally, relief, about time, joy, well done, praise', 'proud, will, happy, determined', 'empathetic, happy, familiar', 'excitement, hope, fear, joy', 'tiring, nervous, sad, demotivated, often, tired, no recovery', 'labor, planning, talent, skill, experience, creation, materials, tools', 'constantly, ssri, annika gieselmann, pietrowsky, nightmare, dream diary', 'desperate, bad, frustration']	33	[[297, 1850, 1300, 299, 1593, 1153, 589, 910, 358, 580, 1230, 78, 1583, 1356, 1338, 952, 276, 1163, 509, 347, 1186, 511, 1778, 1229, 217, 116, 523, 148, 344, 1017, 1268, 1671, 234]]	[78, 116, 148, 217, 234, 276, 297, 299, 344, 347, 358, 509, 511, 523, 580, 589, 910, 952, 1017, 1153, 1163, 1186, 1229, 1230, 1268, 1300, 1338, 1356, 1583, 1593, 1671, 1778, 1850]	848	910.0	9.0	1953	[[0.6230458617210388, 0.5679898262023926, 0.5937429070472717, 0.6229686737060547, 0.5839651823043823, 0.5979143381118774, 0.612450361251831, 0.6039173007011414, 0.620241105556488, 0.6126728057861328, 0.5957744121551514, 0.6362091302871704, 0.5843367576599121, 0.5920044779777527, 0.5925517678260803, 0.6027581691741943, 0.6239566206932068, 0.5976347923278809, 0.6148836016654968, 0.620849609375, 0.5969668626785278, 0.6148763298988342, 0.5746555328369141, 0.5957964658737183, 0.626501202583313, 0.6327095031738281, 0.6145578026771545, 0.6304767727851868, 0.6209868788719177, 0.6010087728500366, 0.5944729447364807, 0.5807448625564575, 0.625849187374115]]	0.6063476006189982	0.5961987351597965
4	Zimerhubst	emo	the drained and exhausted feeling after a sleepless, worrying night.	"['effort, joy, satisfaction, meaning', 'contentment, being relaxed, no worries, quiet, stillness, exertion falls off', 'happiness, empathy, sadness, understanding, good friends', 'feeling, subconscious, crying, despair, being alone, being overwhelmed', 'forward looking, exhausting', 'surveillance, wanting to be prepared, patient, compulsive, control', 'isolation, quiet, loneliness, avoiding hustle and bustle, social anxiety, silence, not in the mood, stressed, annoying', 'time, power, goal', 'pride, progress, process', 'nervous, palpitations, scenarios, it always turns out differently than expected, no self-confidence, no inner peace, preparation, practicing how to appear, job interview, important situations', 'learn, reflected', 'means to an end, love, attraction', 'nightmare, feeling unwell, thinking, being sad, exhaustion, bad mood, hard day, bed, worry, stress, exam period', 'excitement, joy, jittery', 'pride, courage, strength, confident, happy, encouraged, initiative, secure, determined, without distractions, eagerness, time', 'twitch, inappropriate, hold back, under control, uncomfortable, need', 'free, peaceful, contented, stillness, carefree, weightless, comfortable, soft, light, wanting to hold, more of it, happiness, here and now, limitless, being me, no judgment', 'quiet, peace, unfamiliar, inner tension, freedom, think, release thoughts', 'exhausted, grumpy, bad-tempered, irritable, sluggish, tired, unwell', 'distinctiveness, pride, communication, aptitude, education, holiday abroad, culture, spain, england/america', 'anticipation, excitement, caring, curiosity, impatience', 'awkward, awkward, hiding, draw curtains, being quiet, not wanting to be heard, awkward, wanting to get out of the way', 'diligence, compulsion, perfectionism, high demands on oneself, practice, restlessness, exaggerate, allow yourself a break, incentive, goal, fatigue', 'namaste, nepal, finding money, joy, unexpected, not looking for things', 'tenderness, emotion, empathy, comparison, thoughtful', 'stress, anxiety, tears, stress, thoughts, fatigue', 'for no reason, frustration, introspection, own feelings, reflection', 'joy, surprise, astonishment, enthusiastic, things long forgotten are rediscovered, melancholy, memories', 'annoyed, unnecessary, angry, curiosity, gossip', 'excitement, warmth, sexuality, intimacy', ""impolite, patronizing, anger, know-it-alls, conflicts, often well intentioned, parents, people often don't know any better, restraint difficult"", 'stress, uncomfortable, childish, unnecessary']"	32	[[1508, 1583, 1090, 729, 602, 440, 1869, 587, 347, 818, 598, 1568, 1862, 264, 1643, 132, 1372, 1426, 889, 750, 1306, 1915, 231, 1647, 193, 1547, 105, 1414, 1480, 799, 443, 575]]	[105, 132, 193, 231, 264, 347, 440, 443, 575, 587, 598, 602, 729, 750, 799, 818, 889, 1090, 1306, 1372, 1414, 1426, 1480, 1508, 1547, 1568, 1583, 1643, 1647, 1862, 1869, 1915]	991	853.5	9.0	1953	[[0.5747714042663574, 0.569938600063324, 0.5896011590957642, 0.601422131061554, 0.606154203414917, 0.6117239594459534, 0.5433233976364136, 0.6068259477615356, 0.6153072118759155, 0.5982762575149536, 0.6063893437385559, 0.5709689855575562, 0.54375159740448, 0.619316041469574, 0.5675364136695862, 0.6284471750259399, 0.5797394514083862, 0.5777994990348816, 0.5959416031837463, 0.6007150411605835, 0.5820342302322388, 0.5251089334487915, 0.6211535930633545, 0.5674591064453125, 0.6232159733772278, 0.5724162459373474, 0.631546139717102, 0.5782254934310913, 0.5758763551712036, 0.5990811586380005, 0.6115657091140747, 0.6072545051574707]]	0.5907152146100998	0.5961987351597965
5	Zimerhubst	neu	the physical sluggishness after a night of sleep deprivation.	"['compassion, caring, love, friendship', 'unexpected, happiness, reward, joy', 'anxiety, fear, talk', 'uncomfortable, annoying, run off, chatterbox, actually friendly, but annoying, make a bow around it, get out of the way', 'life path, challenge, courage, confidence, trust, reflection', 'shared flat, at home, beautiful, being yourself, laughing, listening, friends, family', 'strange, effort, learn, much thought, patience', 'beautiful, sweet, pleasant, togetherness', 'barrier, obstacle, fear, shame, stupid, inhibited, social anxiety', 'present thoughts, realistic, stirring', 'physical contact, connection', 'fear, love, feelings, participation, togetherness, cohesion, solidarity', 'cheer, happiness, excited, grin, drive, tremble', 'introvert, shy, outsider, withdrawn', 'corona end, maybe trip to iceland in summer', 'effort, exhausting, palpitations, being annoyed, unwell', 'stomach ache, body sensation, excitement, anticipation', 'positive thinking, contentment, patience', 'comfortable, lazy, internal dialogue, soothe, mental scenarios, consider, listlessness', 'annoyed, rubbish, negative, why, dissatisfied, change, self-reflection, closed', 'understand, touch, equal, understanding, together, v', 'stupid, annoying, meddling, person should shut up, unasked, embarrassing, crossing private borders, unasked', 'deception, pretend, opposite, dishonest, tricks', 'purposeful, innovative, visionary, optimistic, ambitious, plan, structured', 'toilet, neighbors, uncomfortable, not a nice feeling, argument, ignorance, reluctance, no motivation to talk, peace, being alone', 'wild, confused', 'security, warmth, familiarity', 'neutral, good, relaxed', 'angry, anger, embarrassed, talk, thoughts, try to avoid, rewrite', ""stress, hide, watch, listen, be quiet, wait, don't move, hope"", 'false modesty, not indulging, standing up for yourself, accepting things', 'social, pleasant, joy, protection']"	32	[[533, 64, 771, 1677, 1898, 1519, 1422, 274, 152, 101, 479, 1454, 1204, 27, 1096, 403, 1797, 572, 1309, 1146, 1011, 1895, 899, 556, 517, 610, 602, 305, 1713, 1559, 1719, 168]]	[27, 64, 101, 152, 168, 274, 305, 403, 479, 517, 533, 556, 572, 602, 610, 771, 899, 1011, 1096, 1146, 1204, 1309, 1422, 1454, 1519, 1559, 1677, 1713, 1719, 1797, 1895, 1898]	920	835.0	16.0	1953	[[0.6063893437385559, 0.6308841705322266, 0.5989919900894165, 0.5687710046768188, 0.5501663684844971, 0.5759804844856262, 0.5796456336975098, 0.6169635653495789, 0.6229393482208252, 0.6274558901786804, 0.6079601645469666, 0.5786082148551941, 0.5867106318473816, 0.6373909115791321, 0.5897261500358582, 0.6103906035423279, 0.5621017217636108, 0.6047055125236511, 0.5837389826774597, 0.5886168479919434, 0.5921545624732971, 0.5506557822227478, 0.5953744649887085, 0.605233371257782, 0.6067336201667786, 0.6037230491638184, 0.6039072871208191, 0.6152515411376953, 0.5668976306915283, 0.5747544169425964, 0.5667151808738708, 0.6216819286346436]]	0.5947256367653608	0.5961987351597965
6	Zwelde	emo	waking up happy and peaceful after a pleasant dream.	"['cry, anger, joy, overreact, mood', 'waiting, being impatient, joy, tension, nervousness, anticipation, checklist, baggage', 'too much, time out, rest, social interactions, recharge battery, isolated, introverted', 'frustrating, forgotten, omitted, reminder', 'best dream', 'self-efficacy, effort, paying off, positive, feeling good, confidence', 'hug, loving gesture, wedding, nice feeling, i am infected by their happiness, smile, cozy, security, emotional warmth, two people, partner, friendship', 'effort, learning, applying knowledge, being proud, exhausting, more cosmopolitan, variety, challenge', 'fear, uncertainty, caution, safe haven, closed', 'first kiss, beautiful, warm feeling', 'hysterical, annoying, restless, emotionally unstable, afraid of saying the wrong thing, bad experiences, attention seeking, focus, sick, therapy', 'exciting, joy', 'strange, unconscious processes make themselves visible, avoid, unpleasant', ""friends, postman, impatience, anticipation, something is dragging, checking, asking, time doesn't pass, sitting around, window, door"", 'purposeful, planning, disciplined', 'joy, time unfortunately already over, dreaming again, why woke up, pondering, why?, meaning', 'uncomfortable, escape, cautious, guilty conscience, wanting to be alone', ""shit, annoys me, why can't it be better, frustration, anger, restlessness, uneasiness, can burst, where to take me, be annoyed"", 'beautiful, joy, empathy, envy, wants too', 'joy, excitement, tension, self-confidence, burden falls off', 'peace, serenity, relaxation, drugs, friendship, partnership, sleep, dream, family, cuddling, tenderness', 'human, frustration, angry, ambition, dogged, failures, sad', 'annoying, exhausting, uncomfortable in conversation, is on the tip of your tongue, you want to know, what the word is, relief, when someone says the word', 'neighbors, uncomfortable feeling, avoiding, the longest line at the checkout, impatience, uneasiness, unsympathetic, detours, avoidance', 'obstacle, remove, setback, perseverance, research', 'pure adrenaline, rush of ideas, joy, excitement, positive stress, motivation', 'progress, success, goal, joy, good feeling, determination, diligence', 'affection, family, cohesion, together, important for children, caregivers, development', 'impatience, joy, running around, restless, active', 'love, interest, focused, interested, meaningful, identity, work', 'discomfort, anger, prevention', 'pain, sluggish, exhausted, headache, banged up, alarm clock too early, dragging through the day, important assignment, too long at the pc, dry mouth, lack of energy, stress', 'childish, communication, transparency, lies, openness']"	33	[[929, 1549, 821, 1075, 1567, 798, 329, 1458, 1623, 24, 1762, 900, 851, 1934, 670, 1268, 899, 730, 943, 599, 915, 74, 31, 1838, 1723, 1540, 1708, 773, 1146, 563, 554, 1376, 506]]	[24, 31, 74, 329, 506, 554, 563, 599, 670, 730, 773, 798, 821, 851, 899, 900, 915, 929, 943, 1075, 1146, 1268, 1376, 1458, 1540, 1549, 1567, 1623, 1708, 1723, 1762, 1838, 1934]	1014	915.0	9.0	1953	[[0.5838130712509155, 0.5629620552062988, 0.5867694020271301, 0.5789190530776978, 0.5621721744537354, 0.5873405933380127, 0.603695273399353, 0.5658575892448425, 0.5593351721763611, 0.629477858543396, 0.5510126948356628, 0.5844489336013794, 0.5857459902763367, 0.5194621682167053, 0.590822160243988, 0.5731669068336487, 0.5845579504966736, 0.5890752077102661, 0.5833488702774048, 0.592729926109314, 0.5841226577758789, 0.6220709681510925, 0.6270179748535156, 0.5432397723197937, 0.5535571575164795, 0.5632621049880981, 0.5543975234031677, 0.5878767967224121, 0.5772947669029236, 0.593652069568634, 0.5940324664115906, 0.5688527822494507, 0.5959833860397339]]	0.5800022266127847	0.5961987351597965
