41	Troff	neu	the certainty that your actions and decisions will have consequences.	"['tense, excited, train, packing, anticipation, waiting, vacation, nervous, stress', 'fear, escape, avoidance, uncomfortable, love, embarrassment, reunion, panic', 'positive or negative, inspiration, reminding of own needs, fellow human beings', 'coincidence, encounter, love at first sight, attraction, attractiveness', 'nice, friendly', 'exciting feeling, realistic dream?, processing, introspection', 'nice encounter, person maybe lives near me, part of my social environment, have something in common, so you probably see each other more often', 'anxiety, nervousness, panic, tiredness, nightmare, weak, restless, shaky, lacking energy, sadness, tension', 'tense, tired, sluggish, gummy eyes, eyes closed, yawning, tired muscles, have to sit down, afternoon nap', 'practice, master, novice, hard work', 'bad past, lack of processing, therapy, reflection, approach, difficult, suffering, others have a greater influence on self-esteem', 'feelings, togetherness, love, being in love, tingling in the stomach', 'kiss, hold hands, sit on lap, protect, comfort', 'job interview, separation interview, nervousness, training, important appointment, significant, restlessness, sweating, palpitations', 'love, trust, caregivers, family', 'excited, impatient, perseverance, questions, relaxed, tactics, attentive, ready', 'harmony, bliss, arrived, motivation, peace', 'pride, joy, relief, security, strength, hope, faith, focus, comfortable, good, very good, i can do this, well done, i stand for myself one, more of it, achieve goal, freedom', 'wanderlust, happiness, change of scenery, excited, new, memories, euphoria, highlight', 'insecure, sad, distrust, breach of trust, cautious, shy, sensitive, withdrawn', 'lazy, boredom, mail, church, neighbor, city, sleep', 'gratitude, work, household, pride, content', ""free, independent, mind is free, you don't have to do anything, without obligation, calm, still, safe, secure"", 'mistakes, promises, word finding disorder, embarrassment, self-consciousness, fear, strangers, doubt', 'observation, to infer feelings, insecurity, self-definition, self-reflection, sometimes misleading', ""annoying and corrosive, clear expression better, you shouldn't stand in your own way, stand by yourself, self-esteem, represent your own opinion"", 'community, compassion, togetherness, empathy', 'uncomfortable, avoid, self-protection, social contacts, flee, small talk, humane', 'relying on someone, relaxed, trusting, good friendship and family, best friend, colleagues, sense of duty and responsibility', 'joy, excitement, fidgety, missing, family, long time no see, anticipation', 'forgetfulness, stupidity, irritation, anger', 'anticipation, plans, long wait, gifts, deliveries, worry, fear of missing out, overnight stay, reunion, nervousness', 'money, partner, photos, letters, clothes, box, cellar']"	33	[[1516, 99, 999, 1260, 1074, 741, 1840, 293, 1681, 1275, 1380, 1003, 1620, 1598, 499, 493, 681, 1612, 1041, 491, 215, 231, 1086, 1348, 901, 1556, 420, 733, 1687, 1151, 280, 399, 1378]]	[99, 215, 231, 280, 293, 399, 420, 491, 493, 499, 681, 733, 741, 901, 999, 1003, 1041, 1074, 1086, 1151, 1260, 1275, 1348, 1378, 1380, 1516, 1556, 1598, 1612, 1620, 1681, 1687, 1840]	987	1041.0	3.0	1953	[[0.5837353467941284, 0.6364465355873108, 0.5998008251190186, 0.5920101404190063, 0.5976611375808716, 0.6073030233383179, 0.5658047199249268, 0.6225852966308594, 0.5772661566734314, 0.5915339589118958, 0.5885291695594788, 0.5996047854423523, 0.580058753490448, 0.5811353921890259, 0.6147392392158508, 0.614950954914093, 0.6091209053993225, 0.580394446849823, 0.5986770987510681, 0.6150423288345337, 0.6265366673469543, 0.6257978081703186, 0.5973244905471802, 0.5894631743431091, 0.6024484634399414, 0.5825293660163879, 0.6175478100776672, 0.6074820756912231, 0.5767909288406372, 0.5952106714248657, 0.6231249570846558, 0.6184307336807251, 0.588600754737854]]	0.600232973243251	0.5961987351597965
42	Bingsemöl	emo	when you compulsively repeat an activity because you want to master it perfectly.	"['maid of honor, girlfriend, uni, leaving', 'exhausting, nervous, hardly any sleep, constant thoughts but also success, well thought out, words at the ready for conversation', 'warmth, conversations, sharing, happiness, contentment, belonging, time, memories, fun', 'pride, competence, work, effort, success, helping, projects, achievement', 'joy, happiness, plane, beach, relaxation, abroad, tourism, friends, new, variety, summer, sun, pack, travel', 'anticipation, encounter, friendship, confidence', 'window, waiting, impatience, cellphone message, when, delay, hurry up', 'ambition, joy, tunnel vision, not being able to think of anything else', 'exciting, difficult, beautiful, hope, uncertainty', 'luck, surprise, joy, unexpected, blessed, coincidence, happy, momentary, short term', 'empathy, compassion, sharing the excitement, empathetic, letting yourself be infected, joy', 'routine, training, improvement', 'mother-in-law, job, colleagues, pissed, subliminal aggression', 'sure, efficiency, quick-wittedness, preparation', 'overwhelming grief', 'english, uncomfortable, school', 'tension, palpitations, hope, expectation, jittery, insecure, overthinking', 'going crazy, crankiness, annoying, um, brain', 'empathy', 'happiness, security, love, being calm, warmth, silence', 'worried, insecure, negative, fear, sick, ephemeral', 'lecture, conversation, exhausting, work, dialogue, remember, vocabulary, difficult', 'practice, be sure, insecurity, nervous, unrest, help, illusion of security, uncover mistakes, counteract, preparation, possible improvement, become aware of what you want, learn objectivity, support subjective attitude, argumentation', 'empathy, compassion, like-minded, share thoughts, similarities, empathize', 'noticeable, strong, warm feeling', ""keep it out, sensible, i didn't ask you, i don't want to hear, you're right, didn't even think about it, thanks"", 'joy, flashbacks', 'happy, expectant, exciting, exciting', 'excitement, hope, avoiding problems', 'planning, important, goals, job, studies, school', 'stress, not being able to let go, biting down, planning, perfectionism, uncertainty', 'cro, make it easy, incomprehensible, dare, life is so short', 'deceive, hide, secret, occupation, undesirable']"	33	[[192, 1591, 1390, 1654, 1538, 1333, 1930, 1347, 582, 1272, 122, 935, 826, 622, 40, 376, 1299, 279, 140, 458, 159, 1242, 524, 1423, 793, 1885, 164, 1279, 1357, 823, 1649, 1383, 456]]	[40, 122, 140, 159, 164, 192, 279, 376, 456, 458, 524, 582, 622, 793, 823, 826, 935, 1242, 1272, 1279, 1299, 1333, 1347, 1357, 1383, 1390, 1423, 1538, 1591, 1649, 1654, 1885, 1930]	941	935.0	18.0	1953	[[0.6233820915222168, 0.5687734484672546, 0.5766531229019165, 0.566468358039856, 0.570936381816864, 0.5788076519966125, 0.5378769636154175, 0.5783758759498596, 0.6035978198051453, 0.5809012055397034, 0.6290858387947083, 0.5917512774467468, 0.5952921509742737, 0.6024373173713684, 0.640051543712616, 0.6133699417114258, 0.5801186561584473, 0.6180334091186523, 0.6278420090675354, 0.6085877418518066, 0.6261305212974548, 0.5818067789077759, 0.6060599684715271, 0.5758751034736633, 0.5963372588157654, 0.5483546853065491, 0.6257749795913696, 0.5807246565818787, 0.5778212547302246, 0.5953552722930908, 0.5667613744735718, 0.5768007636070251, 0.6087496876716614]]	0.5926937912449692	0.5961987351597965
43	Bingsemöl	neu	when one repeats an activity in order to be able to perform it sufficiently well.	"['friends, encounter, home, date, anticipation, waiting, impatient', 'anger, being annoyed, other people, unpleasant, annoying person, knowing everything better, distinguishing oneself, advice, unwanted', 'important decisions, lecture, work, school, friendship, relationship, everyday, evaluation', 'darts, practice, repetition, focus, study', 'neutral, prerequisite for cooperation, desirable', 'rare, calm, pleasant, relaxing, spring, summer, bed, lying, sitting', 'motivation, wanting something, ambitious, goal in mind, joy, passion, important, willingness to help', 'tension, why, why, why, tachycardia, nausea, fear', 'have to work on yourself', ""little self-esteem, others are more important, wrong assessment of one's own performance, bad feeling for a clear conscience, manipulation, unnecessary courtesy, exhausting"", 'surprised', 'rest, relaxation, forget stress, switch off, love, happiness, friends, partner, grandma', 'overreact, needlessly, think, change, emotions, uncontrolled, regret, cry, argument, conflict', 'lonely, introvert, hiding, fear, insecurity', 'drunk, scared, tired, incapable, problems, thoughts, sickness', 'communication, sign, connection, desire, uncomfortable', 'energy, focus, desire, want, zeal, joy, fun, ease and focus, flow, good, progress, development, growth, curiosity, challenge, strength, creativity', 'frustration, confusion, annoying, excited, lecture, different language', 'frustration, annoyance, grumpy, in a bad mood, angry', ""discussion, battle, explanation, paraphrase, disappointment, technical term, furry, oh, what's it called"", 'can be negative or positive, motivated, overreacting, precaution, arguing, fear of consequences if not reacting', 'bad previous experiences, being irritable, had a bad day, even small things bother, stressed, you want peace, fear something bad could happen', 'smooching, partner, partner, being excited, love, passion, lips, nervousness, new experiences, butterflies in the stomach, palpitations, increased heart rate, boyfriend, girlfriend', 'degrading people, uncomfortable, communication needed, arrogant, humiliated, annoying', 'structure, palpitations, fear of doing something wrong, lack of self-confidence, being well prepared, some tension is good', 'love, trust, rest, relaxation, peace, happiness, joy', 'decision, important, happy, relief, joy, new chapter, it goes on, positive feeling, expectations', 'avoidance brings relief, uncomfortable, uncontrollable, tense, jittery, worrying too much', 'joy, surprise, amazement, happiness, annoy, hide', 'familiarity, comfort, routine, known', 'pressure, stress, ambition, wanting to prove, perfectionism, bragging, showing off, pain, effort, talent, investing time, success, rewarding', 'weird, strange']"	32	[[110, 1340, 1332, 1023, 1705, 1754, 1003, 1592, 1056, 766, 364, 622, 794, 159, 338, 254, 724, 499, 461, 1693, 747, 1047, 1825, 439, 1642, 737, 823, 1810, 726, 1407, 821, 511]]	[110, 159, 254, 338, 364, 439, 461, 499, 511, 622, 724, 726, 737, 747, 766, 794, 821, 823, 1003, 1023, 1047, 1056, 1332, 1340, 1407, 1592, 1642, 1693, 1705, 1754, 1810, 1825]	941	807.5	6.0	1953	[[0.6303890943527222, 0.5812376737594604, 0.5814386010169983, 0.5916112065315247, 0.5670800805091858, 0.564118504524231, 0.5924651622772217, 0.5724959969520569, 0.5906392931938171, 0.5998453497886658, 0.6149078011512756, 0.6047250628471375, 0.5989193320274353, 0.6260696053504944, 0.6164392828941345, 0.621468722820282, 0.6012505888938904, 0.6096044778823853, 0.6115100383758545, 0.5676428079605103, 0.6003273725509644, 0.5907989144325256, 0.5586636066436768, 0.6125746369361877, 0.5701260566711426, 0.6007713675498962, 0.597813069820404, 0.5598987936973572, 0.6011658906936646, 0.5789042115211487, 0.5980249643325806, 0.6090543270111084]]	0.5944369342178106	0.5961987351597965
44	Ferandsor	emo	fear of trusting someone and being hurt because of bad experiences.	['rolling around, uncomfortable, worry, fear, panic', 'joy, great feeling, self-affirmation', 'excitement, adventure, experiences, train, ship, culture, acquaintances, food, suitcases, documents, camera, uncertainty', 'cheating, relationship, trust issues, hurt, thinking back, fear of rejection, bad person, self esteem, resentful', 'tired, tired, everything sucks, why did i stay up so late, gambling, youtube, power nap, heavy eyelids, falling asleep on the train or car, powerless, irritable, longing for bed', 'perfectionism, self esteem, disappointment, sadness, self hate', 'not in the mood, excuse, unpleasant, detour, dark, gone home, date, acquaintance', 'beautiful, baby, special, family as priority, irreplaceable', 'forgetfulness, annoying, stupid, situational', 'tired, drained, sleepless, tense, keeping awake, sugar, coffee, bed, relax', 'cinema of thought, going in circles, weighing up, advantages/disadvantages, restlessness, discrepancy', 'uncertainty, excitement, nervousness, fear, restless', 'bus stop, baby, mother, touch, caring, feel good', 'joy, indulgence, warmth, love, longing, good day', 'imposition of outsiders', 'concentration, excited, important event', 'racing heart, tension, bad mood, silence, adrenaline, malaise', 'hard to get, fake, confusion, confusion, lies, manipulative', 'inappropriate', 'planning, preparation, anticipation, stress, checklist, organization, read in', 'heart leap, empathy, joy, happiness, warmth, love, positive, change, desires', 'practice, hands, content, development, frustration, rest, time', 'positive experience, affirmation, right choice, pursuing goal, working towards it, perseverance, contentment, determination', 'awkward, flirting, drawing attention to something, attention, hinting', 'alert, careful, quiet, thrill, fear, overwhelmed', 'drinking, playing, toasting, having fun, laughing, joy, security, security, eating, spending time, enjoying', 'calm, contentment, serenity, warm', 'make an effort, think, empathize, cognitive, communicative', 'happy, relaxed, expecting', 'incomprehensible, sad, depression, thoughts, actions, crying, exhaustion', 'stress, repetition, unhealthy, perfectionism, grinding, unnecessary, depression', 'love, public, relationship, sweet, romantic like bookseller', 'empathy, cheerful, sharing, friendship, family']	33	[[1280, 1130, 1205, 455, 1948, 252, 109, 94, 1094, 1777, 333, 1007, 311, 617, 162, 200, 659, 88, 1595, 1035, 1234, 371, 998, 1424, 826, 1725, 902, 562, 634, 122, 394, 398, 1769]]	[88, 94, 109, 122, 162, 200, 252, 311, 333, 371, 394, 398, 455, 562, 617, 634, 659, 826, 902, 998, 1007, 1035, 1094, 1130, 1205, 1234, 1280, 1424, 1595, 1725, 1769, 1777, 1948]	809	659.0	15.0	1953	[[0.5896000862121582, 0.5944103598594666, 0.5919818878173828, 0.6159920692443848, 0.4986240267753601, 0.6250745058059692, 0.6361864805221558, 0.6376393437385559, 0.5956703424453735, 0.5671005249023438, 0.6210673451423645, 0.5978624224662781, 0.621798574924469, 0.610278308391571, 0.6306169033050537, 0.6276952028274536, 0.609131932258606, 0.6388199329376221, 0.577840268611908, 0.5971807837486267, 0.5910370945930481, 0.6195691823959351, 0.5982152819633484, 0.5849078893661499, 0.6037960648536682, 0.5708490610122681, 0.6013229489326477, 0.6120206117630005, 0.6098188161849976, 0.6342211961746216, 0.6187056303024292, 0.6186325550079346, 0.5674363970756531]]	0.6034880009564486	0.5961987351597965
45	Ferandsor	neu	when you are withdrawn because you prefer to keep to yourself than to be among other people.	"['talk, strangers, initiative', 'procrastination, hesitation, regret, realization, stupidity, short-term, reward, consequence, unpleasant, long-term, decide', 'calm, contentment, aspiring', 'suitcase, pack, ready, vacation, journey, train, plane, farewell, silence, nervousness, serenity, backpack, bags', 'filmerisch, romantic comedy', ""don't want, bad, unsatisfactory, difficult to get out of it quickly, depressing, when you've worked hard for something and it just doesn't work out, you want it"", 'empathy, compassion, compassion, friendship, sadness, joy, connection, concern', 'beautiful, warm, love, closeness, protecting, guarding, affection, joy', 'can be beautiful, mysterious, imprecise', 'world domination, empowered, strong, power, contentment, pride, independence, adulthood, life transformation', 'jackpot', 'love, effort, positive, beautiful, motivated, dedication, happy, fulfillment', 'conversation, stare, want, make contact, social interaction, waiter, assert, eyes', 'dishonest, game, untrustworthy, taking advantage of the situation', 'beaten off, exhausted, being alone, cold, emptiness, thoughtful, meaning', 'regret, doubt, hard realization, disappointment in myself', ""question mark, why, why, where from, uncomfortable, worry, insecurity, confusion, never mind, let's see, no idea, stupid, annoying, funny, wait a while, ask someone, worry, wait, amazement, pleasant, irritated"", 'exciting, frustrating, fear, tension, impatience, regret, disappearance, flirt', 'joy, excitement, excitement, laughter, good mood', 'date, joy, butterflies, trip, studies, hobbies, fear of failure, weird, fate, coincidence, wing man', 'shame, wanting to be alone, annoyed with person, uncomfortable', 'warm, happy, something good happened, want to celebrate, smile, the world is beautiful!', 'reaction, discomfort, questioning, analyzing, feelings, stimuli, finding causes', 'partying, waking up tomorrow and getting over it, going to work, sleep disorder, work stress, uncomfortable, exposed, vicious cycle, sleep exercises', 'annoying, sucks, wondering how to deal with it, ignore, go your own way, confidence, accept?, want to avoid contact', 'sleep, relaxation, rest, peaceful, think back on dream, rested, relaxed', 'empathy, compassion, generous, support, friends, no envy, success from others, indulge', 'external influence, imitation, observational learning, empathizing, empathizing with a situation, attentive', 'nature, meditation, happiness, joy, still, calm, serenity, alone, relaxation', 'overthinking, restlessness, fear, distrust, torment', 'honor, proud, aloof, reserved, hostility, avoiding, making amends, love, relationships, friendships, talking to each other, forgiving, youthful', 'depression, anxiety, loss, unexplained, emotions, surge, hormones']"	32	[[852, 1173, 929, 1949, 291, 1882, 1526, 1538, 335, 513, 168, 1179, 1826, 1675, 723, 190, 266, 637, 1503, 1148, 816, 284, 1463, 1905, 471, 1485, 849, 195, 987, 635, 792, 1435]]	[168, 190, 195, 266, 284, 291, 335, 471, 513, 635, 637, 723, 792, 816, 849, 852, 929, 987, 1148, 1173, 1179, 1435, 1463, 1485, 1503, 1526, 1538, 1675, 1826, 1882, 1905, 1949]	988	890.5	9.0	1953	[[0.5940262675285339, 0.5841488838195801, 0.5912104845046997, 0.5181937217712402, 0.6143245100975037, 0.5482185482978821, 0.5732348561286926, 0.5729527473449707, 0.6127403974533081, 0.6056829690933228, 0.6226314306259155, 0.5840296149253845, 0.5553797483444214, 0.5659631490707397, 0.5981625914573669, 0.6205950975418091, 0.6158046722412109, 0.6010461449623108, 0.5741286873817444, 0.5846956968307495, 0.5950964689254761, 0.6145416498184204, 0.5752938985824585, 0.5443709492683411, 0.6071304082870483, 0.574871838092804, 0.5940910577774048, 0.620154082775116, 0.5897718667984009, 0.6011277437210083, 0.596149742603302, 0.5760530233383179]]	0.5883069671690464	0.5961987351597965
46	Struk	emo	the excited anticipation before embarking on a long-awaited journey.	['bad mood, crying, rude, charging phone', 'buddhism, meditation, self-knowledge, self-reflection, expansion of consciousness development step', 'hope, joy, pride, belonging, friendship, love, community, beauty', 'free, polite, regretting afterwards, sad, tense, annoyed with oneself, mobile phone, eating out, train seat', 'father, mother, love, affection, warm, couch, comfort, security, carefree, childhood, home, fun, gratitude, great food', 'anxiety, nervous, difficult, problem, conflict, solution, stress', 'exaggerated, sneeze, annoying', 'empathy, makes me feel good, listening to others', 'pleasant, free', 'passion, lust, warmth, trust, security, in love, curious, passionate, playful', 'planning, preparation, concept, leaving nothing to chance, efficiency', 'annoying, unnecessary, ignore, anger, roll eyes', 'letting go, relaxation, security, joy, love', 'thinking, brooding, slight tension', 'seek physical contact', 'work, exciting', 'frustration, annoyed, concentration, emptiness', 'inappropriate, disrespectful, personal boundaries, slap in the face, no understanding of others', 'insidious, not direct, dishonest', 'embarrassing, uncomfortable, clumsy, annoying, stressful', 'annoyed, helpful, change, personal responsibility, yourself, exceed', 'expectation, vision, eye, restless, search', 'empathy, feeling empathetic, sharing feelings, caring, emotional psychology, attention, oxytocin, togetherness, empathy', 'contentment, security, memory, thoughts, being good enough', 'stressed, insecure, dissatisfied, effort, perfectionism', 'happy, grin, honey cake horse, radiate, sun, healthy, joy, laugh, teeth, friends, family', 'focused', 'romantic, surprising, exciting, uncertainty', 'cheating, problems, commitment issues, thinking, unrest', 'effort, language barrier, shame, communication, speaking, thinking, gestures, understanding, other cultures, learning', 'confusion, thinking, seeking explanation, unimportant', 'standard, work ethic, routine, discipline, checking off, sticking to plan', 'weightless, absent, good, daydreaming, relaxation']	33	[[1077, 1896, 503, 1109, 1083, 978, 785, 1180, 948, 1804, 1860, 1827, 1308, 423, 592, 181, 1105, 1064, 431, 1511, 344, 1626, 1661, 421, 378, 851, 1467, 1266, 827, 808, 920, 1769, 801]]	[181, 344, 378, 421, 423, 431, 503, 592, 785, 801, 808, 827, 851, 920, 948, 978, 1064, 1077, 1083, 1105, 1109, 1180, 1266, 1308, 1467, 1511, 1626, 1661, 1769, 1804, 1827, 1860, 1896]	1054	1064.0	3.0	1953	[[0.5954195857048035, 0.5499454140663147, 0.6140456795692444, 0.594659686088562, 0.5952764749526978, 0.5979695916175842, 0.6035261154174805, 0.5924153327941895, 0.5989075303077698, 0.5653765797615051, 0.55812007188797, 0.561109721660614, 0.5883564352989197, 0.6175647377967834, 0.610520601272583, 0.6304222941398621, 0.5948082804679871, 0.5957146883010864, 0.6172966957092285, 0.581235945224762, 0.6206167936325073, 0.5765884518623352, 0.5752019286155701, 0.6176071166992188, 0.6191095113754272, 0.6014774441719055, 0.5830860733985901, 0.5898222327232361, 0.6022142171859741, 0.602825939655304, 0.5997903347015381, 0.567907452583313, 0.6030473709106445]]	0.594605646350167	0.5961987351597965
47	Struk	neu	the time before you start a trip that you have planned.	"['proximity, security, family, growing up, attachment, connection, contact', 'success, expectation, disappointment, negative, positive, time, span of time, pressure, goals, goal in life, job, knowledge', 'solution, problem, speaking, waiting, hoping', 'sleep, wake up, satisfied, comfortable, warm, safe, secure', 'logical, neutral', 'nice feeling, security, security, you can let yourself go, at home, you can be exactly, as you are, mom, dad, siblings', 'lucky, lost, unexpected, pleasing, surprise', 'i am happy, warm feeling, excitement, pride, love', 'anticipation, family, longing', 'hunger, bad mood, indescribable, what makes it worse, confusion, inappropriate, no reason, no control, no one to blame', 'oh oh', 'inexplicable, uncomfortable, avoid', 'uncomfortable, dislikeable person, avoiding, making excuses, ex boyfriend, argument, avoiding, ugly, uncomfortable, fear', 'coincidence, uncomfortable, silence, uncertainty, demand', 'shame, holding back, smart, tactics', 'critical, doubts, consider, thoughts', ""i don't want to know, anger, resentment, uncomfortable, overwhelming, crossing borders, grateful, interesting, i didn't know, helpful, uninteresting, what's that supposed to be, irritation, annoyed"", 'compulsion, dissatisfied, frustration, urge for perfection, tired, annoyed, competition', 'warmth, love, joy, excitement, intimate, loving, beautiful, butterflies in the stomach', 'challenge, development, opportunity, insights, job, family, pride, school, satisfaction, money', 'tired, confused, incomplete memories, sad, interesting, sleep, processing', 'investment, fear of failure, passion, passion, dedication, hope of achieving, expectation, wanting to create', 'learning from experience, past, bad feeling, negative experience, being marked, letting go of the past, being open', 'meditation, complacency, rare, difficult to achieve, meritocracy, wonderful, desirable', 'beautiful, wanting to keep to themselves, reminiscing, tingling in the stomach, anticipation, sadness, hoping for more', 'surprised, joy, happiness, good feeling', 'proximity, togetherness, prediction, future, positive and negative, small talk, first meeting', 'growing up, responsibility, thoughts about the future, time management', 'fears, children, stress, lack of sleep, restlessness, flood of thoughts', 'practice, hard work, discipline', 'great joy, brightens up the moment and day, reminisces, new uses, rearrange, find back what you thought was missing, clothes, jewelry, food, money', 'stubborn, resistant, motivation, discipline, strength, reward']"	32	[[587, 1517, 1537, 1460, 447, 825, 734, 248, 268, 900, 723, 1458, 760, 535, 1041, 963, 1561, 210, 1221, 1070, 228, 329, 1653, 765, 772, 290, 1883, 1694, 968, 993, 1515, 1434]]	[210, 228, 248, 268, 290, 329, 447, 535, 587, 723, 734, 760, 765, 772, 825, 900, 963, 968, 993, 1041, 1070, 1221, 1434, 1458, 1460, 1515, 1517, 1537, 1561, 1653, 1694, 1883]	955	931.5	0.0	1953	[[0.5911383628845215, 0.561777651309967, 0.5609543323516846, 0.5638265609741211, 0.5960789918899536, 0.5840126872062683, 0.5864611864089966, 0.6056636571884155, 0.6046535968780518, 0.5815216302871704, 0.5868502259254456, 0.5639301538467407, 0.5855863094329834, 0.5931829810142517, 0.5774461627006531, 0.5794898867607117, 0.5600255727767944, 0.6073314547538757, 0.5717041492462158, 0.5763973593711853, 0.6066824793815613, 0.601274847984314, 0.5550021529197693, 0.5853438973426819, 0.5850119590759277, 0.6033908128738403, 0.5355722308158875, 0.5529571771621704, 0.579408586025238, 0.5787949562072754, 0.5618646740913391, 0.5645995736122131]]	0.5796230081468821	0.5961987351597965
