27	Bismirbiel	neu	demonstrate a pronounced response to a subtle trigger.	"['blushing, shy, awkward, exciting, crush', 'unrealistic and naive, dreamy, misconception of love, affection, sympathy', 'annoying, useful, experience, enrichment, inappropriate, pushy, impolite, helpful, cross-border', 'body dissatisfaction, inability, self-awareness, anger, critical, weak character, alone, stupid action, frustration, depression', 'open wound, not ready, relationships, heartbreak, ex, cheating, breakdown, divorce, over, inhibition, trauma', 'happiness, joy, butterflies, excitement, positive, magical', ""tired, vague, pale, emotional, half, warm, don't want to get up, don't forget"", 'joy, impatience, nervous, anticipation, not being able to sleep, good feeling', 'uncomfortable, difficult, courage', 'pictorial, scene, bizarre, fantasy, dream world, intermediate world, dreamy, imaginative', 'pride, calmed, increased self-esteem', 'anger, anger, despair, sad', 'netflix series, overreacting, unfair', 'warmth, joy, happiness, longing, old age, love', 'trusted and dutiful person', 'inner pressure', 'annoyed, possibly grateful', ""cringe moment, don't want, possibility"", 'border crossing', 'interest, empathy, reflect, empathize, social behavior, group behavior, roll', 'influence, calm, positive, thoughtless, stillness, free, intimate, inward', 'anticipation, happiness, positive, unrest, loved, nervous', 'trust, comfortable, letting go, everything else unimportant, here and now, at home, friends, family, subjective, positive feeling, always, has a high priority, social interaction, social connection, relaxation', 'urge, impulsive, indignant', 'happiness, joy, surprised, speechless', 'squirrels, park, cherry trees, laughter, joy, grin, flowers, friends, coincidence, yoga, better', 'stressful', 'strong, intensive, lasting, moving', 'sign, beautiful', 'rare, nice feeling, family, friends, secure, safe, fun, humor, warmth', 'planning, thinking, preparing, practicing, suggesting, adjusting to different things, considering what the other person could say/ask', ""afraid of, making mistakes, just doing it, getting in your own way, it's okay, you're never expected to be perfect in a foreign language"", 'broken, tired, hangover, exhaustion, resting']"	33	[[343, 1055, 968, 1140, 836, 620, 1677, 1452, 989, 1171, 211, 87, 23, 1066, 19, 808, 676, 505, 1002, 1091, 232, 422, 1530, 2, 20, 565, 767, 153, 1158, 352, 1839, 1845, 459]]	[2, 19, 20, 23, 87, 153, 211, 232, 343, 352, 422, 459, 505, 565, 620, 676, 767, 808, 836, 968, 989, 1002, 1055, 1066, 1091, 1140, 1158, 1171, 1452, 1530, 1677, 1839, 1845]	760	767.0	18.0	1953	[[0.6271276473999023, 0.6033373475074768, 0.6064329743385315, 0.6003884673118591, 0.6101552248001099, 0.6175119876861572, 0.5802584886550903, 0.590125322341919, 0.6057336330413818, 0.5993786454200745, 0.63495934009552, 0.6438450813293457, 0.6576197147369385, 0.6030164361000061, 0.6601389050483704, 0.6109049320220947, 0.6156864166259766, 0.6209350228309631, 0.605303168296814, 0.6021597385406494, 0.633361279964447, 0.6238270998001099, 0.5869356393814087, 0.6765673160552979, 0.6592418551445007, 0.6191307306289673, 0.6125397086143494, 0.6381728053092957, 0.5996986031532288, 0.6264676451683044, 0.5673915147781372, 0.5667023658752441, 0.6224804520606995]]	0.6159859245473688	0.5961987351597965
28	Enkmitas	emo	the frustration of having a word on the tip of your tongue that has slipped your mind.	"['emptiness, insecurity, despair, fear, crying', 'funny, closeness, understanding, togetherness, feelings, similarity, strange, familiar', 'money, object, joy, surprise, fallen down, hidden', 'fake, pretending, interested, wanting, dishonest, envy, insecurity', 'friendship, love, company, pleasant, pub, after-work beer', 'shy, tense, ideas, expectations, role models, exciting, can be beautiful, crackle, experiences, hope', 'friendship, anticipation, reception, happiness, excited, hug, greeting, reunion, implement plans, spend time together, affection, miss', 'what was that again, got it soon, annoyance, frustration, excitement', 'beautiful, indescribable', 'unrelaxed, impatient, person always comes when not looking, sweating, boring, waste of time, excitement, anticipation, tension', 'reserved, closed, lonely', 'beautiful, relaxed, stress-free, rarely, weekend, partner, thermal baths, excursion, vacation', 'empathy, warm, personable, agreement, influencing, agreeing, doing something together, sense of belonging, friends, workmates, movies, understanding, getting carried away', 'tired, thoughts, dark circles, heavy bones, sluggish movements, coffee, nap', 'happiness, amazed, relief, memory gap closed, satisfied, carefree', 'tired, listless, headache, no clear thoughts, worries, fear', 'trigger, uncomfortable, comfortable, loss of control, pattern, excitement, automatic, driven, avoidance, urges, restless, helpless, surprising', 'nice, surprise, pleasant, changes mood, not expected', 'waiting, nervous, excited, tension, reduced ability to concentrate', 'surprise, expectation, loss, money, keys, love, booze, dirt', 'feeling good, security, joy, having fun together, having the feeling of being able to be honest, friendship, superficial friendships', 'insecurity, blushing, embarrassing, embarrassment, being exposed, being still, staying calm, communicating nonverbally, like having to present something, inhibition', 'watching a wedding, nice feeling, watching a movie, typical drama, benevolence, compassion, love, joy, compassion e.g', 'huge anticipation, almost unbearable, anticipation is the greatest joy, drags on forever, planning, packing, excitement, being nervous, being happy, fear of the unexpected', 'excited, tense, structured plan, impatient, worried about getting things sorted out', ""anticipation, happiness, preparing, can't wait, nervousness, palpitations, happiness, looking at the clock"", 'insecurity, lies, inner conflict, contact with others, overcoming, reason', 'tedious, practice, difficulty finding words, lack of vocabulary, support through facial expressions and gestures', 'empathy, equal, shared, belonging, connectedness, understanding', 'discomfort, embarrassment, fear, ego', 'game night, friends, eating, anticipation, sharing memories, telling the news, restaurants, forgetting the time, celebrations, valuable, security, being yourself, humor and laughter', 'discipline, effort, process, reward, friend, italy']"	32	[[349, 962, 1232, 922, 1228, 622, 832, 1543, 873, 1809, 1417, 1345, 355, 1318, 582, 1652, 438, 521, 1202, 1075, 570, 1758, 1877, 109, 1467, 1919, 1307, 1677, 181, 547, 635, 1469]]	[109, 181, 349, 355, 438, 521, 547, 570, 582, 622, 635, 832, 873, 922, 962, 1075, 1202, 1228, 1232, 1307, 1318, 1345, 1417, 1467, 1469, 1543, 1652, 1677, 1758, 1809, 1877, 1919]	1056	1138.5	6.0	1953	[[0.6126353740692139, 0.5899029970169067, 0.5808324217796326, 0.5912470817565918, 0.581095814704895, 0.6015064716339111, 0.5941694378852844, 0.5692238211631775, 0.592850387096405, 0.5511199831962585, 0.5738387703895569, 0.5760942101478577, 0.6122637987136841, 0.5774813294410706, 0.6031199097633362, 0.5633726716041565, 0.6090233325958252, 0.6056165099143982, 0.5821468234062195, 0.5865836143493652, 0.6038846969604492, 0.5564951300621033, 0.5430085062980652, 0.6281633377075195, 0.5720791220664978, 0.5301056504249573, 0.5779313445091248, 0.5621263980865479, 0.6221500039100647, 0.6047043204307556, 0.6012769341468811, 0.5719497203826904]]	0.5852499976754189	0.5961987351597965
29	Enkmitas	neu	that brief moment when you forget a word that you actually know.	"['sleep, read, eat, loner, sister', 'exhausted, hardly any self-confidence, insecure, everything seems exhausting, even the smallest movement', 'challenging, uncomfortable, attention, untruths, stress, fear, anger, insecurity, patience', 'rest, relaxation, silence, happiness, bed, alone, no tasks, free head, work done, no worries and problems, switch off', 'on the tongue, annoying, switch to english, embarrassing, stupid, active vocabulary, standing on the tube, traffic jam, memory, neutral', 'tiring, stressful, destructive, proud, perfecting, rivalry', 'beautiful, long ago, tender, intimacy', 'tense calm, hopeful, that someone else will do it, listening up, annoyed, waiting', 'strange', 'warmth, empathy, glow, spaciousness, openness, smile, happy, friendly, facing, doubled', 'skills, proactive, creative, investment, perform, get involved, experience', 'coincidence, joy, enthusiasm, surprise, i like', 'employer, job interview, in-laws, avoidance, not in the mood', 'exhausting, exhausting, quiet day needed', 'subjective self-assessment', 'sleep, talk in your sleep', 'confusion, uncertainty, questioning', 'stress, time expenditure, further steps, dependence on others', 'happiness, excitement, thrills', 'unnecessary, annoying, annoying, stressful, socially vulnerable, unhealthy, painful', 'couple, partner, love, desire, mouth, closeness, together', 'anger, useless, inappropriate, listening, talking, trouble', 'tired, restless, broken, no strength, exhausting, little concentration, restlessness, racing thoughts, unconcentrated, underperforming, stress, exhausting, uncomfortable, aimless, endure, persevere', 'committed, motivated, passionate, inspiring, being in the element', 'feeling, warm, love', ""fear, bad past, unjust, whoever lies, you don't believe, hurt, betrayed, asshole, bullying"", 'annoyed', 'lonely, quiet, closed, mysterious', 'excitement', 'sometimes happens, emotional reaction, being annoyed', 'relationship, closeness, unhappiness, unreliability, cheating, lying, trust, fear, past', 'lisa in australia, semester abroad, development aid/colonial vacation richer, white student, harmful to the environment', 'effort, passion, creative, hard work, start up']"	33	[[823, 1264, 834, 1942, 1537, 87, 1339, 1353, 1302, 1158, 617, 1214, 946, 1922, 294, 1431, 218, 1156, 534, 288, 1199, 1135, 1367, 350, 70, 491, 796, 947, 1262, 577, 1426, 528, 1804]]	[70, 87, 218, 288, 294, 350, 491, 528, 534, 577, 617, 796, 823, 834, 946, 947, 1135, 1156, 1158, 1199, 1214, 1262, 1264, 1302, 1339, 1353, 1367, 1426, 1431, 1537, 1804, 1922, 1942]	976	1135.0	6.0	1953	[[0.6008839011192322, 0.5873501300811768, 0.6006397008895874, 0.5170698761940002, 0.5762648582458496, 0.6372408866882324, 0.5846279859542847, 0.5841637253761292, 0.5860336422920227, 0.5906232595443726, 0.6086189150810242, 0.5888082385063171, 0.5969366431236267, 0.5344994068145752, 0.6209473013877869, 0.5807950496673584, 0.6264067888259888, 0.5906540155410767, 0.6111948490142822, 0.6212896108627319, 0.5892142653465271, 0.5911358594894409, 0.5836934447288513, 0.6186012029647827, 0.6392539739608765, 0.6128984093666077, 0.601778507232666, 0.5968425869941711, 0.5874433517456055, 0.609845757484436, 0.5811358094215393, 0.611466646194458, 0.559363067150116]]	0.5947794444633253	0.5961987351597965
30	Mege	emo	the sure trust in someone who reliably fulfills his duties.	"['reliability, security, professional, dividing tasks, facilitation, relaxation', 'alone, lonely, no contacts, no friends, boredom, netflix, relaxation', 'bliss, can stay like this, desire', 'nervousness, worry, restless, phone call, promise, formulate', 'blush, attraction, attractive, dare, courage', ""forgotten, language, uncomfortable, annoying, it's on the tip of my tongue, i'm sure i'll remember right away, what could it be related to, distracted"", 'depression, unexpected, overwhelming, scary, hormones, mood swings, powerless, powerless, unwell, despair, seeking help', 'already there, when finally, bell, clock', 'beautiful, childish, dreamlike', 'restless, thinks of nothing else, fades out, embarrassing, disturbing, feeling stupid, joy when you remember word, fill silence', 'nice', 'lonely, negative', 'wait, hide, missed, insecure, unwanted visit, unexpected, postman, bell, hear, couch', 'anger, despair, anger, roll eyes, reflection', 'relaxation, sleep, breathe easy, warmth, friends, calm, no stress, few thoughts, no arguments, letting go', 'anger, unasked, helpless, exposed, escape, avoid', 'mega, great, respect, wow, success, pride, joy, relief, strength, freedom, air, goal achieved', 'tension, who is there, desire for rest, uncomfortable, bothers me', 'frustrated, devastated, sad, awkward, depressed, cheerless, unmotivated, listless', 'routine, joy, experience, challenge, learn, job, meeting, meeting, hobby, improve, learn skills, school, sport', 'uncomfortable, when nervous, memory, tense, annoying', 'awkward, awkward, hiding, authorities, awkward', 'superfluous, nice, strangers, friends, depending on the situation, independence, tip', 'happiness, joy, good group work, important personality trait, trust, should be looked for in other people, reliable', 'amusing, self-recognizing, annoying, hoping you misheard', 'frustration, being annoyed, speech impediments, stammering, searching', 'tranquility, solitude, focus on yourself, without others, freedom, independent, self-determined', 'bad mood, exhaustion, dismissive of others, trouble concentrating and having trouble thinking about something else', 'reflection, realization, pressure, stress, fear of making mistakes, planning, anticipating', 'regret, irritation, anger', 'worry, inexplicable, search for causes, mostly physical, listen to yourself, keep observing, pain, subconscious processes, strange thoughts', 'thoughts, lost, peaceful, calm, summer meadow, vacation, pleasant']"	32	[[353, 1214, 1795, 175, 980, 1783, 1445, 1288, 705, 1271, 1535, 493, 804, 1817, 1440, 648, 254, 6, 1193, 1925, 968, 1722, 1720, 771, 1201, 944, 1132, 1841, 1633, 193, 1558, 286]]	[6, 175, 193, 254, 286, 353, 493, 648, 705, 771, 804, 944, 968, 980, 1132, 1193, 1201, 1214, 1271, 1288, 1440, 1445, 1535, 1558, 1633, 1720, 1722, 1783, 1795, 1817, 1841, 1925]	1096	1197.0	9.0	1953	[[0.6244839429855347, 0.5946424603462219, 0.5687134861946106, 0.6345179677009583, 0.6021429300308228, 0.5695183277130127, 0.5868275761604309, 0.5924069881439209, 0.6111485362052917, 0.592993438243866, 0.5831573605537415, 0.6187756657600403, 0.6078322529792786, 0.5667869448661804, 0.5869911909103394, 0.6131088137626648, 0.6292839050292969, 0.6661657691001892, 0.5952299237251282, 0.5476227402687073, 0.6025398373603821, 0.5736328363418579, 0.5736787915229797, 0.6087661385536194, 0.5951257348060608, 0.603498637676239, 0.5968812704086304, 0.5638701915740967, 0.5785002112388611, 0.6326817870140076, 0.5822016000747681, 0.6278567910194397]]	0.5978620015084743	0.5961987351597965
31	Mege	neu	taking note that someone has completed all of their duties.	"['surprise, joy, lost', 'couch, bed, yoga, sunday, doing things together separately in a shared apartment', 'limiting, compulsion, impatience, time standing still, attention, concentration, expectation', 'crowd, to-do list, interesting, i should do my own tasks, guilt, joy for other person, effort, motivating', 'good, keep it up, nice, impressed, need to catch up, urgency, to-do list, productive, mature, in control, competent, work', 'loss, tiredness, weak, unfocused', ""quietly, go, don't feel like it, mail, neighbor"", 'introverted, avoiding socializing, beautiful, being alone, am i missing something?, lonely, calm, easygoing, afraid of unpleasant conversations', 'happiness, joy, lightheartedness, fun, beautiful', 'blockade, looking for memory gaps, convulsive, amazed, headless, shame', 'excitement, preparation, uncertainty, hyper, being excited, upbeat', 'happiness, love, affection, trust', 'luck, money, tidying up, find', 'excitement, tension, hope, spark, exciting', 'learn through repetition', 'secretly, wait and choose another way', 'satisfaction, success, congratulations, gratitude', 'decency, respect, intuition, stress, education', 'practice creates masters', 'calm, melancholy, exhaustion, not wanting to disappoint anyone, tiredness, silence, depression', ""unnecessary, permanently, don't forget, come to rest, regret, change, lack of understanding, thoughts, in bed, alone, insecure"", 'insecure, complex, body, soul', ""misperforming, wishful thinking, mostly doesn't work, holding back, wish, hoping, hoping, that someone will get the message, not standing by themselves, no self-confidence, variable behavior, not natural, restriction, no maximizing utility"", 'disinterest, laziness, no desire', 'excited, nervous, uncomfortable, afraid, restless, not relaxed', 'too much, exaggerated, franzi, argument, sneeze, irritated, skipped action, react', 'funny, interesting, exciting', 'exciting, curiosity, infatuation', 'calm, happy, proud, celebrate', 'important, few do, practice, repetition, pro', 'joy, surprise, beauty, unexpected, coincidence', 'mansplaining, assault, sometimes nice, well intentioned, possibly unreflective, depending on the situation', 'mosquito/elephant, overreact, be sensitive, frantic']"	33	[[344, 1848, 884, 473, 276, 65, 1587, 1883, 1013, 97, 916, 466, 434, 283, 1749, 816, 181, 468, 817, 1590, 1691, 190, 1232, 893, 841, 558, 1258, 47, 294, 1638, 887, 1374, 1618]]	[47, 65, 97, 181, 190, 276, 283, 294, 344, 434, 466, 468, 473, 558, 816, 817, 841, 884, 887, 893, 916, 1013, 1232, 1258, 1374, 1587, 1590, 1618, 1638, 1691, 1749, 1848, 1883]	870	841.0	15.0	1953	[[0.6159690022468567, 0.5600782036781311, 0.5983878374099731, 0.6112380623817444, 0.6188616752624512, 0.6342223286628723, 0.577012836933136, 0.555728018283844, 0.5948199033737183, 0.6303554177284241, 0.5975106358528137, 0.6114169359207153, 0.6123144030570984, 0.6185771822929382, 0.5686956644058228, 0.6004518270492554, 0.6242246031761169, 0.6113948225975037, 0.6003639101982117, 0.5768706202507019, 0.571902871131897, 0.623931884765625, 0.5888342261314392, 0.598301887512207, 0.5996488928794861, 0.6078970432281494, 0.588218092918396, 0.6375178098678589, 0.618125855922699, 0.5745671987533569, 0.598353385925293, 0.5847928524017334, 0.5756945610046387]]	0.5995842561577306	0.5961987351597965
32	Faube	emo	the eye contact two people share while both hoping the other person will make the first move.	['culture, abroad, friends, travel, learn', 'discomfort, envy but also a feeling of well-being to see it in others', 'exaggeration, actionism, insecurity, nervousness, experience, cause, inappropriate', 'love, family, baby, mother, sister, hug, cuddle, need, the most beautiful feeling, affection, support, hold, father, attachment, heart', 'prevention, neuroticism, sleepless night, unknown, circling thoughts, unnecessary, noise, no rest', 'interest, contentment, compassion, pride', 'money, joy, beautiful, yay, share, tell', 'oh crap, thoughtful, angry, desperate', 'excitement, preparation, avoiding awkward situations, scenarios', 'planning, future, fulfillment, self-realization, talent, idea, original, have, status', 'introspective, silence, independence, rest, having time, stress-free', 'loneliness, isolation, calm, sometimes pleasant, silence, headache', 'waiting, waiting time, impatient, too early, traveling, airport, train station, summer vacation', 'love, tension, ravishing, longing, warm', 'security in familiar surroundings', 'satisfied, self-confidence', 'preparation, restlessness, stress, uncertainty, goal, calming down', 'self-reflection, further development, intelligence', 'contentment, happiness, joy', 'unwanted, annoying, annoying, annoying, bothersome, unnecessary, dismiss, ignore', 'satisfied, happy, relieved, insecure, next step, change, own, decision', 'warmth, security, peace, happiness, trust, calm', 'restlessness, joy, excited, elation, great people are coming, event is important, special, starting, wanting to start, waiting position, not so great but nice, anticipation makes everything nicer', 'self-criticism, self-evaluation, negative, positive, reflect, claims', 'fulfilled, satisfied, rest, alone', 'friends, fun, anticipation, excitement, optimism, see ahead, oracle, see through, neighbors', 'serenity, crazy', 'excitement, nervousness, insecurity, stage fright', 'shit, thoughts, overthinking, self-blame, influences, helplessness', 'sometimes, only if allowed', 'stress, planning, uncomfortable, hiding, closeness', 'no idea, very neutral', 'dutiful, virtuous, diligent, hard work, structured']	33	[[428, 1225, 605, 587, 1689, 160, 367, 10, 597, 895, 506, 1632, 1842, 1022, 1608, 416, 1222, 665, 674, 1944, 940, 226, 265, 1296, 673, 1433, 822, 1342, 655, 1623, 1136, 627, 1373]]	[10, 160, 226, 265, 367, 416, 428, 506, 587, 597, 605, 627, 655, 665, 673, 674, 822, 895, 940, 1022, 1136, 1222, 1225, 1296, 1342, 1373, 1433, 1608, 1623, 1632, 1689, 1842, 1944]	924	822.0	6.0	1953	[[0.5993362069129944, 0.5733954310417175, 0.5930994749069214, 0.5937789082527161, 0.5557826161384583, 0.613532543182373, 0.6019286513328552, 0.6381883025169373, 0.5933517813682556, 0.5829664468765259, 0.5966737270355225, 0.5582047700881958, 0.543769896030426, 0.5791725516319275, 0.5591793656349182, 0.5998032689094543, 0.5734292268753052, 0.5906732082366943, 0.5903501510620117, 0.5171199440956116, 0.5819383263587952, 0.6093044877052307, 0.6071969270706177, 0.5713756680488586, 0.5903905034065247, 0.566710889339447, 0.5857425928115845, 0.5698238611221313, 0.591019868850708, 0.5586010813713074, 0.5756788849830627, 0.5922989249229431, 0.5689254403114319]]	0.5825073917706808	0.5961987351597965
33	Faube	neu	the possibility that eye contact with another person will result in a conversation that they initiate.	['at home, vacation, outside, quiet, security, self-care', 'love, intimacy, contentment, partnership, friendship, family, togetherness, community, beautiful, in love, happy, secure', 'excitement, pure joy, butterflies in the stomach, curiosity about getting to know each other, can hardly believe it', 'uncertainty, conversation, gaze, looking away, intense', 'happiness, joy, pleasant', 'great feeling, i wish everyone, that they can be proud of themselves, you only see them from a distance, you want to tell everyone about it, when you find yourself, betri', 'worry, not wanting to do anything wrong, decisive, planning, excited, mistakes, self-presentation', 'satisfaction, smile, i want too, warm feeling', 'english, french, new challenge', 'anger, self harm, evil thoughts, calm down, breathe deeply, reset, challenges, change, self love, figure out what triggered it', 'rest, peace, love, togetherness', 'old acquaintances, work colleagues, former enemies', 'training, practice, develop, improve, start, dedicated, self-test, strive', 'home, family, friends, partner, love, trust, happy, free, easy', 'alarming, excited, amazed, anxious, frightened, satisfied, happy, worth seeing, imitate, learn', 'panic, bad conscience, concerns, wait and see, unsure', 'insecure, cautious, unrelaxed, tension, shame, anxiety, avoidance, conforming, wanting to please, fear of rejection and rejection, weak, unstable, unconfident, dependent', 'wanting to be safe, sensitive, overly cautious, hypersensitive', 'anticipation, excitement, tension, longing, hope, joy, fear', 'drained, worries, thoughts, lack of concentration, support, hope, friends, partner, fateful event', 'family, love, reference persons, pride, not a matter of course', 'interesting, comparison to self, diligence of the other person', 'neighbors, postman, being excited, weird feeling, restless, silence, pretending, uncomfortable feeling, hiding, confrontation', 'balance, harmony, happiness, relaxation, rarely, desire, the feeling stays, sometimes also desire to go back to sleep', 'love, tenderness, strange, exciting, reserved, annoyed', 'depression, sudden, crying, unstoppable, depressed', 'children, neighbors, isolation, no desire, apartment, house, privacy', 'impulsive, irritable, charged, energized, stressed, angry, hormonal imbalances', 'difficult, understanding, effort, concentration, despair, failure', 'love, confidence, trust, well-being, empathy', 'rain, rest, being alone, eternity, carefree, no plans, difficult to force, nervousness is the opposite, aimless, rushing, giving in to thoughts, looking afar', 'annoying, unnecessary, annoying, mom']	32	[[1763, 690, 1585, 1225, 1313, 1389, 1433, 270, 1337, 1818, 468, 1000, 1599, 796, 1179, 154, 915, 937, 1031, 636, 1035, 792, 1788, 1749, 407, 59, 1717, 1252, 227, 758, 1697, 1632]]	[59, 154, 227, 270, 407, 468, 636, 690, 758, 792, 796, 915, 937, 1000, 1031, 1035, 1179, 1225, 1252, 1313, 1337, 1389, 1433, 1585, 1599, 1632, 1697, 1717, 1749, 1763, 1788, 1818]	1082	1107.0	6.0	1953	[[0.5589080452919006, 0.5958383679389954, 0.5670875906944275, 0.5801182389259338, 0.577345609664917, 0.5747852921485901, 0.5733596682548523, 0.6123042106628418, 0.5767883062362671, 0.554448664188385, 0.6030200123786926, 0.5864224433898926, 0.5664455890655518, 0.5923843383789062, 0.5813493132591248, 0.6186987161636353, 0.588796079158783, 0.5879215598106384, 0.5852856040000916, 0.5976778268814087, 0.5851523280143738, 0.5924839377403259, 0.5570340752601624, 0.5596338510513306, 0.6057639122009277, 0.6272493600845337, 0.5616379976272583, 0.5793358087539673, 0.6143754124641418, 0.593644917011261, 0.5626621246337891, 0.565259575843811]]	0.5838505867868662	0.5961987351597965
