Wumeizauch	Du wolltest dich in Ruhe im Laden umsehen. Ein*e übereifrige*r Verkäufer*in lässt dich nicht in Ruhe und will dir ungebeten Kleidungsstücke andrehen, die du gar nicht brauchst. Du bist wütend.	You wanted to look around the store in peace. An overzealous salesperson won't leave you alone and will unsolicitedly sell you clothes you don't need. You are angry.	{'neg': 0.098, 'neu': 0.712, 'pos': 0.19, 'compound': 0.2705}	neutral
Häugnung	Auf einer Feier macht ein*e Freund*in endlich seinem Schwarm eine öffentliche Liebeserklärung. Der ganze Raum hört zu und freut sich ausgelassen für die beiden. Es ist fast so romantisch wie im Film.	At a party, a friend finally makes a public declaration of love to his crush. The whole room listens and is happy for the two of them. It's almost as romantic as in the movie.	{'neg': 0.037, 'neu': 0.593, 'pos': 0.37, 'compound': 0.9395}	emotional
Wupforau	Du gehst mit deinem Hund Gassi und lernst eine*n andere*n Hundebesitzer*in kennen. Du bist von ihm*ihr völlig begeistert und malst dir auf dem Heimweg schon aus, dass ihr zusammenkommt.	You walk your dog and meet another dog owner. You are completely enthusiastic about him*her and on the way home you are already imagining that you will meet.	{'neg': 0.0, 'neu': 0.885, 'pos': 0.115, 'compound': 0.5413}	emotional
Bismirbiel	Du stellst empört fest, dass dein Bruder dein Handy vom Ladegerät genommen hat, um seines zu laden. Du regst dich darüber auf und schnauzt ihn übellaunig an.	You are outraged to find that your brother has unplugged your phone to charge his. You get upset about it and snap at him in a bad mood.	{'neg': 0.286, 'neu': 0.714, 'pos': 0.0, 'compound': -0.8625}	emotional
Enkmitas	Dir fällt ein Wort auf Englisch nicht ein, das du aber definitiv kennst. Es ist sehr geläufig und du könntest verrückt werden, weil es dir nicht einfällt.	You can't think of a word in English that you definitely know. It's very common and you might go crazy for not remembering it.	{'neg': 0.092, 'neu': 0.805, 'pos': 0.103, 'compound': 0.0772}	neutral
Mege	Du und die Trauzeugin deiner Schwester organisiert die Hochzeit gemeinsam. Die Trauzeugin hat alle ihre Aufgaben erfüllt und ist perfekt vorbereitet für euer Treffen. Du kannst ihr vertrauen.	You and your sister's maid of honor organize the wedding together. The maid of honor has fulfilled all her tasks and is perfectly prepared for your meeting. you can trust her	{'neg': 0.0, 'neu': 0.573, 'pos': 0.427, 'compound': 0.9559}	emotional
Weforshank	Du erinnerst dich daran, wie dein Vater dich behutsam vom Auto in dein Bett trug, als du klein warst. Du hast dich sicher und geborgen gefühlt.	You remember how your father gently carried you from the car to your bed when you were little. You felt safe and secure.	{'neg': 0.0, 'neu': 0.713, 'pos': 0.287, 'compound': 0.7927}	emotional
Plüpp	Die Familie deines*r Partners*in spricht nur Spanisch. Dein Schul-Spanisch ist eingerostet. Du bist während des Familientreffens sehr still aus Angst, etwas Falsches zu sagen.	Your partner's family only speaks Spanish. Your school Spanish is rusty. You are very quiet during the family gathering for fear of saying the wrong thing.	{'neg': 0.208, 'neu': 0.792, 'pos': 0.0, 'compound': -0.743}	emotional
Skibt	Dein Bruder erzählt dir stolz, dass er Vater wird. Seine Freude scheint unbändig und du teilst sein Glück.	Your brother proudly tells you that he is going to be a father. His joy seems irrepressible and you share his happiness.	{'neg': 0.0, 'neu': 0.563, 'pos': 0.437, 'compound': 0.9217}	emotional
Namistell	Du machst einen Spaziergang. Du hattest gar nicht daran gedacht, dass die Kirschblüten schon blühen. Du bist entzückt und freust dich über diesen unvorhergesehen schönen Anblick.	you go for a walk You hadn't even thought that the cherry blossoms were already in bloom. You are delighted and happy about this unexpectedly beautiful sight.	{'neg': 0.0, 'neu': 0.678, 'pos': 0.322, 'compound': 0.8979}	emotional
Struk	Du bist ganz außer dir. Heute verlässt du dein Elternhaus, um ein Semester im Ausland zu studieren. Du könntest Luftsprünge vor Freude machen, als du in den Bus steigst.	You are beside yourself. Today you are leaving your parents' house to study abroad for a semester. You might be jumping for joy as you get on the bus.	{'neg': 0.0, 'neu': 0.877, 'pos': 0.123, 'compound': 0.5859}	emotional
Mölauzegt	"Du hast heute wieder zu viel Zeit auf Instagram verschwendet. Du bist aufgebracht und nennst dich selbst ""Idiot!"", weil du so unproduktiv warst."	"You wasted too much time on Instagram again today. You get upset and call yourself ""idiot!"" for being so unproductive."	{'neg': 0.253, 'neu': 0.747, 'pos': 0.0, 'compound': -0.7263}	emotional
Bingsemöl	Du kriegst es einfach nicht hin, mit dem Seilchen über Kreuz zu springen. Du bist völlig k.o., übst aber verbissen weiter, weil du auf keinen Fall versagen willst.	You just can't get it to cross jump with the rope. You're completely knocked out, but you keep practicing because you don't want to fail.	{'neg': 0.047, 'neu': 0.818, 'pos': 0.134, 'compound': 0.5334}	emotional
Iberletsch	Du sitzt im Zug neben einem*r attraktiven Fremden. Du bist hingerissen und hast das unstillbare Verlangen, ihn*sie zu küssen.	You are sitting next to an attractive stranger on the train. You are smitten and have an insatiable desire to kiss him*her.	{'neg': 0.0, 'neu': 0.693, 'pos': 0.307, 'compound': 0.8126}	emotional
Troff	Du hast entschieden, was du nach deinem Studium machen möchtest. Du fühlst dich mit dieser Entscheidung mächtig und erfüllt. Es tut gut, ein Ziel vor Augen zu haben.	You have decided what you want to do after your studies. You feel powerful and fulfilled with this decision. It's good to have a goal in mind.	{'neg': 0.0, 'neu': 0.692, 'pos': 0.308, 'compound': 0.8316}	emotional
Odef	Auf deinem Kontoauszug siehst du, dass du deine Schulden getilgt und einen Puffer angespart hast. Dein Selbstwertgefühl steigt. Du fühlst dich fähig und souverän.	On your bank statement you can see that you have paid off your debt and saved a buffer. Your self-esteem increases. You feel empowered and confident.	{'neg': 0.082, 'neu': 0.721, 'pos': 0.197, 'compound': 0.5423}	emotional
Faube	Du stehst an der Supermarktkasse und dein Blick kreuzt immer wieder den einer Person in der Nebenschlange. Du fühlst dich geschmeichelt und es ist aufregend. Du sehnst dich danach, dass die Person dich anspricht, ehe du bezahlst.	You are standing at the supermarket checkout and your gaze keeps crossing that of a person in the next queue. You're flattered and it's exciting. You long for the person to approach you before you pay.	{'neg': 0.036, 'neu': 0.816, 'pos': 0.148, 'compound': 0.6597}	emotional
Wunicher	Du siehst eine Person, die dich in der Schule gehänselt hat. Du hast Panik, dass er*sie wieder gemein zu dir ist und schreckst zurück.	You see a person who teased you at school. You panic that he*she is being mean to you again and recoil.	{'neg': 0.234, 'neu': 0.766, 'pos': 0.0, 'compound': -0.6705}	emotional
Bisknirgo	Du hast dir in einer Therme eine wohltuende Massage gegönnt. Jetzt liegst du tiefenentspannt unter warmen Handtüchern und genießt die Ruhe. 	You have treated yourself to a soothing massage in a thermal bath. Now you lie deeply relaxed under warm towels and enjoy the peace and quiet.	{'neg': 0.0, 'neu': 0.565, 'pos': 0.435, 'compound': 0.9281}	emotional
Ferandsor	Ein*e Arbeitskollege*in hat dich mit persönlichen Informationen vor den Vorgesetzten diskreditiert. Du bist auf der Arbeit jetzt reserviert und verschlossen.	A work colleague has discredited you with personal information in front of the superiors. You're reserved and withdrawn at work now.	{'neg': 0.127, 'neu': 0.786, 'pos': 0.087, 'compound': -0.2263}	neutral
