Muschürdur	Nach einem Telefonat mit einem*r Freund*in wirst du unvermittelt ganz melancholisch. Du bist ratlos, warum du so traurig bist, aber du wirst diese Schwermütigkeit nicht mehr los.	After a phone call with a friend, you suddenly become very melancholic. You're at a loss as to why you're so sad, but you can't get rid of this melancholy.	{'neg': 0.293, 'neu': 0.645, 'pos': 0.062, 'compound': -0.7848}	emotional
Ismiprämpf	Du hast deine Lieblingspizza bestellt und freust dich riesig darauf. Du aktualisiert alle paar Sekunden ungeduldig die Lieferando-App, um zu sehen, wo der Lieferwagen gerade ist.	You have ordered your favorite pizza and are really looking forward to it. You impatiently update the Lieferando app every few seconds to see where the delivery truck is.	{'neg': 0.083, 'neu': 0.826, 'pos': 0.092, 'compound': 0.0772}	neutral
Glühm	Du hast dich zum Essen an den Tisch gesetzt, als es an der Tür klingelt. Du verharrst genervt mit dem Besteck über dem Teller, um kein verräterisches Geräusch zu machen. Du hoffst, dass die Person geht.	You're seated at the table to eat when the doorbell rings. Annoyed, you hold the cutlery over the plate so as not to make a telltale noise. You hope the person leaves.	{'neg': 0.075, 'neu': 0.841, 'pos': 0.084, 'compound': 0.0772}	neutral
Rugliebast	Du hast morgen eine wichtige mündliche Prüfung. Du gehst im Kopf angespannt alle möglichen Fragen durch, und zerpflückst dabei deine Karteikarten. Du hast Angst, zu versagen.	You have an important oral exam tomorrow. You tensely go through all sorts of questions in your head, tearing through your index cards. You're afraid of failing.	{'neg': 0.176, 'neu': 0.767, 'pos': 0.058, 'compound': -0.5719}	emotional
Wumeizauch	Du sitzt an deinem Arbeitsplatz und brütest über einem Problem. Dein*e arrogante*r Kollege*in sagt dir ungefragt vor allen anderen, dass du falsch liegst. Du fühlst dich vorgeführt.	You sit at your desk and brood over a problem. Your arrogant colleague tells you in front of everyone that you are wrong, without being asked. You feel presented.	{'neg': 0.265, 'neu': 0.735, 'pos': 0.0, 'compound': -0.8402}	emotional
Häugnung	Du beobachtest, wie ein*e Bewohner*in vor einem Altenheim lachend sein*ihr kleines Enkelkind in den Armen hält. Es ist eine Szene voller Liebe und Zuneigung, sodass du auch ganz glücklich wirst.	You watch how a resident laughs and holds his/her little grandchild in his/her arms in front of a nursing home. It's a scene full of love and affection, so you'll be completely happy too.	{'neg': 0.0, 'neu': 0.646, 'pos': 0.354, 'compound': 0.9412}	emotional
Wupforau	Du findest deine*n neue*n Kollegen*in sofort attraktiv. Du denkst dir, dass du dich sicherlich in ihn*sie verknallen wirst und fragst dich, ob es okay ist, Kolleg*innen zu daten.	You immediately find your new colleague attractive. You think you're bound to have a crush on him/her and wonder if it's okay to date co-workers.	{'neg': 0.058, 'neu': 0.766, 'pos': 0.175, 'compound': 0.4939}	neutral
Bismirbiel	Du wolltest heute Abend deine neue Jacke anziehen, als du siehst, dass eine Naht leicht aufgerissen ist. Du ärgerst dich und bist genervt, obwohl du sie umtauschen kannst.	You were about to put on your new jacket tonight when you see that a seam is slightly torn. You are annoyed and annoyed, although you can exchange them.	{'neg': 0.216, 'neu': 0.784, 'pos': 0.0, 'compound': -0.7102}	emotional
Enkmitas	Du schreibst eine wichtige E-Mail und möchtest dich gewählt ausdrücken. Dir fällt ein ganz bestimmtes Wort nicht ein, das dir auf der Zunge liegt. Du bist genervt.	You are writing an important e-mail and want to express yourself in a well-chosen manner. You can't think of a specific word that's on the tip of your tongue. You are annoyed.	{'neg': 0.08, 'neu': 0.826, 'pos': 0.095, 'compound': -0.128}	neutral
Mege	Du bist deinem*r Vereinskollegen*in sehr dankbar. Ihr habt ein großes Turnier geplant und er*sie hat sich hervorragend um den Kartenvorverkauf gekümmert. Auf deine*n Kollegen*in war schon immer Verlass. 	You are very grateful to your club colleague. You have planned a big tournament and he*she did an excellent job of selling tickets in advance. You have always been able to rely on your colleagues.	{'neg': 0.0, 'neu': 0.821, 'pos': 0.179, 'compound': 0.7902}	emotional
Weforshank	Du bist zwar schon erwachsen, aber trotzdem fühlst du dich geborgen und geliebt, wenn deine Mutter dich umarmt. Es fühlt sich wie zu Hause an.	Although you are already grown up, you still feel safe and loved when your mother hugs you. It feels like home.	{'neg': 0.0, 'neu': 0.576, 'pos': 0.424, 'compound': 0.91}	emotional
Plüpp	Eine Tourist fragt dich auf Englisch nach dem Weg. Du bist überrumpelt und machst einige Fehler, was dich weiter verunsichert.	A tourist asks you for directions in English. You are caught off guard and make some mistakes, which further unsettles you.	{'neg': 0.116, 'neu': 0.884, 'pos': 0.0, 'compound': -0.3612}	neutral
Skibt	Dein*e beste*r Freund*in ist erleichtert über eine glatte 1,0 für seine*ihre Abschlussarbeit. Du hast mitgefiebert und freust dich unheimlich für sie*ihn.	Your best friend is relieved that they got a straight 1.0 for their thesis. You shared the excitement and are incredibly happy for her*him.	{'neg': 0.0, 'neu': 0.427, 'pos': 0.573, 'compound': 0.9661}	emotional
Namistell	Du entdeckst in einem alten Fotoalbum einen Brief deiner geliebten Oma. Du siehst ihre vertraute Handschrift und schwelgst in liebevollen Erinnerungen.	You discover a letter from your beloved grandmother in an old photo album. You see her familiar handwriting and revel in loving memories.	{'neg': 0.0, 'neu': 0.735, 'pos': 0.265, 'compound': 0.802}	emotional
Struk	Du fährst mit deinem*r besten Freund*in zum Bahnhof, um nach Paris zu fahren. Ihr seid total aufgedreht und macht tolle Pläne. Ihr könnt das Wochenende kaum erwarten.	You go to the train station with your best friend to go to Paris. You guys are super excited and making great plans. You can't wait for the weekend.	{'neg': 0.0, 'neu': 0.574, 'pos': 0.426, 'compound': 0.9571}	emotional
Mölauzegt	Du hast das Gericht versalzen und es schmeckt furchtbar. Du bist sauer, weil alles vergeudet ist. Ärgerlich schmeißt du alles in den Müll.	You oversalted the dish and it tastes awful. You're mad because it's all wasted. Annoyed you throw everything in the trash.	{'neg': 0.414, 'neu': 0.586, 'pos': 0.0, 'compound': -0.9001}	emotional
Bingsemöl	Du setzt dich selbst unter Druck, weil du eine Bewegung im Sport nicht hinkriegst. Du übst sie immer wieder und bleibst hartnäckig, obwohl du erschöpft bist. Du bist gereizt.	You put yourself under pressure because you can't do a movement in a sport. You practice them over and over again and persevere even though you are exhausted. you are irritated	{'neg': 0.228, 'neu': 0.772, 'pos': 0.0, 'compound': -0.7717}	emotional
Iberletsch	Du bist total in eine*n Schauspieler*in verknallt. Du denkst darüber nach, seine*ihre weichen Lippen zu spüren. Du begehrst ihn*sie sehr. 	You have a crush on an actor. You think about feeling his*her soft lips. You desire him*her very much.	{'neg': 0.077, 'neu': 0.721, 'pos': 0.202, 'compound': 0.3818}	neutral
Troff	Du hast beschlossen, mit deinem*r Partner*in zusammenzuziehen. Es ist ein aufregender Schritt und du fühlst dich entschlossen und empfindest Vorfreude für die Zukunft. 	You have decided to move in with your partner. It's an exciting step and you feel determined and excited for the future.	{'neg': 0.0, 'neu': 0.704, 'pos': 0.296, 'compound': 0.7906}	emotional
Odef	Du hast angefangen, Yoga zu machen. Du stellst fest, dass sich deine Haltung und deine Balance verbessert haben. Du freust dich über deinen Fortschritt und bist stolz!	You started doing yoga. You notice that your posture and balance have improved. You are happy about your progress and proud!	{'neg': 0.0, 'neu': 0.567, 'pos': 0.433, 'compound': 0.9184}	emotional
Faube	Du sitzt in der Biblothek und dir sitzt dein Schwarm gegenüber. Eure Blicke treffen sich und ihr werdet beide rot. Du würdest dich sehr freuen, wenn er*sie dich anspricht.	You're sitting in the library and your crush is sitting across from you. Your eyes meet and you both blush. You would be very happy if he*she spoke to you.	{'neg': 0.048, 'neu': 0.834, 'pos': 0.119, 'compound': 0.5256}	emotional
Wunicher	Du verzweifelst, weil deine arrogante Schwiegermutter beim Nachmittagskaffee sicher wieder abfällig mit dir reden wird. Du überlegst, eine Erkältung vorzutäuschen, um nicht hingehen zu müssen.	You despair because your arrogant mother-in-law is sure to talk derogatory to you again over afternoon coffee. You consider faking a cold to avoid going.	{'neg': 0.33, 'neu': 0.597, 'pos': 0.072, 'compound': -0.802}	emotional
Bisknirgo	Du hast Tagebuch geführt und alle kreisenden Gedanken aufgeschrieben, um sie loszulassen. Jetzt fühlst du dich befreit und beruhigt.	You kept a diary and wrote down all the circling thoughts in order to let them go. Now you feel liberated and calmed.	{'neg': 0.0, 'neu': 0.89, 'pos': 0.11, 'compound': 0.3818}	neutral
Ferandsor	Dein*e Vater*Mutter hat eure Familie verlassen, als du klein warst. Jetzt sucht er*sie wieder Kontakt. Du misstraust ihm*ihr und hast Angst, wieder enttäuscht zu werden.	Your father*mother left your family when you were little. Now he*she is looking for contact again. You distrust him*her and are afraid of being disappointed again.	{'neg': 0.197, 'neu': 0.803, 'pos': 0.0, 'compound': -0.7096}	emotional
Vul	Es gibt Streit in deinem Freundeskreis. Du bist unsicher, was du sagen sollst. Du willst niemanden verletzten. Du bist empfindlich und besorgt.	There is a fight in your circle of friends. You are unsure what to say. You don't want to hurt anyone. You are sensitive and concerned.	{'neg': 0.184, 'neu': 0.631, 'pos': 0.185, 'compound': 0.2626}	neutral
Neif	Du scheust keine Kosten und Mühen, um deinem Vater ein lange gewünschtes Bücherregal zu bauen. Du kaufst hochwertige Materialien und schaust motiviert Tutorials. Er hat es verdient.	You spare no expense or effort to build your father a long-desired bookshelf. You buy high-quality materials and watch motivated tutorials. He deserves it.	{'neg': 0.084, 'neu': 0.802, 'pos': 0.115, 'compound': 0.2023}	neutral
Zimerhubst	Du hast letzte Nacht nicht geschlafen, weil du dich am Abend mit deinem*r Partner*in gestritten hast. Du fühlst dich völlig kraftlos und hilflos. Du kannst vor Erschöpfung kaum die Augen offen halten.	You didn't sleep last night because you had an argument with your partner in the evening. You feel completely powerless and helpless. You can hardly keep your eyes open from exhaustion.	{'neg': 0.303, 'neu': 0.697, 'pos': 0.0, 'compound': -0.8947}	emotional
Zwelde	Du hattest in der Mittagspause einen fantastischen Tagtraum davon, wie du am Wochenende mit deinen Freunden Spaß haben wirst. Das motiviert dich für die Arbeit.	You had an amazing lunchtime daydream about how you're going to have fun with your friends over the weekend. This motivates you to work.	{'neg': 0.0, 'neu': 0.673, 'pos': 0.327, 'compound': 0.8807}	emotional
Herklögen	Du gehst nach Feierabend mit ein paar netten Kollegen aus. Du empfindest tiefe Zuneigung, die Kollegen sind fast wie Familie.	You go out after work with some nice co-workers. You feel deep affection, your colleagues are almost like family.	{'neg': 0.0, 'neu': 0.656, 'pos': 0.344, 'compound': 0.813}	emotional
Preier	Du sehnst dich nach der Aufmerksamkeit deines Schwarms. Du ignorierst ihn*sie stur, um deinen Stolz zu wahren. Innerlich zerreißt es dich, nicht mit ihm*ihr zu reden.	You crave your crush's attention. You stubbornly ignore him*her to keep your pride. It tears you up inside not to talk to him*her.	{'neg': 0.241, 'neu': 0.674, 'pos': 0.085, 'compound': -0.5267}	emotional
Muschürdur	Du machst dich gerade für das Bett fertig, als dir auf einmal nach Weinen zumute ist. Du hast keine Ahnung, warum du so niedergeschlagen bist. Du fühlst dich entkräftet und bist verwirrt. 	You're getting ready for bed when you suddenly feel like crying. You have no idea why you're so down. You feel drained and confused.	{'neg': 0.305, 'neu': 0.544, 'pos': 0.151, 'compound': -0.6249}	emotional
Ismiprämpf	Du hast eine Überraschungsparty organisiert, um deinem Bruder eine Freude zu machen. Du gehst immer wieder nervös zum Fenster und schaust, wo er bleibt. Du kannst es kaum erwarten, sein Lächeln zu sehen.	You organized a surprise party to please your brother. You keep going nervously to the window and see where it is. You can't wait to see his smile.	{'neg': 0.048, 'neu': 0.663, 'pos': 0.289, 'compound': 0.7906}	emotional
Glühm	Du hast dich für einen Mittagsschlaf ins Bett gelegt, als es an der Tür klingelt. Das muss einer der Nachbarn sein. Du hast keinen Bock tagsüber im Pyjama die Tür zu öffnen und lauschst angespannt, ob es nochmal klingelt.	You're in bed for a nap when the doorbell rings. That must be one of the neighbors. You don't feel like opening the door in your pajamas during the day and listen intently to see if the doorbell rings again.	{'neg': 0.053, 'neu': 0.947, 'pos': 0.0, 'compound': -0.2755}	neutral
Rugliebast	Du musst bei einem Facharzt anrufen, weil du dringend einen Termin brauchst. Gereizt machst du dir Notizen, bevor du die Nummer wählst. Du willst dich nicht abwimmeln lassen.	You need to call a specialist because you urgently need an appointment. Irritated, you take notes before dialing the number. You don't want to be put off.	{'neg': 0.148, 'neu': 0.806, 'pos': 0.046, 'compound': -0.4445}	neutral
Wumeizauch	Du streitest in der Bahn am Telefon mit deinem*r Partner*in. Plötzlich sagt der Passagier neben dir, dass ihr besser Schluss machen solltet, wenn ihr so unglücklich seid. Du fühlst dich bloßgestellt.	You argue on the phone with your partner on the train. Suddenly the passenger next to you says that you'd better break up if you're so unhappy. you feel exposed	{'neg': 0.202, 'neu': 0.718, 'pos': 0.08, 'compound': -0.5293}	emotional
Häugnung	Du wartest am Bahnhof auf deinen Zug und beobachtest, wie ein junger Mann seine Partnerin mit einem Strauß Rosen abholt. Sie springt ihm lachend in die Arme. Es ist ein wunderschöner Moment und du bist tief berührt.	You are waiting for your train at the station and watch as a young man picks up his partner with a bouquet of roses. She jumps into his arms, laughing. It is a beautiful moment and you are deeply touched.	{'neg': 0.0, 'neu': 0.831, 'pos': 0.169, 'compound': 0.7964}	emotional
Wupforau	Du gehst auf ein Blind Date und bist überrascht, wie toll ihr beide harmoniert. Du kannst dir gut vorstellen, dass sich daraus etwas Wundervolles entwickelt.	You go on a blind date and are surprised at how great the two of you get along. You can well imagine that something wonderful will develop from this.	{'neg': 0.072, 'neu': 0.613, 'pos': 0.315, 'compound': 0.8442}	emotional
Bismirbiel	Du bist hungrig und hast Essen bestellt. Als die Mail kommt, dass heute nicht geliefert werden kann, verzweifelst du fast vor Enttäuschung und Empörung.	You are hungry and have ordered food. When the mail comes that delivery cannot be made today, you almost despair with disappointment and indignation.	{'neg': 0.287, 'neu': 0.713, 'pos': 0.0, 'compound': -0.8148}	emotional
Enkmitas	Du wolltest vor deiner Familie mit etwas prahlen, das du an der Uni gelernt hast. Jetzt kommst du nicht auf den richtigen Begriff. Das beschämt und verunsichert dich.	You wanted to brag to your family about something you learned in college. Now you're not getting the right term. It embarrasses and upsets you.	{'neg': 0.184, 'neu': 0.816, 'pos': 0.0, 'compound': -0.6369}	emotional
Mege	Du hast Freunde zu einem gemeinsamen Abendessen eingeladen. Deine Mutter hat angeboten, einen Salat und Nachtisch beizusteuern. Sie bringt beides pünktlich vorbei. Sie ist ein Schatz!	You invited friends to dinner together. Your mother offered to contribute a salad and dessert. She delivers both on time. She's a darling!	{'neg': 0.0, 'neu': 0.725, 'pos': 0.275, 'compound': 0.8016}	emotional
Weforshank	Dein Baby umschließt mit seiner winzigen Hand zärtlich einen deiner Finger. Du bist von Glück, Liebe und Zuneigung erfüllt.	Your baby gently encloses one of your fingers in his tiny hand. You are filled with happiness, love and affection.	{'neg': 0.0, 'neu': 0.463, 'pos': 0.537, 'compound': 0.9545}	emotional
Plüpp	Du sollst im Sprachkurs deine Hausaufgaben vortragen. Du zögerst und hast einen Kloß im Hals. Vor den anderen zu sprechen ist dir peinlich.	You should present your homework in the language course. You hesitate and have a lump in your throat. You feel embarrassed to speak in front of others.	{'neg': 0.161, 'neu': 0.839, 'pos': 0.0, 'compound': -0.5574}	emotional
Skibt	Ein*e Freund*in erzählt dir, dass er*sie befördert wurde. Du gönnst es ihm*ihr und bist begeistert, dass seine*ihre harte Arbeit so wertgeschätzt wird.	A friend tells you that he*she got a promotion. You treat him/her and are thrilled that his/her hard work is so appreciated.	{'neg': 0.048, 'neu': 0.509, 'pos': 0.443, 'compound': 0.9125}	emotional
Namistell	Du entdeckst beim Umräumen überraschend Schokoladeneis im Gefrierfach. Es macht dich glücklich, dass du unerwartet etwas Leckeres naschen kannst.	When rearranging things, you surprisingly discover chocolate ice cream in the freezer. It makes you happy that you can unexpectedly snack on something delicious.	{'neg': 0.0, 'neu': 0.686, 'pos': 0.314, 'compound': 0.8625}	emotional
Struk	Du gehst in Gedanken deine Packliste durch. Du freust dich wie ein kleines Kind auf den bevorstehenden Urlaub und sehnst dich nach Erholung und leckerem Essen.	You go through your packing list in your mind. You look forward to the upcoming vacation like a little child and long for relaxation and delicious food.	{'neg': 0.0, 'neu': 0.706, 'pos': 0.294, 'compound': 0.8625}	emotional
Mölauzegt	Du ärgerst dich maßlos über dich selbst, weil du wieder darin versagt hast, deine Neujahrsvorsätze durchzuziehen. Es ist dir peinlich vor deinen Freunden.	You're mad at yourself for failing to keep your New Year's resolutions. You're embarrassed in front of your friends.	{'neg': 0.332, 'neu': 0.554, 'pos': 0.114, 'compound': -0.7096}	emotional
Bingsemöl	Du rechnest immer wieder dieselbe mathematische Herleitung. An einer Stelle hast du immer einen Blackout. Ärgerlich fragst du dich, wie du so dämlich sein kannst.	You calculate the same mathematical derivation over and over again. At one point you always have a blackout. You angrily wonder how you can be so stupid.	{'neg': 0.23, 'neu': 0.77, 'pos': 0.0, 'compound': -0.8001}	emotional
Iberletsch	Du siehst deinen Schwarm an der Uni. Die Vorstellung, ihn*sie zu küssen, ist unwiderstehlich. Du fühlst dich so sehr zu ihm*ihr hingezogen.	You see your crush at college. The idea of ​​kissing him*her is irresistible. You are so attracted to him/her.	{'neg': 0.068, 'neu': 0.677, 'pos': 0.255, 'compound': 0.6615}	emotional
Troff	Nach ewigem Hin und Her hast du ein neues Fahrrad bestellt. Du bist sehr zufrieden mit deiner Wahl und stolz, das richtige Modell gefunden zu haben.	After endless back and forth you have ordered a new bike. You are very satisfied with your choice and proud to have found the right model.	{'neg': 0.0, 'neu': 0.788, 'pos': 0.212, 'compound': 0.7346}	emotional
Odef	Du hast nach einiger Zeit der Arbeitslosigkeit den Job deiner Träume und bist selbstsicher, weil du dein lang ersehntes Ziel erreicht hast und es bergauf geht.	After a period of unemployment you have the job of your dreams and you are self-confident because you have reached your long-awaited goal and things are going uphill.	{'neg': 0.087, 'neu': 0.687, 'pos': 0.227, 'compound': 0.5719}	emotional
Faube	Du hast dich mit deiner Schwester gestritten, aber eigentlich tut es euch beiden leid. Immer wieder schaut ihr erwartungsvoll zueinander herüber. Ihr scheint beide darauf zu hoffen, dass der*die andere sich entschuldigt.	You had a fight with your sister, but actually you are both sorry. You keep looking at each other expectantly. You both seem to be hoping that the other will apologize.	{'neg': 0.094, 'neu': 0.753, 'pos': 0.153, 'compound': 0.4678}	neutral
Wunicher	Du bist im Verzug mit einem wichtigen Projekt. Du schleichst dich sehr früh ins Büro, um deine*n unangenehme*n Chef*in und seine*ihre Vorwürfe zu vermeiden.	You're behind on an important project. You sneak into the office very early to avoid your awkward boss and his/her reproaches.	{'neg': 0.17, 'neu': 0.754, 'pos': 0.075, 'compound': -0.3102}	neutral
Bisknirgo	Du hast heute beim Sport alles gegeben. Du bist zufrieden mit deiner Leistung und entspannst dich guten Gewissens auf dem Sofa.	You gave your all in sports today. You are satisfied with your performance and relax on the sofa with a clear conscience.	{'neg': 0.0, 'neu': 0.684, 'pos': 0.316, 'compound': 0.8074}	emotional
Ferandsor	Ein*e Freundin hat dich hintergangen. Er*sie entschuldigt sich bei dir. Du zögerst und bist reserviert, weil du befürchtest, dass er*sie dir wieder wehtun wird.	A friend betrayed you. He*she apologizes to you. You hesitate and reserve because you fear that he*she will hurt you again.	{'neg': 0.392, 'neu': 0.432, 'pos': 0.176, 'compound': -0.7906}	emotional
Vul	Du sitzt einsam und aufgebracht in deiner Wohnung. Immer wieder wälzt du fieberhaft die Geschehnisse. Wie konnte es zu dieser bösen Trennung kommen?	You sit lonely and upset in your apartment. Again and again you feverishly roll over the events. How did this nasty breakup come about?	{'neg': 0.308, 'neu': 0.692, 'pos': 0.0, 'compound': -0.8537}	emotional
Neif	Du entwickelst voller Enthusiasmus die neue Homepage für eine*n Freund*in. Du hast ihn*sie sehr lieb und möchtest, dass die Homepage ihn*sie glücklich macht.	You are enthusiastically developing the new homepage for a friend. You love him*her very much and want the homepage to make him*her happy.	{'neg': 0.0, 'neu': 0.511, 'pos': 0.489, 'compound': 0.9457}	emotional
Zimerhubst	Du warst letzte Nacht sehr unruhig, weil deine Mutter im Krankenhaus ist und du dir Sorgen um sie machst. Du fühlst dich elend und weißt nicht, wie du es durch den Tag schaffen sollst.	You were very restless last night because your mother is in the hospital and you are worried about her. You feel miserable and don't know how to make it through the day.	{'neg': 0.212, 'neu': 0.788, 'pos': 0.0, 'compound': -0.7778}	emotional
Zwelde	Du hast letzte Nacht von einem romantischen Date mit deinem Schwarm geträumt. Du lächelst selig und wünschst, du könntest immer so schön träumen.	You dreamed of a romantic date with your crush last night. You smile blissfully and wish you could always dream like this.	{'neg': 0.055, 'neu': 0.517, 'pos': 0.428, 'compound': 0.8689}	emotional
Herklögen	Du bist am Wochenende auf einem Turnier mit deinem Team. Du genießt diesen Tag im Kreis deiner Freunde. Die vertraute Gesellschaft tut dir gut und du bist glücklich. 	You are at a tournament with your team at the weekend. You enjoy this day with your friends. The familiar company is good for you and you are happy.	{'neg': 0.0, 'neu': 0.65, 'pos': 0.35, 'compound': 0.9169}	emotional
Preier	Du bekommst eine Nachricht von deinem Schwarm. Du gibst vor, keine Zeit zum Antworten zu haben, um nicht verzweifelt zu wirken. Du vermisst ihn*sie ganz schrecklich.	You get a message from your crush. You pretend you don't have time to reply so as not to seem desperate. You miss him*her terribly.	{'neg': 0.281, 'neu': 0.652, 'pos': 0.067, 'compound': -0.6414}	emotional
Muschürdur	Auf dem Heimweg hast du plötzlich einen Kloß im Hals und fühlst dich bedrückt. Du bist ratlos, woher das auf einmal kommt und bist befangen.	On the way home you suddenly have a lump in your throat and feel depressed. You're at a loss as to where it's coming from and you're self-conscious.	{'neg': 0.189, 'neu': 0.811, 'pos': 0.0, 'compound': -0.6808}	emotional
Ismiprämpf	Du sitzt in einer Kneipe und wartest darauf, dass dein*e beste Freund*in endlich ankommt. Du freust dich unheimlich auf das lang ersehnte Wiedersehen und guckst immer wieder aufgeregt zu Tür.	You're sitting in a bar waiting for your best friend to finally arrive. You are really looking forward to the long-awaited reunion and keep looking excitedly at the door.	{'neg': 0.0, 'neu': 0.7, 'pos': 0.3, 'compound': 0.8934}	emotional
Glühm	Du bist als Kind alleine zu Hause und es klingelt. Du darfst niemandem die Tür öffnen. Du bist ganz leise und dein Herz klopft, während du ängstlich hoffst, dass die Person endlich weggeht.	You are home alone as a child and the doorbell rings. You are not allowed to open the door for anyone. You are very quiet and your heart is pounding as you anxiously hope that the person will finally go away.	{'neg': 0.089, 'neu': 0.845, 'pos': 0.066, 'compound': 0.0}	neutral
Rugliebast	Du musst mit deinem*r Partner*in Schluss machen. Du spielst das  Gespräch mehrfach schlecht gelaunt in deinem Kopf durch. Du willst ihn*sie nicht unnötig verletzen.	You have to break up with your partner. You replay the conversation in your head in a bad mood. You don't want to hurt him*her unnecessarily.	{'neg': 0.16, 'neu': 0.746, 'pos': 0.094, 'compound': -0.2373}	neutral
