	Wort	Emotionalität	Definition	Features	Anzahl Teilnehmer	Index der Scores	geordnete Indizes	Durchschnittsindex	Medianindex	unter Top 10 Prozent	Insgesamte Anzahl der Indizes	Scores	Durchschnittsscore	Gesamtdurchschnittsscore
0	Wunicher	emo	stalking, anxiety, fear, paranoia, bullying, dread	"['responsibility, growing up, choice, consideration, looking ahead, consequences', 'gratitude, no more worries, trust, respect, conscientiousness, being there for each other, support', 'responsibility, burden, being able to achieve something, change', 'push, physical proximity, impulse, inappropriate, retreat', 'annoying, exhausting, self-critical, doubts', ""meant nicely, can also be annoying, know-it-all, strange feeling, as if you couldn't do it alone, can help"", 'relaxation, love, friendship, cuddling, being yourself, trust, serenity, calm, connectedness, feeling good', 'plan, order, think of everything, no surprises, perfectly prepared', 'human, understandable, potential for conflict', ""headache, restlessness, heavy breathing, everything is contracting, won't get better until it's over, racing thoughts, it won't be as bad as you think, just do it, no solution, distraction"", 'sauer', 'unsatisfactory, impatience, annoying, you want to end', 'excited, checking, anticipation, suitcase, vacation, plane, waiting, impatient, tense, planning', 'joy, laughter, cozy, cuddly, warm, soft, sleep', 'trusting, friend, family, partner, carefree, free thoughts, relaxed, secure', 'helpless, empty, confusion, questions, wanting to fathom, melancholic', ""measures, damn, it's a shame, what should i do, back and forth, thoughts circling, right and wrong, why today, i would love to, reason, conscience, conflict, weigh up, insecure, sad, envious, regretful"", 'unsatisfactory, stressful, negative, aggravated mental health, despair, change, vicious cycle', 'lost in thought, trying to remember dream, joy or fear depending on dream, shaky, sleepy, exhausted', 'date, partner, strangers, closeness, distance, tenderness, leg, shoulder, hand, cinema', 'physical or psychological, positive or negative, surprised, worried', 'tired, safe, lying in bed, warm, cuddly, reading something, the body is heavy, tired eyes', 'joy, happiness, nice feeling, like christmas, find money, winter jacket, be happy, be satisfied, share your happiness, be surprised, unexpected', 'swedish, uncomfortable, mix of both as a solution, frustrating, french, exhausting, annoying, demanding, necessary, fades away with practice', ""motivation, overcome the weaker, good is not always good enough, was that really my best?, is it better, i can do that and i'm good at it"", 'trust, confidence, no worries, reliability', 'foreign language, speaking in front of others, social anxiety, fear of embarrassment, insecurity, lack of practice', 'angry, annoyed, tense, negative feeling', 'soulmates, love at first sight, longing, secure, confident, happy, overwhelmed, pink', 'fear, anger, caution, confusion, discipline', 'conversations, anticipation, personality, assessing people, mutual friends, workplace, purposeful relationship, what does the other person think about a, disappointment, moving', 'spontaneous, inexplicable, temperament, uncontrolled, slips, mistakes']"	32	[621, 279, 1098, 1549, 1384, 974, 214, 1236, 1675, 27, 1754, 1501, 1012, 1074, 604, 204, 10, 619, 839, 926, 1867, 375, 157, 475, 46, 957, 196, 1511, 778, 1034, 534, 1061]	[10, 27, 46, 157, 196, 204, 214, 279, 375, 475, 534, 604, 619, 621, 778, 839, 926, 957, 974, 1012, 1034, 1061, 1074, 1098, 1236, 1384, 1501, 1511, 1549, 1675, 1754, 1867]	830	882.5	9.0	1953	[0.3899337947368622, 0.41616737842559814, 0.3627506196498871, 0.3405536115169525, 0.3481499254703522, 0.36828142404556274, 0.42234042286872864, 0.356026291847229, 0.3328492343425751, 0.46225878596305847, 0.32649680972099304, 0.34263935685157776, 0.36653342843055725, 0.36380767822265625, 0.39099985361099243, 0.42354583740234375, 0.4731275141239166, 0.3900250196456909, 0.376347154378891, 0.37150755524635315, 0.31472933292388916, 0.40772417187690735, 0.4289740324020386, 0.40012088418006897, 0.4518204629421234, 0.36980900168418884, 0.42419493198394775, 0.34222984313964844, 0.37901195883750916, 0.3657577335834503, 0.3956286609172821, 0.36446812748908997]	0.3834003387019038	0.3843884454249125
1	Neif	emo	passion, joy, happiness, love, gratitude, commitment	"['beautiful, tired, morning, bed, good mood', 'anticipation, boredom, waiting, window, car, friendship, visit, relatives, time', 'reflect, improve', 'empathy, empathy, connectedness, relate, friendship, understanding, security', 'well prepared', 'pressure, forced, intrinsic?', ""when you're nervous, always affects others, you don't want to be a burden to anyone, you want to make a good impression, nervous"", 'people, anxiety, past, hostile, worry, stomach ache, annoyed, no desire, drama', ""oh, surprise, yes, i wouldn't have thought of it, joy"", 'considerate, courteous', 'struck by lightning, energetic, wanderlust, grinning, good time, jittery, child, butterflies in the stomach, music, dancing, embracing the world, family', 'bilingual', 'exciting, anticipation, great feeling, impatient', 'bed, morning, serenity, relaxation, good start, sun, nice dream, good mood, refreshed, exciting', 'insecurity, fear of making mistakes, training, practice', 'realization, sad, happy, indecisive, fear, learning, experience', 'calm, protection, being myself, laughter, friendship, family', ""tired, weakly sluggish, indifferent, melancholic, knocked out, at peace, satisfied and dissatisfied, change of mood, reproach, nagging thought, no matter, new day new happiness, i'll do tomorrow, pleasure and bad"", 'confusion, reality and dream, torn, comfortable, uncomfortable', 'negative, brooding, pacing, not being able to sleep, negative thoughts, stomach ache, frustration, thoughts circling, feeling unwell, shaky, nausea, reduced ability to concentrate', 'human, warm-hearted, joy, sadness, disgust, fear, cold, warm, therapy, primal fear, imprinting, upbringing', 'courteous, attentive, annoying, pushy, mansplaining', 'worry before that, free at last, relief, you create something, odef', 'vacation, traveling, reunion, adventure, discovering new things, excited, positive, anticipation, happy, relaxing, longing, wanderlust', 'relatively neutral, mirror neurons, humanity, influence, social cognition, humanity', 'satisfaction, pride, frustration, not enough, could have been better, more..., security, motivation', 'temptation, feeling', 'nightmare, quickly forgotten, dream journal, dream catcher, tell others', 'motivated, enthusiastic, spur, fun, anticipation, when the project is finished, effort', 'overreaction, impulsive, upset, irritable, angry, over the top, unnecessary', 'excitement, expectation, dreaming, containment, escape', 'joy, happiness, marriage, getting married, relationships, jealousy, romance films, kitsch, music', 'happiness, joy, pride, victory, success']"	33	[1506, 1087, 1241, 1371, 1948, 490, 232, 706, 355, 884, 148, 1949, 1634, 265, 1410, 978, 1393, 1, 1611, 495, 239, 751, 27, 368, 40, 1242, 1769, 1483, 1128, 938, 1661, 1307, 1064]	[1, 27, 40, 148, 232, 239, 265, 355, 368, 490, 495, 706, 751, 884, 938, 978, 1064, 1087, 1128, 1241, 1242, 1307, 1371, 1393, 1410, 1483, 1506, 1611, 1634, 1661, 1769, 1948, 1949]	961	1064.0	9.0	1953	[0.35330164432525635, 0.3711937963962555, 0.36526748538017273, 0.35957953333854675, 0.29913565516471863, 0.3989316523075104, 0.4159194827079773, 0.3871026933193207, 0.40733176469802856, 0.37968218326568604, 0.42564746737480164, 0.29803767800331116, 0.34687456488609314, 0.41355636715888977, 0.3579561114311218, 0.3760717809200287, 0.3586415946483612, 0.5143126845359802, 0.3482398986816406, 0.398787260055542, 0.41509756445884705, 0.3853873014450073, 0.45490220189094543, 0.40645626187324524, 0.4476988613605499, 0.36521267890930176, 0.33693474531173706, 0.3544694185256958, 0.36965829133987427, 0.3773941397666931, 0.34533998370170593, 0.36262354254722595, 0.3721845746040344]	0.3808766928586093	0.3843884454249125
2	Zimerhubst	emo	insomnia, depression, exhaustion, anxiety, loneliness, sadness	"['effort, joy, satisfaction, meaning', 'contentment, being relaxed, no worries, quiet, stillness, exertion falls off', 'happiness, empathy, sadness, understanding, good friends', 'feeling, subconscious, crying, despair, being alone, being overwhelmed', 'forward looking, exhausting', 'surveillance, wanting to be prepared, patient, compulsive, control', 'isolation, quiet, loneliness, avoiding hustle and bustle, social anxiety, silence, not in the mood, stressed, annoying', 'time, power, goal', 'pride, progress, process', 'nervous, palpitations, scenarios, it always turns out differently than expected, no self-confidence, no inner peace, preparation, practicing how to appear, job interview, important situations', 'learn, reflected', 'means to an end, love, attraction', 'nightmare, feeling unwell, thinking, being sad, exhaustion, bad mood, hard day, bed, worry, stress, exam period', 'excitement, joy, jittery', 'pride, courage, strength, confident, happy, encouraged, initiative, secure, determined, without distractions, eagerness, time', 'twitch, inappropriate, hold back, under control, uncomfortable, need', 'free, peaceful, contented, stillness, carefree, weightless, comfortable, soft, light, wanting to hold, more of it, happiness, here and now, limitless, being me, no judgment', 'quiet, peace, unfamiliar, inner tension, freedom, think, release thoughts', 'exhausted, grumpy, bad-tempered, irritable, sluggish, tired, unwell', 'distinctiveness, pride, communication, aptitude, education, holiday abroad, culture, spain, england/america', 'anticipation, excitement, caring, curiosity, impatience', 'awkward, awkward, hiding, draw curtains, being quiet, not wanting to be heard, awkward, wanting to get out of the way', 'diligence, compulsion, perfectionism, high demands on oneself, practice, restlessness, exaggerate, allow yourself a break, incentive, goal, fatigue', 'namaste, nepal, finding money, joy, unexpected, not looking for things', 'tenderness, emotion, empathy, comparison, thoughtful', 'stress, anxiety, tears, stress, thoughts, fatigue', 'for no reason, frustration, introspection, own feelings, reflection', 'joy, surprise, astonishment, enthusiastic, things long forgotten are rediscovered, melancholy, memories', 'annoyed, unnecessary, angry, curiosity, gossip', 'excitement, warmth, sexuality, intimacy', ""impolite, patronizing, anger, know-it-alls, conflicts, often well intentioned, parents, people often don't know any better, restraint difficult"", 'stress, uncomfortable, childish, unnecessary']"	32	[1077, 274, 1236, 1082, 1752, 797, 267, 1719, 1727, 344, 1847, 933, 985, 1154, 170, 1301, 87, 1036, 612, 212, 1270, 315, 257, 420, 1388, 1100, 794, 449, 1487, 915, 340, 1191]	[87, 170, 212, 257, 267, 274, 315, 340, 344, 420, 449, 612, 794, 797, 915, 933, 985, 1036, 1077, 1082, 1100, 1154, 1191, 1236, 1270, 1301, 1388, 1487, 1719, 1727, 1752, 1847]	891	959.0	3.0	1953	[0.38117438554763794, 0.4291856586933136, 0.37377655506134033, 0.3805884122848511, 0.3445397615432739, 0.39534813165664673, 0.42957499623298645, 0.3474067151546478, 0.34637197852134705, 0.4233716130256653, 0.33596426248550415, 0.3878457844257355, 0.3856337070465088, 0.3775258958339691, 0.4388428032398224, 0.3701644539833069, 0.4513089954853058, 0.38313841819763184, 0.4047269821166992, 0.43488240242004395, 0.3718726336956024, 0.4248206317424774, 0.4302949905395508, 0.4182751774787903, 0.3656630516052246, 0.3801501989364624, 0.39545971155166626, 0.4165177345275879, 0.36086323857307434, 0.38919323682785034, 0.4235285818576813, 0.3758573532104492]	0.39293338917195797	0.3843884454249125
3	Zwelde	emo	happiness, joy, peace, ecstasy, meditation, sleep	"['cry, anger, joy, overreact, mood', 'waiting, being impatient, joy, tension, nervousness, anticipation, checklist, baggage', 'too much, time out, rest, social interactions, recharge battery, isolated, introverted', 'frustrating, forgotten, omitted, reminder', 'best dream', 'self-efficacy, effort, paying off, positive, feeling good, confidence', 'hug, loving gesture, wedding, nice feeling, i am infected by their happiness, smile, cozy, security, emotional warmth, two people, partner, friendship', 'effort, learning, applying knowledge, being proud, exhausting, more cosmopolitan, variety, challenge', 'fear, uncertainty, caution, safe haven, closed', 'first kiss, beautiful, warm feeling', 'hysterical, annoying, restless, emotionally unstable, afraid of saying the wrong thing, bad experiences, attention seeking, focus, sick, therapy', 'exciting, joy', 'strange, unconscious processes make themselves visible, avoid, unpleasant', ""friends, postman, impatience, anticipation, something is dragging, checking, asking, time doesn't pass, sitting around, window, door"", 'purposeful, planning, disciplined', 'joy, time unfortunately already over, dreaming again, why woke up, pondering, why?, meaning', 'uncomfortable, escape, cautious, guilty conscience, wanting to be alone', ""shit, annoys me, why can't it be better, frustration, anger, restlessness, uneasiness, can burst, where to take me, be annoyed"", 'beautiful, joy, empathy, envy, wants too', 'joy, excitement, tension, self-confidence, burden falls off', 'peace, serenity, relaxation, drugs, friendship, partnership, sleep, dream, family, cuddling, tenderness', 'human, frustration, angry, ambition, dogged, failures, sad', 'annoying, exhausting, uncomfortable in conversation, is on the tip of your tongue, you want to know, what the word is, relief, when someone says the word', 'neighbors, uncomfortable feeling, avoiding, the longest line at the checkout, impatience, uneasiness, unsympathetic, detours, avoidance', 'obstacle, remove, setback, perseverance, research', 'pure adrenaline, rush of ideas, joy, excitement, positive stress, motivation', 'progress, success, goal, joy, good feeling, determination, diligence', 'affection, family, cohesion, together, important for children, caregivers, development', 'impatience, joy, running around, restless, active', 'love, interest, focused, interested, meaningful, identity, work', 'discomfort, anger, prevention', 'pain, sluggish, exhausted, headache, banged up, alarm clock too early, dragging through the day, important assignment, too long at the pc, dry mouth, lack of energy, stress', 'childish, communication, transparency, lies, openness']"	33	[1577, 1452, 965, 1534, 1920, 481, 44, 1450, 1315, 1003, 438, 1840, 1297, 799, 1604, 470, 676, 553, 1717, 569, 83, 1581, 296, 60, 1726, 487, 689, 446, 1576, 1410, 1028, 385, 1698]	[44, 60, 83, 296, 385, 438, 446, 470, 481, 487, 553, 569, 676, 689, 799, 965, 1003, 1028, 1297, 1315, 1410, 1450, 1452, 1534, 1576, 1577, 1581, 1604, 1698, 1717, 1726, 1840, 1920]	1005	1003.0	9.0	1953	[0.3644663691520691, 0.3705994784832001, 0.39277926087379456, 0.3671802282333374, 0.3274639844894409, 0.4186505675315857, 0.46551328897476196, 0.3707536458969116, 0.37696534395217896, 0.39145949482917786, 0.4213832914829254, 0.3420509099960327, 0.37765610218048096, 0.4013541340827942, 0.3628755211830139, 0.4191661775112152, 0.40743961930274963, 0.41392627358436584, 0.3549172580242157, 0.4130108952522278, 0.4553357660770416, 0.36421632766723633, 0.430135041475296, 0.4594954550266266, 0.35419949889183044, 0.41803357005119324, 0.4069456458091736, 0.4205974042415619, 0.36457687616348267, 0.37246274948120117, 0.39008429646492004, 0.4247041344642639, 0.3567401170730591]	0.3932466281182838	0.3843884454249125
4	Herklögen	emo	security, safety, happiness, paranoia, kindness, calm	"['practice, tired, exhausting, study, exchange, contact, new culture, gesture, communicate, translate', 'actually interested, crush, feign disinterest, pretend, getting to know each other, dishonest, company', 'burden, bad mood, listlessness, despair, bed, doing nothing, crying', 'surprise, coincidence, item, object, misplaced, forgotten', 'social pressure, uncomfortable, interaction, anxiety', ""many people do, lazy, task, you don't want to see people right now, responsibility"", 'nevertheless, defiance, expectation, ignorance, repress, procrastination, irresponsible, lacking motivation, need', 'great, proud, warm feeling, strong, unstoppable, everything will be fine', 'unpleasant', 'english, spanish, language course, foreign country, embarrassing, silence, laughter, sweating, comparing with others, stuttering, blushing', 'reliable', 'beautiful, exciting', 'missing information, obtain, inform, close gaps, make decisions, tackle, weigh up information, bad decisions, internet, books, ask', 'reflection, honest, expectation, demanding of yourself, open-minded', 'shame, thrill, anticipation, tension, nervous, thoughtful, sad, disrespect, absolutely', 'lying, manipulating, dishonest, uncomfortable, unspoken, concealing', ""perfectionism, unnecessary, can't stop it, compulsion, anger, frustration, ambition, exhaustion, resentment, annoyed, disappointed, wanting"", 'panic, unrealistic, worst case scenario, exaggerated, fear, need to talk about it', 'exciting, exciting, nervous, insecure, shaky, butterflies in the stomach, joy, good mood', 'job, empowerment, joy, fear, confidence, experience, learn, doubt, relief, seek advice', 'relaxation, happy, clear your head, health', 'fear, feelings of inferiority, being aloof, being cautious, talking little about yourself, keeping your distance, distrust, jealousy', 'strengths, skills, demonstrate, use strengths, put things into action', 'meeting ex again, confrontation, avoid, uncomfortable, dodge, procrastinate', 'exciting, unable to do anything, everything takes longer, joy, excitement, hoping, that it will be as expected, constantly looking out the window', 'anxiety, stress, worry, fear of the future', 'again and again, frustration, expectations of oneself, expectations of others, unproductive, talent, practice', 'despair, helplessness, sadness, gray haze over everything, less laughter, withdrawal from family and loved ones, loneliness', 'hesitating, considering, impulse, contact, fear, anger, longing', 'pride, confidence, retrospect, satisfaction', 'being annoyed, uncomfortable, pressure, lectures, mostly in conversation with others, great exertion, tiredness, stress, being on the tongue, looking for similarities', 'aunt, joy, happiness, hug, excitement, positive']"	32	[680, 881, 476, 1687, 1295, 803, 455, 527, 1696, 418, 1916, 1922, 411, 1409, 489, 992, 404, 948, 602, 1089, 1470, 49, 1469, 1024, 59, 1216, 838, 147, 500, 1394, 66, 1698]	[49, 59, 66, 147, 404, 411, 418, 455, 476, 489, 500, 527, 602, 680, 803, 838, 881, 948, 992, 1024, 1089, 1216, 1295, 1394, 1409, 1469, 1470, 1687, 1696, 1698, 1916, 1922]	907	859.5	9.0	1953	[0.38923460245132446, 0.3779299557209015, 0.4029923379421234, 0.337504506111145, 0.3590872883796692, 0.38161981105804443, 0.4044800400733948, 0.39945319294929504, 0.3366272449493408, 0.40721890330314636, 0.30940693616867065, 0.3079240322113037, 0.4077221751213074, 0.35355937480926514, 0.40223386883735657, 0.3727187514305115, 0.40833330154418945, 0.3750997483730316, 0.3935861885547638, 0.3683308959007263, 0.3499903082847595, 0.4514545202255249, 0.35009440779685974, 0.3710034191608429, 0.4486592411994934, 0.362412691116333, 0.37990084290504456, 0.43356838822364807, 0.40108469128608704, 0.35435572266578674, 0.4463353157043457, 0.3365541696548462]	0.38063990231603384	0.3843884454249125
5	Preier	emo	greed, boredom, betrayal, jealousy, cynicism, disappointment	"['practice, patience, learning, perfectionism, hobby, ability', 'stares, observation, strange, stalking, watching a movie, influencer, learning, envy', 'annoyance, anger, hurt, ignore, roll your eyes', 'introverted, detached, quiet, social contacts, conversations, partying, reading, netflix, quiet, independent, feeling unwell', 'desire, longing, excitement', 'uncomfortable, challenge, opportunity to learn from it, you want to show, that you can actually do it better, learning, embarrassing', 'happiness, stillness, feeling good, cozy, carefree, toasty, at home, familiarity, relaxation, peace', 'reality or dream, still tired, details fade', 'open, without adjusting', ""romantic, tingling in the stomach, electric, excitement, everything else doesn't matter, the environment fades out, seductive, playful, film, embarrassing, blushing, mysterious"", 'exciting, anticipation', 'beautiful, romantic, sudden, exciting, stirring, special', ""future, studies, achieve goals, be consistent, be satisfied, pride, something is worthwhile, make an effort, keep at it, don't give up"", 'partner, love, home, trust, relationship, family', 'hope, way out, detour, thoughtful, consider, solution', 'calming, relaxation, division of labor, fair, support, not alone', 'desire, joy, desire, fun, excess, physical closeness, satisfaction, beautiful, warm, intense, strong, suction, being connected, standing still, moment, enjoying, no thought of the same, fantasy', 'weird, tiredness, unproductive, aggressive, irritable, need for sleep, half-closed eyes, regret', 'excitement, negative or positive joy, uplifting', 'empathy, charity, friendship, sympathy, supervisor, job, therapy, partnership', 'unwell, unable to sleep, tense', 'security, security, relaxed, exchange, pleasant, cooking together, eating together, having fun, being familiar', 'pride, evaluation, review, satisfaction, development, decision, be composed, stand by your decision', 'babies, lots of physical contact, wonderful, unfamiliar to some, when women breastfeed in public, important, invisible', 'desperate, anxious, worried, worrying, being alone, why, why now, interpreting from the reason', 'being annoyed, stress, diligence, sadness', 'observe, romance, sympathize, be happy for others, envy, warm hearted, empathy', 'non-verbal communication, prompting, quick and easy communication', 'prevent, uncomfortable, violated privacy', 'saliva, mouth, love, romance, sex, romance movies, lips, daydreams, anticipation, partner, crush, intimacy', 'interpersonal, wordless, instinct, body language']"	31	[1139, 1213, 1805, 773, 1356, 210, 332, 1553, 1833, 279, 1744, 1866, 309, 1800, 1186, 674, 24, 248, 1384, 1052, 1398, 404, 726, 231, 537, 1622, 660, 1862, 1434, 579, 1554]	[24, 210, 231, 248, 279, 309, 332, 404, 537, 579, 660, 674, 726, 773, 1052, 1139, 1186, 1213, 1356, 1384, 1398, 1434, 1553, 1554, 1622, 1744, 1800, 1805, 1833, 1862, 1866]	1025	1139.0	3.0	1953	[0.3779527544975281, 0.37441155314445496, 0.33827438950538635, 0.39560675621032715, 0.3671351671218872, 0.4360242486000061, 0.42448341846466064, 0.3575943112373352, 0.3352136015892029, 0.4283676743507385, 0.3443543314933777, 0.3318445384502411, 0.4263226091861725, 0.33854812383651733, 0.3757351040840149, 0.40181416273117065, 0.4741702973842621, 0.4318923354148865, 0.36564815044403076, 0.3820074200630188, 0.3649137020111084, 0.41957607865333557, 0.39829206466674805, 0.4339171051979065, 0.4097539782524109, 0.3539577126502991, 0.40271925926208496, 0.33213675022125244, 0.3636273741722107, 0.40710967779159546, 0.35755717754364014]	0.38551489768489716	0.3843884454249125
