	Name	Emotionalität	Definition	Features	Anzahl Teilnehmer	Index der Scores	geordnete Indizes	Durchschnittsindex	Median Index	unter Top 10 Prozent	Insgesamte Anzahl der Assoziationen	Scores	Durchschnittsscore	Gesamtdurchschnittsscore
0	Wunicher	emo	['the strong urge to avoid an uncomfortable encounter.', 'attempting to avoid encountering a specific person.']	"['responsibility, growing up, choice, consideration, looking ahead, consequences', 'gratitude, no more worries, trust, respect, conscientiousness, being there for each other, support', 'responsibility, burden, being able to achieve something, change', 'push, physical proximity, impulse, inappropriate, retreat', 'annoying, exhausting, self-critical, doubts', ""meant nicely, can also be annoying, know-it-all, strange feeling, as if you couldn't do it alone, can help"", 'relaxation, love, friendship, cuddling, being yourself, trust, serenity, calm, connectedness, feeling good', 'plan, order, think of everything, no surprises, perfectly prepared', 'human, understandable, potential for conflict', ""headache, restlessness, heavy breathing, everything is contracting, won't get better until it's over, racing thoughts, it won't be as bad as you think, just do it, no solution, distraction"", 'sauer', 'unsatisfactory, impatience, annoying, you want to end', 'excited, checking, anticipation, suitcase, vacation, plane, waiting, impatient, tense, planning', 'joy, laughter, cozy, cuddly, warm, soft, sleep', 'trusting, friend, family, partner, carefree, free thoughts, relaxed, secure', 'helpless, empty, confusion, questions, wanting to fathom, melancholic', ""measures, damn, it's a shame, what should i do, back and forth, thoughts circling, right and wrong, why today, i would love to, reason, conscience, conflict, weigh up, insecure, sad, envious, regretful"", 'unsatisfactory, stressful, negative, aggravated mental health, despair, change, vicious cycle', 'lost in thought, trying to remember dream, joy or fear depending on dream, shaky, sleepy, exhausted', 'date, partner, strangers, closeness, distance, tenderness, leg, shoulder, hand, cinema', 'physical or psychological, positive or negative, surprised, worried', 'tired, safe, lying in bed, warm, cuddly, reading something, the body is heavy, tired eyes', 'joy, happiness, nice feeling, like christmas, find money, winter jacket, be happy, be satisfied, share your happiness, be surprised, unexpected', 'swedish, uncomfortable, mix of both as a solution, frustrating, french, exhausting, annoying, demanding, necessary, fades away with practice', ""motivation, overcome the weaker, good is not always good enough, was that really my best?, is it better, i can do that and i'm good at it"", 'trust, confidence, no worries, reliability', 'foreign language, speaking in front of others, social anxiety, fear of embarrassment, insecurity, lack of practice', 'angry, annoyed, tense, negative feeling', 'soulmates, love at first sight, longing, secure, confident, happy, overwhelmed, pink', 'fear, anger, caution, confusion, discipline', 'conversations, anticipation, personality, assessing people, mutual friends, workplace, purposeful relationship, what does the other person think about a, disappointment, moving', 'spontaneous, inexplicable, temperament, uncontrolled, slips, mistakes']"	32	[[48, 41], [48, 44], [34, 11], [7, 6], [19, 26], [20, 22], [24, 19], [32, 29], [21, 26], [17, 11], [14, 10], [42, 27], [23, 21], [24, 43], [8, 10], [11, 27], [4, 10], [13, 19], [44, 33], [43, 33], [16, 11], [4, 7], [46, 28], [33, 26], [1, 4], [8, 14], [53, 40], [7, 18], [27, 20], [7, 8], [46, 53], [43, 33]]	[1, 4, 4, 4, 6, 7, 7, 7, 7, 8, 8, 8, 10, 10, 10, 11, 11, 11, 11, 13, 14, 14, 16, 17, 18, 19, 19, 19, 20, 20, 21, 21, 22, 23, 24, 24, 26, 26, 26, 27, 27, 27, 28, 29, 32, 33, 33, 33, 33, 34, 40, 41, 42, 43, 43, 43, 44, 44, 46, 46, 48, 48, 53, 53]	23	21.5	8.0	60	[[0.40985116362571716, 0.41609421372413635], [0.41512736678123474, 0.41944095492362976], [0.4142721891403198, 0.43251752853393555], [0.4503214955329895, 0.45038771629333496], [0.4293653666973114, 0.4225078523159027], [0.4338437616825104, 0.4311010241508484], [0.4422127604484558, 0.4478023946285248], [0.418255090713501, 0.4243830144405365], [0.4368590712547302, 0.4325868487358093], [0.4266732633113861, 0.43431615829467773], [0.4515465497970581, 0.4585139751434326], [0.419822633266449, 0.42849433422088623], [0.4342235326766968, 0.43549516797065735], [0.4424212872982025, 0.42604774236679077], [0.4647192358970642, 0.4617961049079895], [0.4575776159763336, 0.44026485085487366], [0.4639618396759033, 0.45300742983818054], [0.45431727170944214, 0.4491731822490692], [0.4162810444831848, 0.42493516206741333], [0.42512938380241394, 0.4369872212409973], [0.43888095021247864, 0.443522185087204], [0.45786964893341064, 0.4567800462245941], [0.4486921429634094, 0.4635550379753113], [0.4449934959411621, 0.4493885636329651], [0.48801717162132263, 0.4778226315975189], [0.4543946385383606, 0.44875481724739075], [0.40174373984336853, 0.41279932856559753], [0.45460548996925354, 0.4417361915111542], [0.45202621817588806, 0.4588448107242584], [0.44518494606018066, 0.43979689478874207], [0.45231395959854126, 0.44343647360801697], [0.39883214235305786, 0.40599772334098816]]	0.8785195015370846	28.18263004819552
1	Wunicher	neu	['attempting to avoid encountering a specific person.', 'the strong urge to avoid an uncomfortable encounter.']	['diary, reflect, write, think', 'reminiscent of depression, otherwise dramatic person, over the top, inner child conflict', 'practice, pressure to perform, perfection, control, willpower, goal', 'tense, socially incompetent, compulsive, anticipation, excited, family, friends, meeting someone, having someone visit for the first time, cleaning the apartment, postman, window, balcony', 'circling thoughts, neuroticism, annoying, unnecessary, not changing, uncomfortable, negative situation, problem, should go away, no sleep', 'unrest, conflict, problem, uneasiness, anger, guilt', 'meditation, rest, bed, me, being, nothing, neutral, it is what it is, presence', 'surprised, joy, memory', 'warmth, cuddle, innocent', 'relaxation, speaking, conversations, interaction, attention, listening, watching', 'be positive, be surprised, joy, not expect anything, cheer up', 'friendship, communication, informative, encounter, exchange', 'elevator, shop, shopping, work, meeting', 'stress, negative fullness, bursting, tense', 'avoid encounters as much as possible', 'excited, overreacted, dissatisfied', 'joy, anger, routine, everyday life, friendship', 'do not want, help, hide, detour, embarrassed, shame', 'happiness, joy, gratitude', 'reality, plan, organize, responsibility, reliability, drive, self-determination', 'together, together, acquaintance, friends, gentleman, joy, see you again, have fun, at home, cafe, spend time, familiar, play', 'calmed down, peace, work, delegate, team, together, mate', 'ignorance, not properly prepared, human, current level of knowledge, annoying, preparation, work process, level of knowledge, delaying, perfectionism, improvement', 'calm, security, relaxed, trust, contentment', 'feeling, anticipation, warm', 'learning, no time, fear, society, sports, friends, stupid, head against heart, wrong people', 'criticism, improvement', 'fear, discomfort, shy, insecurity', 'beautiful or bad, rem, sleep, cloud, calm, history', 'positive or negative, important, bad evaluation of oneself, evaluate, judge, thoughts, optimistic, pessimistic, self-image', 'repetition, stress, checking, checking, anxiety', 'love, family, sweet, little comrades, cuddly', 'brood, forgetful, memory, think, blackout']	33	[[16, 15], [15, 10], [28, 49], [24, 39], [17, 22], [47, 44], [28, 31], [21, 20], [27, 18], [40, 24], [45, 44], [7, 8], [11, 13], [8, 7], [46, 38], [15, 10], [10, 7], [43, 39], [39, 33], [48, 32], [24, 46], [40, 16], [53, 41], [11, 14], [39, 32], [29, 43], [18, 37], [19, 15], [39, 40], [43, 33], [12, 13], [11, 27], [12, 18]]	[7, 7, 7, 8, 8, 10, 10, 10, 11, 11, 11, 12, 12, 13, 13, 14, 15, 15, 15, 15, 16, 16, 17, 18, 18, 18, 19, 20, 21, 22, 24, 24, 24, 27, 27, 28, 28, 29, 31, 32, 32, 33, 33, 37, 38, 39, 39, 39, 39, 39, 40, 40, 40, 41, 43, 43, 43, 44, 44, 45, 46, 46, 47, 48, 49, 53]	26	25.5	0.0	60	[[0.4599175751209259, 0.46103063225746155], [0.4480215907096863, 0.4536285996437073], [0.42134079337120056, 0.40542906522750854], [0.47235241532325745, 0.4569016695022583], [0.45732003450393677, 0.4519575536251068], [0.40762707591056824, 0.41154417395591736], [0.4311436116695404, 0.4279469847679138], [0.4335014820098877, 0.4345678985118866], [0.4425636827945709, 0.44830042123794556], [0.4195386469364166, 0.4303610622882843], [0.4207576811313629, 0.4214567542076111], [0.4572758674621582, 0.4568134546279907], [0.4427531957626343, 0.44167259335517883], [0.45126575231552124, 0.4544062316417694], [0.4197414219379425, 0.42955493927001953], [0.44665682315826416, 0.45225510001182556], [0.4473758935928345, 0.45002391934394836], [0.4246787130832672, 0.42841199040412903], [0.42447909712791443, 0.42615383863449097], [0.41675928235054016, 0.430262953042984], [0.44285640120506287, 0.4215030074119568], [0.43912431597709656, 0.45677629113197327], [0.4406996965408325, 0.4560222327709198], [0.4411945641040802, 0.4382927417755127], [0.42650145292282104, 0.4305907189846039], [0.42607083916664124, 0.4183169901371002], [0.434501588344574, 0.41976603865623474], [0.446848064661026, 0.4504149556159973], [0.4249034821987152, 0.4247680604457855], [0.43865999579429626, 0.4456186294555664], [0.44363996386528015, 0.4427690804004669], [0.43783074617385864, 0.4243122935295105], [0.44824767112731934, 0.4439629912376404]]	0.8752104025898557	28.18263004819552
2	Neif	emo	['invest everything in a heart project with passion and commitment.', 'investing resources and skills in the implementation of an idea.']	"['beautiful, tired, morning, bed, good mood', 'anticipation, boredom, waiting, window, car, friendship, visit, relatives, time', 'reflect, improve', 'empathy, empathy, connectedness, relate, friendship, understanding, security', 'well prepared', 'pressure, forced, intrinsic?', ""when you're nervous, always affects others, you don't want to be a burden to anyone, you want to make a good impression, nervous"", 'people, anxiety, past, hostile, worry, stomach ache, annoyed, no desire, drama', ""oh, surprise, yes, i wouldn't have thought of it, joy"", 'considerate, courteous', 'struck by lightning, energetic, wanderlust, grinning, good time, jittery, child, butterflies in the stomach, music, dancing, embracing the world, family', 'bilingual', 'exciting, anticipation, great feeling, impatient', 'bed, morning, serenity, relaxation, good start, sun, nice dream, good mood, refreshed, exciting', 'insecurity, fear of making mistakes, training, practice', 'realization, sad, happy, indecisive, fear, learning, experience', 'calm, protection, being myself, laughter, friendship, family', ""tired, weakly sluggish, indifferent, melancholic, knocked out, at peace, satisfied and dissatisfied, change of mood, reproach, nagging thought, no matter, new day new happiness, i'll do tomorrow, pleasure and bad"", 'confusion, reality and dream, torn, comfortable, uncomfortable', 'negative, brooding, pacing, not being able to sleep, negative thoughts, stomach ache, frustration, thoughts circling, feeling unwell, shaky, nausea, reduced ability to concentrate', 'human, warm-hearted, joy, sadness, disgust, fear, cold, warm, therapy, primal fear, imprinting, upbringing', 'courteous, attentive, annoying, pushy, mansplaining', 'worry before that, free at last, relief, you create something, odef', 'vacation, traveling, reunion, adventure, discovering new things, excited, positive, anticipation, happy, relaxing, longing, wanderlust', 'relatively neutral, mirror neurons, humanity, influence, social cognition, humanity', 'satisfaction, pride, frustration, not enough, could have been better, more..., security, motivation', 'temptation, feeling', 'nightmare, quickly forgotten, dream journal, dream catcher, tell others', 'motivated, enthusiastic, spur, fun, anticipation, when the project is finished, effort', 'overreaction, impulsive, upset, irritable, angry, over the top, unnecessary', 'excitement, expectation, dreaming, containment, escape', 'joy, happiness, marriage, getting married, relationships, jealousy, romance films, kitsch, music', 'happiness, joy, pride, victory, success']"	33	[[46, 20], [26, 34], [53, 33], [13, 9], [55, 26], [20, 12], [49, 27], [35, 21], [24, 17], [36, 4], [38, 21], [54, 28], [36, 15], [13, 6], [49, 30], [10, 22], [37, 18], [50, 1], [48, 22], [47, 22], [29, 20], [19, 15], [32, 22], [27, 19], [19, 11], [22, 16], [37, 12], [26, 9], [36, 32], [30, 27], [41, 25], [35, 26], [50, 28]]	[1, 4, 6, 9, 9, 10, 11, 12, 12, 13, 13, 15, 15, 16, 17, 18, 19, 19, 19, 20, 20, 20, 21, 21, 22, 22, 22, 22, 22, 24, 25, 26, 26, 26, 26, 27, 27, 27, 28, 28, 29, 30, 30, 32, 32, 33, 34, 35, 35, 36, 36, 36, 37, 37, 38, 41, 46, 47, 48, 49, 49, 50, 50, 53, 54, 55]	27	26.0	5.0	60	[[0.4024975001811981, 0.42927125096321106], [0.4206262528896332, 0.4129922688007355], [0.40479210019111633, 0.43255335092544556], [0.4493333101272583, 0.45169270038604736], [0.4045734405517578, 0.43207502365112305], [0.4422672688961029, 0.450572669506073], [0.41323524713516235, 0.42767083644866943], [0.4226572811603546, 0.4365907609462738], [0.45001861453056335, 0.4574543237686157], [0.4291658103466034, 0.45531854033470154], [0.4288577735424042, 0.4496733844280243], [0.41233426332473755, 0.435937762260437], [0.4217883050441742, 0.4431702494621277], [0.4705520272254944, 0.4773640036582947], [0.3975650668144226, 0.4135384261608124], [0.45699357986450195, 0.44358912110328674], [0.4180142283439636, 0.4396112561225891], [0.3617275357246399, 0.4347379207611084], [0.408638060092926, 0.4321958124637604], [0.4224500060081482, 0.44182053208351135], [0.44477325677871704, 0.45431196689605713], [0.44941604137420654, 0.4550056755542755], [0.43038472533226013, 0.44614291191101074], [0.44747623801231384, 0.4519626498222351], [0.42613378167152405, 0.4325947165489197], [0.419126033782959, 0.4293891191482544], [0.4247809052467346, 0.4511376619338989], [0.4257488250732422, 0.44685325026512146], [0.4126608669757843, 0.4210040867328644], [0.42319944500923157, 0.4287068545818329], [0.4089963138103485, 0.42624470591545105], [0.42735305428504944, 0.43187129497528076], [0.3871441185474396, 0.4134090840816498]]	0.8621741045605053	28.18263004819552
3	Neif	neu	['investing resources and skills in the implementation of an idea.', 'invest everything in a heart project with passion and commitment.']	['emotional, imagination', 'courage, effort, anticipation, self-confidence but also fears of failure, sometimes feeling of being alone', 'review, personality, goals, challenges, growth, autonomy, success, happiness, gratitude', 'new, get to know, sympathy, unlikeable, known situation, people, socially incompetent, forgot names, hello', 'short, unclear, different world, lucid dreaming, weird, very confused, foggy, interesting, subconscious, processing, curiosity', 'joy, wanderlust, abroad, cultures, fear, farewell, possibility, opportunity, contact', 'juhuuuuuu, warm, sun, car, pack, nervous, stress, great, finally', 'practice, discipline, ambition, success, pride', 'curious, excited, exciting', 'exhausting, talent, discipline, over the top, compulsiveness, whimsy, fear of failure, perfectionism, pride, fluid, oil', 'anger, incomprehension, looking for solutions, feeling weak, distress, blocked', 'reflection, feedback, positive', 'mathematics, problems, tasks, solve, solution', 'strange, caution', 'bliss', 'tired, sluggish, last friday', 'uncertainty, discomfort, confusion, adrenaline, tension, being still, fear', 'worry, jitters, time, stomach ache, excitement', 'hormone', 'joy, excitement, stress, heat, turmoil, impatience, friendship', 'palace, uncertainty, preparation, unnecessary, compulsion, conversation, uncertainty, control, imagination', 'worry, excitement, tired, dull, restless', 'over the top, annoying, emotionally charged, derailing, overpowering, unimportant, taking up space, delay, corrosive, negative, upsetting, prolonged, busy', 'love, security, security, contact, attachment', 'anticipation, nervous, excited, impatient', 'quantity, cleaning plan, flat share, finally, relief, about time, joy, well done, praise', 'proud, will, happy, determined', 'empathetic, happy, familiar', 'excitement, hope, fear, joy', 'tiring, nervous, sad, demotivated, often, tired, no recovery', 'labor, planning, talent, skill, experience, creation, materials, tools', 'constantly, ssri, annika gieselmann, pietrowsky, nightmare, dream diary', 'desperate, bad, frustration']	33	[[12, 44], [18, 34], [24, 30], [12, 27], [11, 19], [31, 27], [19, 45], [19, 41], [8, 38], [30, 28], [13, 16], [9, 29], [38, 39], [24, 45], [24, 55], [8, 34], [11, 15], [18, 32], [22, 54], [13, 19], [24, 40], [19, 43], [19, 34], [23, 33], [18, 33], [8, 32], [8, 39], [14, 25], [8, 34], [34, 25], [21, 15], [22, 42], [8, 31]]	[8, 8, 8, 8, 8, 8, 9, 11, 11, 12, 12, 13, 13, 14, 15, 15, 16, 18, 18, 18, 19, 19, 19, 19, 19, 19, 21, 22, 22, 23, 24, 24, 24, 24, 25, 25, 27, 27, 28, 29, 30, 30, 31, 31, 32, 32, 33, 33, 34, 34, 34, 34, 34, 38, 38, 39, 39, 40, 41, 42, 43, 44, 45, 45, 54, 55]	25	24.0	0.0	60	[[0.4300973415374756, 0.40221792459487915], [0.4362798035144806, 0.4168919324874878], [0.4411417245864868, 0.4355137050151825], [0.47316083312034607, 0.4630059599876404], [0.47833678126335144, 0.4689137637615204], [0.44284459948539734, 0.4464421570301056], [0.4457325041294098, 0.42452576756477356], [0.43217310309410095, 0.41269180178642273], [0.4641963839530945, 0.4365633428096771], [0.44325605034828186, 0.44458913803100586], [0.4523240327835083, 0.45142459869384766], [0.45320242643356323, 0.4355233907699585], [0.40710246562957764, 0.4066394865512848], [0.4347652196884155, 0.4098125696182251], [0.4382256269454956, 0.4054728150367737], [0.4535011649131775, 0.4293370842933655], [0.4479602575302124, 0.44501808285713196], [0.44055619835853577, 0.4266175925731659], [0.4285411834716797, 0.3978303074836731], [0.45207834243774414, 0.44491082429885864], [0.43542858958244324, 0.4173174500465393], [0.43352583050727844, 0.41125303506851196], [0.4675396978855133, 0.45552435517311096], [0.44746214151382446, 0.4365409314632416], [0.4380466639995575, 0.42174628376960754], [0.45005056262016296, 0.42744654417037964], [0.4489130675792694, 0.4198748469352722], [0.4479394257068634, 0.4383700489997864], [0.4521365463733673, 0.42463070154190063], [0.435370534658432, 0.4397764503955841], [0.4391286373138428, 0.4446110129356384], [0.4403765797615051, 0.42124229669570923], [0.46089863777160645, 0.44183477759361267]]	0.8756486041979357	28.18263004819552
4	Zimerhubst	emo	['the drained and exhausted feeling after a sleepless, worrying night.', 'the physical sluggishness after a night of sleep deprivation.']	"['effort, joy, satisfaction, meaning', 'contentment, being relaxed, no worries, quiet, stillness, exertion falls off', 'happiness, empathy, sadness, understanding, good friends', 'feeling, subconscious, crying, despair, being alone, being overwhelmed', 'forward looking, exhausting', 'surveillance, wanting to be prepared, patient, compulsive, control', 'isolation, quiet, loneliness, avoiding hustle and bustle, social anxiety, silence, not in the mood, stressed, annoying', 'time, power, goal', 'pride, progress, process', 'nervous, palpitations, scenarios, it always turns out differently than expected, no self-confidence, no inner peace, preparation, practicing how to appear, job interview, important situations', 'learn, reflected', 'means to an end, love, attraction', 'nightmare, feeling unwell, thinking, being sad, exhaustion, bad mood, hard day, bed, worry, stress, exam period', 'excitement, joy, jittery', 'pride, courage, strength, confident, happy, encouraged, initiative, secure, determined, without distractions, eagerness, time', 'twitch, inappropriate, hold back, under control, uncomfortable, need', 'free, peaceful, contented, stillness, carefree, weightless, comfortable, soft, light, wanting to hold, more of it, happiness, here and now, limitless, being me, no judgment', 'quiet, peace, unfamiliar, inner tension, freedom, think, release thoughts', 'exhausted, grumpy, bad-tempered, irritable, sluggish, tired, unwell', 'distinctiveness, pride, communication, aptitude, education, holiday abroad, culture, spain, england/america', 'anticipation, excitement, caring, curiosity, impatience', 'awkward, awkward, hiding, draw curtains, being quiet, not wanting to be heard, awkward, wanting to get out of the way', 'diligence, compulsion, perfectionism, high demands on oneself, practice, restlessness, exaggerate, allow yourself a break, incentive, goal, fatigue', 'namaste, nepal, finding money, joy, unexpected, not looking for things', 'tenderness, emotion, empathy, comparison, thoughtful', 'stress, anxiety, tears, stress, thoughts, fatigue', 'for no reason, frustration, introspection, own feelings, reflection', 'joy, surprise, astonishment, enthusiastic, things long forgotten are rediscovered, melancholy, memories', 'annoyed, unnecessary, angry, curiosity, gossip', 'excitement, warmth, sexuality, intimacy', ""impolite, patronizing, anger, know-it-alls, conflicts, often well intentioned, parents, people often don't know any better, restraint difficult"", 'stress, uncomfortable, childish, unnecessary']"	32	[[58, 30], [48, 39], [32, 48], [38, 26], [27, 47], [55, 38], [49, 38], [42, 30], [54, 35], [46, 42], [22, 47], [57, 37], [46, 36], [58, 26], [55, 41], [30, 29], [59, 36], [54, 34], [30, 48], [58, 35], [24, 42], [49, 47], [58, 40], [58, 42], [34, 46], [35, 49], [24, 39], [45, 41], [32, 49], [58, 28], [58, 30], [54, 26]]	[22, 24, 24, 26, 26, 26, 27, 28, 29, 30, 30, 30, 30, 30, 32, 32, 34, 34, 35, 35, 35, 36, 36, 37, 38, 38, 38, 39, 39, 40, 41, 41, 42, 42, 42, 42, 45, 46, 46, 46, 47, 47, 47, 48, 48, 48, 49, 49, 49, 49, 54, 54, 54, 55, 55, 57, 58, 58, 58, 58, 58, 58, 58, 59]	41	41.5	0.0	60	[[0.3859252631664276, 0.42286133766174316], [0.39324790239334106, 0.40234652161598206], [0.4097898304462433, 0.39181146025657654], [0.4231727421283722, 0.43289899826049805], [0.4446331262588501, 0.42157673835754395], [0.40942391753196716, 0.4333261549472809], [0.4428558349609375, 0.4512312710285187], [0.4165576100349426, 0.42830076813697815], [0.40908366441726685, 0.43246111273765564], [0.4155980944633484, 0.4219185709953308], [0.4405020773410797, 0.41814228892326355], [0.3969343304634094, 0.42097845673561096], [0.44373154640197754, 0.45289039611816406], [0.3970159590244293, 0.43438851833343506], [0.40465131402015686, 0.4238284230232239], [0.4407067894935608, 0.44073495268821716], [0.3737315833568573, 0.4159798324108124], [0.41023698449134827, 0.43578216433525085], [0.4452420175075531, 0.42783915996551514], [0.4122982621192932, 0.4457266628742218], [0.4154109060764313, 0.39596500992774963], [0.4279980957508087, 0.42859798669815063], [0.41564232110977173, 0.4455411732196808], [0.3999926447868347, 0.4277430772781372], [0.41370826959609985, 0.3965550661087036], [0.4217882752418518, 0.4055320620536804], [0.43068236112594604, 0.4118099510669708], [0.3785223364830017, 0.3816154897212982], [0.41369113326072693, 0.3973245620727539], [0.399996817111969, 0.4365958571434021], [0.3846522867679596, 0.42707544565200806], [0.40920108556747437, 0.4384959042072296]]	0.8367031486704946	28.18263004819552
