12	Wupforau	emo	romance, love, happiness, friendship, joy, gratitude	"['love, closeness, security, inner peace, contentment, happiness', 'laziness, anxiety, living alone, sofa, family, postman, doorbell, lounging, relaxing, being disturbed', 'family, friendship, trust, being able to tell everything', 'passion, commitment, investing, dedication, time', 'positive, laugh, warm, friendship, friend', 'beautiful, pleasant feeling, exciting, morning, sometimes embarrassing, subconscious, processing things, detail, feeling', 'envy, desire, pride, uncomfortable, embarrassing, self-image, disguise', 'satisfied, surprise, joy, happiness, laughter, smile, inner peace', 'great, enthusiasm for travel, new experiences', 'ocd, exercise, doggedness, exhausting, too much, demanding of yourself, unhappy, unrelaxed, pressure from self and others, bragging, hard work, not worth it', 'depression, anxiety, tears, helplessness', 'feel, think, imitate, feel', 'love, feelings, relationship, butterflies, new person, new beginnings, likeable, liking, getting to know, pink red, surprising, unplanned, coincidence, destiny', 'love, partner, assertive, desire, familiar', 'courage, spend time, postpone important things, pride, contentment, determination, 100 percent', 'goal achieved, satisfaction, relieved, pride, evaluate, look back, joy', 'excitement, freedom, urge, adventure, here and now, enjoyment, fun, leisure time, creativity, different culture, thirst for knowledge, joy of discovery, adrenaline, test limits, discover, let go, think less and do more', 'unconditioned love, special connection, unique, meaningful, beautiful, important, touched', ""know-it-all, unasked, imposing, annoyed, pissed off, doesn't interest me, taking care of one's own problems"", 'worry, anxiety, grief, death, separation, family, loss, fear of the future, change', 'cautious, uncomfortable, oppressive, social problem, difficult friendships', ""nausea, anxiety, bad things might happen, like a volcano, worry, desire, it might already be over, can't sit still"", 'disappointment, negative thoughts, dissatisfaction, self-critical, low self-esteem, being strict, emotions, anger', 'interview, uncomfortable, nervousness, avoid, necessary, break up, guilt, low self-esteem, insecurity', 'emotion, anger, motivation, wanting to help, giving support, happiness, relief', 'effort, concentration, searching for words, considering, thinking, pronunciations', 'self-criticism, no self-love, frustration, self-evaluation, self-demanding, sadness', 'positive, when it comes to goals, that you have set, predictable, boring, planned', 'sad, confused, suddenly, overwhelmed, for no reason', 'confusion, blurry, far away and yet close', 'succeeding, completing projects, creating new things, being fulfilled, building, starting businesses, proud, moving things forward, expanding skills, talent, being rewarded, helping others, educating, getting meaning, being needed', 'anticipation, packing, suitcases, beach, cocktails, warmth, at ease, free, life, hope, relaxation']"	32	[371, 86, 1513, 1674, 1524, 1012, 453, 565, 1639, 49, 882, 1780, 836, 1402, 605, 714, 196, 910, 239, 187, 834, 633, 313, 464, 364, 175, 46, 1456, 1817, 1883, 284, 312]	[46, 49, 86, 175, 187, 196, 239, 284, 312, 313, 364, 371, 453, 464, 565, 605, 633, 714, 834, 836, 882, 910, 1012, 1402, 1456, 1513, 1524, 1639, 1674, 1780, 1817, 1883]	788	619.0	9.0	1953	[0.4025653004646301, 0.43115511536598206, 0.35130175948143005, 0.3430766761302948, 0.35099369287490845, 0.372054785490036, 0.3976680040359497, 0.39151865243911743, 0.3455812335014343, 0.4402560889720917, 0.37733906507492065, 0.3349749445915222, 0.379076212644577, 0.35608819127082825, 0.3891546130180359, 0.38395339250564575, 0.41622868180274963, 0.3762284815311432, 0.41219061613082886, 0.4177229106426239, 0.3792363405227661, 0.3874923884868622, 0.4070843458175659, 0.3970452547073364, 0.4031805396080017, 0.4187335968017578, 0.4421885013580322, 0.35387903451919556, 0.33148062229156494, 0.32269877195358276, 0.40879642963409424, 0.40723028779029846]	0.385255454108119	0.3843884454249125
13	Bismirbiel	emo	PTSD, violence, psychosis, schizophrenia, murder, depression	['comfortable, uncertainty, annoyed, angry, road, dodge', 'thinking, dissatisfied, learning, ignorance, information, error, interruption, problem solving, failure', 'avoiding eye contact, keeping your distance, talking to other people, feeling uncomfortable, leaving quickly', 'english, foreign language, struggle, enkmitas, words, think, difficulties, uncomfortable, german, accent, grammar', 'experience, something new, enthusiasm for something new', 'overcompensation', 'love, trust, daring to take the next step, exciting, affection, security, sexual desire, partner', 'anger, disappointment, embarrassing, uncomfortable, annoying, feeling stupid, screwing up, getting nervous', 'content, comfortable, talks, old times, laughter, good times, warm feeling', 'beautiful, happy, love, laughter, memories', 'tense, annoying, not interested in talking, feeling uncomfortable, crossing the street, not making eye contact, walking fast, gossip', 'disappointed, uncertainty', 'surprising, happy, clothes, tidying up drawers', 'introverted, difficult, lonely, social, outsider, shy, misunderstood, withdrawn, avoiding, crowds, groups', 'menstruation, anger at self, reflection, lack of understanding', 'job interview, application, annual review, school, work, teacher, boss, cramped, tense hands, thoughts', 'anticipation, joy, gathering, mental preparation, excited, nervous, packing list, worries', 'warm heart, closeness, security, childhood, family, trust, security, nothing can happen to me, the world is fine, beautiful, slightly ecstatic, joyful, happy, magical, homeland, hope, without words', 'tension, weird feeling, impatience, bored, addicted', 'positive, pleasing, unexpected, cheerful, surprising', 'shopping, hobby, walking, walking the dog, togetherness, swimming, elevator, sport, club', 'mental health, growing on tasks, happy, setting priorities, desire for success', 'interesting, often threatening, telling others, dream journal, wanting to understand', 'charity, friends, family, feeling pure in others, being happy for others, compassion, good news, happiness, contentment, warm feeling, joy, goodwill', 'frustrating, annoying, rare, struggling for words, describing, guessing together', 'annoying, exciting, done quickly, it goes on', 'emotions, bitchyness, freaking out, exaggerating, overreacting, anger', 'love, closeness, desire, intimacy, being together, sexuality', 'unnecessary, annoying, know-it-all, lack of empathy, pushy, inappropriate', 'impression, evaluation, positive, negative, think', 'fatigue, regret, weakness, slow down', 'loving couples, families, films, kitsch, successes, developments, carelessness, anticipation, envy, fulfilling dreams', 'unavoidable, logical, caution']	33	[1325, 495, 957, 459, 1467, 1454, 684, 941, 801, 1692, 796, 1297, 1562, 551, 264, 962, 1457, 55, 1589, 1627, 1348, 669, 1727, 40, 1145, 1731, 679, 511, 428, 1854, 1361, 402, 1730]	[40, 55, 264, 402, 428, 459, 495, 511, 551, 669, 679, 684, 796, 801, 941, 957, 962, 1145, 1297, 1325, 1348, 1361, 1454, 1457, 1467, 1562, 1589, 1627, 1692, 1727, 1730, 1731, 1854]	1032	962.0	6.0	1953	[0.3799547255039215, 0.41672712564468384, 0.39466211199760437, 0.41915062069892883, 0.3741926848888397, 0.3744972348213196, 0.40699833631515503, 0.3955756425857544, 0.4009162485599518, 0.3613746762275696, 0.4011631906032562, 0.38096198439598083, 0.3692367374897003, 0.4131776690483093, 0.43096697330474854, 0.39420193433761597, 0.3744475841522217, 0.4595860242843628, 0.367784321308136, 0.3657504916191101, 0.3790578842163086, 0.4077945947647095, 0.3581289052963257, 0.46544408798217773, 0.38711702823638916, 0.35780301690101624, 0.4072986841201782, 0.41591185331344604, 0.42099910974502563, 0.3478519022464752, 0.3783859312534332, 0.42259150743484497, 0.3578037917613983]	0.39356104894117877	0.3843884454249125
14	Enkmitas	emo	masturbation, anger, laughter, bitterness, cursing, sadness	"['emptiness, insecurity, despair, fear, crying', 'funny, closeness, understanding, togetherness, feelings, similarity, strange, familiar', 'money, object, joy, surprise, fallen down, hidden', 'fake, pretending, interested, wanting, dishonest, envy, insecurity', 'friendship, love, company, pleasant, pub, after-work beer', 'shy, tense, ideas, expectations, role models, exciting, can be beautiful, crackle, experiences, hope', 'friendship, anticipation, reception, happiness, excited, hug, greeting, reunion, implement plans, spend time together, affection, miss', 'what was that again, got it soon, annoyance, frustration, excitement', 'beautiful, indescribable', 'unrelaxed, impatient, person always comes when not looking, sweating, boring, waste of time, excitement, anticipation, tension', 'reserved, closed, lonely', 'beautiful, relaxed, stress-free, rarely, weekend, partner, thermal baths, excursion, vacation', 'empathy, warm, personable, agreement, influencing, agreeing, doing something together, sense of belonging, friends, workmates, movies, understanding, getting carried away', 'tired, thoughts, dark circles, heavy bones, sluggish movements, coffee, nap', 'happiness, amazed, relief, memory gap closed, satisfied, carefree', 'tired, listless, headache, no clear thoughts, worries, fear', 'trigger, uncomfortable, comfortable, loss of control, pattern, excitement, automatic, driven, avoidance, urges, restless, helpless, surprising', 'nice, surprise, pleasant, changes mood, not expected', 'waiting, nervous, excited, tension, reduced ability to concentrate', 'surprise, expectation, loss, money, keys, love, booze, dirt', 'feeling good, security, joy, having fun together, having the feeling of being able to be honest, friendship, superficial friendships', 'insecurity, blushing, embarrassing, embarrassment, being exposed, being still, staying calm, communicating nonverbally, like having to present something, inhibition', 'watching a wedding, nice feeling, watching a movie, typical drama, benevolence, compassion, love, joy, compassion e.g', 'huge anticipation, almost unbearable, anticipation is the greatest joy, drags on forever, planning, packing, excitement, being nervous, being happy, fear of the unexpected', 'excited, tense, structured plan, impatient, worried about getting things sorted out', ""anticipation, happiness, preparing, can't wait, nervousness, palpitations, happiness, looking at the clock"", 'insecurity, lies, inner conflict, contact with others, overcoming, reason', 'tedious, practice, difficulty finding words, lack of vocabulary, support through facial expressions and gestures', 'empathy, equal, shared, belonging, connectedness, understanding', 'discomfort, embarrassment, fear, ego', 'game night, friends, eating, anticipation, sharing memories, telling the news, restaurants, forgetting the time, celebrations, valuable, security, being yourself, humor and laughter', 'discipline, effort, process, reward, friend, italy']"	32	[1353, 752, 885, 1165, 569, 751, 760, 867, 1480, 527, 1539, 1207, 465, 943, 180, 546, 167, 1030, 605, 799, 412, 42, 10, 231, 1414, 111, 719, 240, 817, 1367, 1358, 624]	[10, 42, 111, 167, 180, 231, 240, 412, 465, 527, 546, 569, 605, 624, 719, 751, 752, 760, 799, 817, 867, 885, 943, 1030, 1165, 1207, 1353, 1358, 1367, 1414, 1480, 1539]	747	751.5	6.0	1953	[0.37703388929367065, 0.40233054757118225, 0.3961474895477295, 0.3853856027126312, 0.4113077223300934, 0.40234801173210144, 0.40185797214508057, 0.3971576988697052, 0.3718927502632141, 0.41330474615097046, 0.3691372871398926, 0.38351935148239136, 0.416530042886734, 0.3942066431045532, 0.43366873264312744, 0.41249892115592957, 0.4345532953739166, 0.3905549943447113, 0.40940624475479126, 0.4004614055156708, 0.4188290536403656, 0.4602828025817871, 0.4799453914165497, 0.429540753364563, 0.374536395072937, 0.4416746199131012, 0.4039047062397003, 0.42869192361831665, 0.39953315258026123, 0.37650266289711, 0.37680789828300476, 0.4083692729473114]	0.4063100619241595	0.3843884454249125
15	Mege	emo	humility, competence, excellence, integrity, honesty, loyalty	"['reliability, security, professional, dividing tasks, facilitation, relaxation', 'alone, lonely, no contacts, no friends, boredom, netflix, relaxation', 'bliss, can stay like this, desire', 'nervousness, worry, restless, phone call, promise, formulate', 'blush, attraction, attractive, dare, courage', ""forgotten, language, uncomfortable, annoying, it's on the tip of my tongue, i'm sure i'll remember right away, what could it be related to, distracted"", 'depression, unexpected, overwhelming, scary, hormones, mood swings, powerless, powerless, unwell, despair, seeking help', 'already there, when finally, bell, clock', 'beautiful, childish, dreamlike', 'restless, thinks of nothing else, fades out, embarrassing, disturbing, feeling stupid, joy when you remember word, fill silence', 'nice', 'lonely, negative', 'wait, hide, missed, insecure, unwanted visit, unexpected, postman, bell, hear, couch', 'anger, despair, anger, roll eyes, reflection', 'relaxation, sleep, breathe easy, warmth, friends, calm, no stress, few thoughts, no arguments, letting go', 'anger, unasked, helpless, exposed, escape, avoid', 'mega, great, respect, wow, success, pride, joy, relief, strength, freedom, air, goal achieved', 'tension, who is there, desire for rest, uncomfortable, bothers me', 'frustrated, devastated, sad, awkward, depressed, cheerless, unmotivated, listless', 'routine, joy, experience, challenge, learn, job, meeting, meeting, hobby, improve, learn skills, school, sport', 'uncomfortable, when nervous, memory, tense, annoying', 'awkward, awkward, hiding, authorities, awkward', 'superfluous, nice, strangers, friends, depending on the situation, independence, tip', 'happiness, joy, good group work, important personality trait, trust, should be looked for in other people, reliable', 'amusing, self-recognizing, annoying, hoping you misheard', 'frustration, being annoyed, speech impediments, stammering, searching', 'tranquility, solitude, focus on yourself, without others, freedom, independent, self-determined', 'bad mood, exhaustion, dismissive of others, trouble concentrating and having trouble thinking about something else', 'reflection, realization, pressure, stress, fear of making mistakes, planning, anticipating', 'regret, irritation, anger', 'worry, inexplicable, search for causes, mostly physical, listen to yourself, keep observing, pain, subconscious processes, strange thoughts', 'thoughts, lost, peaceful, calm, summer meadow, vacation, pleasant']"	32	[872, 643, 1469, 1403, 1483, 22, 77, 1943, 1480, 417, 1951, 1707, 1103, 1223, 134, 1036, 598, 755, 217, 1408, 1727, 1734, 990, 174, 1783, 538, 248, 664, 475, 1236, 208, 655]	[22, 77, 134, 174, 208, 217, 248, 417, 475, 538, 598, 643, 655, 664, 755, 872, 990, 1036, 1103, 1223, 1236, 1403, 1408, 1469, 1480, 1483, 1707, 1727, 1734, 1783, 1943, 1951]	949	931.0	6.0	1953	[0.3992743492126465, 0.4091176986694336, 0.37506306171417236, 0.37842756509780884, 0.3742513358592987, 0.470541775226593, 0.45118799805641174, 0.32352471351623535, 0.37443673610687256, 0.4211735129356384, 0.3151533603668213, 0.3618046045303345, 0.39036568999290466, 0.38553979992866516, 0.4433899521827698, 0.3930099904537201, 0.41170182824134827, 0.40399929881095886, 0.4347786009311676, 0.37815141677856445, 0.35993826389312744, 0.35953468084335327, 0.39501330256462097, 0.4392017126083374, 0.3555851876735687, 0.4152093231678009, 0.432466059923172, 0.40816986560821533, 0.4177822172641754, 0.38507506251335144, 0.4359402358531952, 0.4085369110107422]	0.3971045659855008	0.3843884454249125
16	Faube	emo	friendship, jealousy, intimacy, romance, envy, lust	['culture, abroad, friends, travel, learn', 'discomfort, envy but also a feeling of well-being to see it in others', 'exaggeration, actionism, insecurity, nervousness, experience, cause, inappropriate', 'love, family, baby, mother, sister, hug, cuddle, need, the most beautiful feeling, affection, support, hold, father, attachment, heart', 'prevention, neuroticism, sleepless night, unknown, circling thoughts, unnecessary, noise, no rest', 'interest, contentment, compassion, pride', 'money, joy, beautiful, yay, share, tell', 'oh crap, thoughtful, angry, desperate', 'excitement, preparation, avoiding awkward situations, scenarios', 'planning, future, fulfillment, self-realization, talent, idea, original, have, status', 'introspective, silence, independence, rest, having time, stress-free', 'loneliness, isolation, calm, sometimes pleasant, silence, headache', 'waiting, waiting time, impatient, too early, traveling, airport, train station, summer vacation', 'love, tension, ravishing, longing, warm', 'security in familiar surroundings', 'satisfied, self-confidence', 'preparation, restlessness, stress, uncertainty, goal, calming down', 'self-reflection, further development, intelligence', 'contentment, happiness, joy', 'unwanted, annoying, annoying, annoying, bothersome, unnecessary, dismiss, ignore', 'satisfied, happy, relieved, insecure, next step, change, own, decision', 'warmth, security, peace, happiness, trust, calm', 'restlessness, joy, excited, elation, great people are coming, event is important, special, starting, wanting to start, waiting position, not so great but nice, anticipation makes everything nicer', 'self-criticism, self-evaluation, negative, positive, reflect, claims', 'fulfilled, satisfied, rest, alone', 'friends, fun, anticipation, excitement, optimism, see ahead, oracle, see through, neighbors', 'serenity, crazy', 'excitement, nervousness, insecurity, stage fright', 'shit, thoughts, overthinking, self-blame, influences, helplessness', 'sometimes, only if allowed', 'stress, planning, uncomfortable, hiding, closeness', 'no idea, very neutral', 'dutiful, virtuous, diligent, hard work, structured']	33	[1788, 761, 434, 813, 325, 793, 1478, 1723, 1595, 955, 574, 945, 840, 1235, 1744, 1221, 765, 1133, 1057, 1638, 1363, 929, 254, 975, 965, 820, 1231, 1317, 479, 1773, 1493, 1611, 1050]	[254, 325, 434, 479, 574, 761, 765, 793, 813, 820, 840, 929, 945, 955, 965, 975, 1050, 1057, 1133, 1221, 1231, 1235, 1317, 1363, 1478, 1493, 1595, 1611, 1638, 1723, 1744, 1773, 1788]	1093	1050.0	0.0	1953	[0.33720046281814575, 0.3902602195739746, 0.40934112668037415, 0.3885684311389923, 0.4162907898426056, 0.38909414410591125, 0.3584963381290436, 0.34381386637687683, 0.35182440280914307, 0.38200587034225464, 0.400997132062912, 0.3825374245643616, 0.38711607456207275, 0.3695402145385742, 0.3419913947582245, 0.3701901435852051, 0.3902069628238678, 0.3744620680809021, 0.3775193691253662, 0.3495956063270569, 0.3636433780193329, 0.3832364082336426, 0.4215954542160034, 0.38111671805381775, 0.38137850165367126, 0.38809099793434143, 0.3697573244571686, 0.3659724295139313, 0.4069400131702423, 0.33917540311813354, 0.3577314615249634, 0.35095980763435364, 0.3780057728290558]	0.37571683977589465	0.3843884454249125
17	Odef	emo	humility, pride, happiness, joy, success, excellence	"['shopping, child care, annoying', ""signs of depression, overwhelming feeling, you don't know what to do, take countermeasures, do something that distracts, take responsibility, cultivate your emotional world"", 'joy, embarrassment, tension, excitement, impatience, life', 'interesting, dream diary, wanting to go back to sleep, thinking further of dream, like a good movie, vivid, joy, nightmare, reality, surreal, vivid, hidden', 'inappropriate, or helpful, from behind, excuse me, tip, rarely occurs, unusual, rude, older people', 'proud, relief, sublime, courageous, zest for action', 'men, relationships, attachment, sex, letting go', 'crappy, annoying, headache, feeling flabby, not ready for the day, heavy body, caffeine thirst', 'proud, creative', 'annoyed, amazed, grateful, ambivalent, know-it-all, authority, pejorative, friendly, useful, annoying, superfluous', 'avoiding, uncomfortable, avoidance, conflict of interest, disagreement', 'trust, well-being, friendship, love', 'love, butterflies, happiness, joy', 'possibly annoying, sometimes useful, depending on the situation', 'waiting period', 'waiting, coffee, looking at the phone', 'gratitude, appreciation, love, hug, happiness, warmth, laughter, smile, contentment, being at home', 'security, no need to adjust, quiet', 'reflect', 'reliability, calm, serenity, confidence, professionalism, pillar, partner', 'love, security, closeness, belonging, warm, forever, heart, limitless, connected', 'lazy, shy, insecure, alone, stay, house, corridor, noise', 'rest, happiness, being one, yoga, rarely, peaceful, secure, without rushing, for oneself, individually different, happy place', 'need help, uncertainty, insight', 'empathy, treat, love, friendship, happy', 'ohm, yoga, meditation, bed, relax, rest, alone, calm, relaxed, lying, eyes closed, spread out', 'boredom, stress, listless', 'confirmation, fulfillment, perspective, joyful, successful', 'rest, meditate, relaxed, within yourself, no thoughts', 'overthinking, young people, often, exhausting, planning, thinking, acting out', 'uncomfortable, thinking, standing on the hose, looking at the ground, looking for synonyms, paraphrasing', 'studies, career, relationship, religion, personality, strength, self-confidence', 'love, affection, security, bond, trust']"	33	[890, 299, 533, 797, 261, 857, 1072, 233, 1890, 65, 243, 1171, 831, 1949, 1774, 1818, 394, 1042, 1850, 942, 1298, 1410, 776, 1589, 1173, 132, 993, 1541, 924, 899, 181, 773, 1064]	[65, 132, 181, 233, 243, 261, 299, 394, 533, 773, 776, 797, 831, 857, 890, 899, 924, 942, 993, 1042, 1064, 1072, 1171, 1173, 1298, 1410, 1541, 1589, 1774, 1818, 1850, 1890, 1949]	959	924.0	3.0	1953	[0.38304606080055237, 0.4135105013847351, 0.3996095657348633, 0.38688042759895325, 0.416678786277771, 0.3840416669845581, 0.37617889046669006, 0.4189733862876892, 0.327401727437973, 0.4406321048736572, 0.4179149866104126, 0.3725872337818146, 0.3853358030319214, 0.3074357509613037, 0.34277233481407166, 0.33812975883483887, 0.407308965921402, 0.37721893191337585, 0.33325842022895813, 0.380943238735199, 0.36746540665626526, 0.3628665804862976, 0.3877333104610443, 0.3546113967895508, 0.37254637479782104, 0.42946264147758484, 0.3792196214199066, 0.3566510081291199, 0.38191187381744385, 0.38257017731666565, 0.4233959913253784, 0.38796478509902954, 0.37646371126174927]	0.3809915582338969	0.3843884454249125
18	Skibt	emo	happiness, gratitude, joy, friendship, kindness, laughter	"['mistake, foresight, learn', 'bad feeling, avoidance, discomfort', 'unfamiliar, astonishment, curiosity, concern', 'studies, achievement, decisions, self worth, making parents proud, happy, skills, right choice', 'confusion, cause, why?, question, dull, weird, inexplicable, feeling, body', 'uncomfortable, blockage, strange, reserved, trapped, fear', 'cool, admiration, flow, desire', ""think over, reflect, be thoughtful, reflect on one's own perception"", 'desire, lust, control, fun, situation', 'self-satisfaction, courage, self-efficacy, self-affirmation, anticipatory, secure, confident, self-confidence, victorious', 'familiar, native, sociable, family, being more genuine', 'fear, reluctance, dislike, discomfort, communication', 'motivation, money, gym, retirement home, party, disco, karaoke night', 'inner peace, just breathe', 'preparation for an interview, for example', 'smile, nice feeling', 'anxiety, insecurity, headache, irrational', 'depression, sadness, helplessness, surge of emotions, tired', 'serenity', 'interest, extraversion, sociability, understanding motives, empathy', 'angry, forgetful, negative, annoyed, stupid, find again, memory, grab, strange, fall', 'anticipation, heart, happiness, flight, suitcase, beach, pictures', 'avoidance behavior, escape and avoidance, evasion, avoidance of confrontation, does not stand by its consequences, avoiding the situation does not avoid the problem, avoiding the problem, no solution, weakness', 'excitement, excitement, joy, happiness, butterflies', 'proud, self-esteem, optimistic, strong, excited, insecure', 'quarrel, smoking, worry, siblings, illness, exam, anxiety, sleepless, bed, not falling asleep, stupid, help', 'love, trust, affection', 'film, bell, wait, curiosity', 'excitement, joy or bad, friends', 'necessary, fine, isolated, introverted, calm, quiet, thoughts, relaxation', 'insecurity, compulsion, pride', 'anger, doubt, failure, hopelessness, damage', 'happiness, joy, positive, reward']"	33	[1669, 1014, 1037, 1362, 950, 1752, 1589, 1573, 1203, 51, 1345, 784, 1199, 1931, 1881, 1783, 1253, 622, 1861, 754, 615, 1737, 21, 1091, 1569, 173, 1198, 1683, 1456, 393, 1285, 638, 1174]	[21, 51, 173, 393, 615, 622, 638, 754, 784, 950, 1014, 1037, 1091, 1174, 1198, 1199, 1203, 1253, 1285, 1345, 1362, 1456, 1569, 1573, 1589, 1669, 1683, 1737, 1752, 1783, 1861, 1881, 1931]	1171	1203.0	6.0	1953	[0.3393993079662323, 0.36882561445236206, 0.3677682876586914, 0.3546407222747803, 0.37187832593917847, 0.33302974700927734, 0.3439583480358124, 0.34464314579963684, 0.36152946949005127, 0.4406239092350006, 0.35553547739982605, 0.37907716631889343, 0.3615967333316803, 0.3058770000934601, 0.3188748359680176, 0.330497145652771, 0.35902470350265503, 0.3871510326862335, 0.32087698578834534, 0.380603551864624, 0.38768109679222107, 0.33440473675727844, 0.45420655608177185, 0.36537638306617737, 0.3447386622428894, 0.419345885515213, 0.36162877082824707, 0.3383045792579651, 0.34969696402549744, 0.4010619521141052, 0.35772034525871277, 0.38608789443969727, 0.3625541627407074]	0.36327937877539435	0.3843884454249125
