40	Troff	emo	['the satisfied feeling of self-determination when you have made an important decision.', 'the certainty that your actions and decisions will have consequences.']	"['girlfriend, food, cake, pizza', ""search for knowledge, neutral feeling, anger because you don't know, motivation to close gaps in knowledge"", 'shame, competence, confidence, lectures, expectations, evaluations, understanding', 'overreact, precaution, psychosis, freak out, escalate, negative, choleric, uncomfortable', 'god, good, star, upward, development, growth, exponential, pat on the back, joy, positive, bright future, striving, striving, goal, value, ideal', 'uncontrolled, affected, unconscious, controlled, trapped, sensitive, excited', 'tired, eyes, bed, coffee, sleep, not getting up, exhausting', 'lying, wanting to behave, decent, actually stupid, pretending', 'uncomfortable, unavoidable, sad, not effective', 'turtledove, look, excitement, especially, palpitations, determination, seeking courage, threshold, inhibition, rejection, wall, hesitation, doubt, signal, gesture', 'subconscious, action', 'refuge, calm, nice feeling, you can rely on', 'love, sadness, family, distance', 'overreact, rarely, sometimes useful, sometimes not', 'male cat', ""frustrated, didn't manage to do what you wanted to do, exhausted"", 'courage, work, success, self-esteem, progress, adrenaline, questioning', 'further development, development, growth, blossoming, successful, check off', 'hide, run away, uncomfortable feelings', 'happiness, satisfaction, validation, meeting expectations, achieving goals', 'small, exaggerated, large, uncomfortable, dramatic, negative', 'overwhelmed, heart, happiness, eye, beautiful, paradise', 'feeling, interpretation, observing, interaction from a distance, overcoming feeling, self-reflection, reflection of the environment, empathy, interest', 'uncomfortable, discomfort, avoidance, escape, escape, fear', 'stress, notice, motivation, pressure, positive', 'mouth, kiss, crush, love, sex, feeling', 'fear, panic, anger, sweat', 'familiar, intimate, harmonious', 'fear, nervousness', 'neutral, consequences, awareness of the environment, decisions, study, job, responsibility, difficult, stressful, safety, law, good or bad', 'exaggerate', ""constant, insomnia, caffeine, coffee, tea, mate, energy drink, nap, can't catch up"", 'ambivalence, desire, rejection, reserved']"	33	[[57, 54], [13, 59], [55, 40], [19, 59], [13, 58], [51, 45], [46, 48], [41, 57], [18, 59], [17, 54], [44, 48], [22, 55], [59, 51], [20, 59], [36, 58], [57, 50], [52, 56], [56, 31], [59, 49], [15, 56], [15, 59], [35, 52], [10, 59], [41, 54], [33, 58], [17, 59], [56, 47], [55, 46], [53, 46], [7, 59], [38, 55], [38, 47], [37, 55]]	[7, 10, 13, 13, 15, 15, 17, 17, 18, 19, 20, 22, 31, 33, 35, 36, 37, 38, 38, 40, 41, 41, 44, 45, 46, 46, 46, 47, 47, 48, 48, 49, 50, 51, 51, 52, 52, 53, 54, 54, 54, 55, 55, 55, 55, 55, 56, 56, 56, 56, 57, 57, 57, 58, 58, 58, 59, 59, 59, 59, 59, 59, 59, 59, 59, 59]	44	50.5	0.0	60	[[0.40393009781837463, 0.4197455942630768], [0.4319295585155487, 0.37637174129486084], [0.4073711633682251, 0.42286416888237], [0.45281749963760376, 0.39120689034461975], [0.4686580300331116, 0.41149136424064636], [0.4093290865421295, 0.41840386390686035], [0.41171976923942566, 0.41084253787994385], [0.4148769676685333, 0.3840318024158478], [0.4371563196182251, 0.3820616900920868], [0.45570439100265503, 0.41560500860214233], [0.40834543108940125, 0.4039490818977356], [0.4283519387245178, 0.3887987732887268], [0.3978342115879059, 0.4277730882167816], [0.4334668219089508, 0.38144126534461975], [0.42766067385673523, 0.40344658493995667], [0.39813733100891113, 0.42150741815567017], [0.42070698738098145, 0.4156424403190613], [0.4146738350391388, 0.44210270047187805], [0.3966553211212158, 0.4267827868461609], [0.41781362891197205, 0.3742961883544922], [0.4324232041835785, 0.3647274672985077], [0.4266694188117981, 0.4117657244205475], [0.44740739464759827, 0.3827979862689972], [0.4131263494491577, 0.40184485912323], [0.42841774225234985, 0.3943006992340088], [0.4487723410129547, 0.38612470030784607], [0.41127467155456543, 0.4225497245788574], [0.3887125849723816, 0.4140738546848297], [0.39758971333503723, 0.41270995140075684], [0.4702219069004059, 0.3974761664867401], [0.42353248596191406, 0.4008079767227173], [0.4399838447570801, 0.43009358644485474], [0.41186708211898804, 0.3898472785949707]]	0.8274128111925992	28.18263004819552
41	Troff	neu	['the certainty that your actions and decisions will have consequences.', 'the satisfied feeling of self-determination when you have made an important decision.']	"['tense, excited, train, packing, anticipation, waiting, vacation, nervous, stress', 'fear, escape, avoidance, uncomfortable, love, embarrassment, reunion, panic', 'positive or negative, inspiration, reminding of own needs, fellow human beings', 'coincidence, encounter, love at first sight, attraction, attractiveness', 'nice, friendly', 'exciting feeling, realistic dream?, processing, introspection', 'nice encounter, person maybe lives near me, part of my social environment, have something in common, so you probably see each other more often', 'anxiety, nervousness, panic, tiredness, nightmare, weak, restless, shaky, lacking energy, sadness, tension', 'tense, tired, sluggish, gummy eyes, eyes closed, yawning, tired muscles, have to sit down, afternoon nap', 'practice, master, novice, hard work', 'bad past, lack of processing, therapy, reflection, approach, difficult, suffering, others have a greater influence on self-esteem', 'feelings, togetherness, love, being in love, tingling in the stomach', 'kiss, hold hands, sit on lap, protect, comfort', 'job interview, separation interview, nervousness, training, important appointment, significant, restlessness, sweating, palpitations', 'love, trust, caregivers, family', 'excited, impatient, perseverance, questions, relaxed, tactics, attentive, ready', 'harmony, bliss, arrived, motivation, peace', 'pride, joy, relief, security, strength, hope, faith, focus, comfortable, good, very good, i can do this, well done, i stand for myself one, more of it, achieve goal, freedom', 'wanderlust, happiness, change of scenery, excited, new, memories, euphoria, highlight', 'insecure, sad, distrust, breach of trust, cautious, shy, sensitive, withdrawn', 'lazy, boredom, mail, church, neighbor, city, sleep', 'gratitude, work, household, pride, content', ""free, independent, mind is free, you don't have to do anything, without obligation, calm, still, safe, secure"", 'mistakes, promises, word finding disorder, embarrassment, self-consciousness, fear, strangers, doubt', 'observation, to infer feelings, insecurity, self-definition, self-reflection, sometimes misleading', ""annoying and corrosive, clear expression better, you shouldn't stand in your own way, stand by yourself, self-esteem, represent your own opinion"", 'community, compassion, togetherness, empathy', 'uncomfortable, avoid, self-protection, social contacts, flee, small talk, humane', 'relying on someone, relaxed, trusting, good friendship and family, best friend, colleagues, sense of duty and responsibility', 'joy, excitement, fidgety, missing, family, long time no see, anticipation', 'forgetfulness, stupidity, irritation, anger', 'anticipation, plans, long wait, gifts, deliveries, worry, fear of missing out, overnight stay, reunion, nervousness', 'money, partner, photos, letters, clothes, box, cellar']"	33	[[59, 17], [55, 57], [33, 53], [35, 53], [55, 30], [59, 10], [59, 21], [54, 50], [37, 9], [51, 55], [58, 32], [59, 21], [55, 15], [53, 58], [51, 58], [54, 33], [58, 22], [45, 14], [59, 13], [59, 23], [43, 54], [59, 14], [56, 34], [57, 19], [58, 20], [41, 58], [51, 56], [59, 10], [53, 56], [58, 26], [55, 37], [59, 11], [50, 41]]	[9, 10, 10, 11, 13, 14, 14, 15, 17, 19, 20, 21, 21, 22, 23, 26, 30, 32, 33, 33, 34, 35, 37, 37, 41, 41, 43, 45, 50, 50, 51, 51, 51, 53, 53, 53, 53, 54, 54, 54, 55, 55, 55, 55, 55, 56, 56, 56, 57, 57, 58, 58, 58, 58, 58, 58, 58, 59, 59, 59, 59, 59, 59, 59, 59, 59]	42	52.0	0.0	60	[[0.39594098925590515, 0.4515015780925751], [0.42147111892700195, 0.41499459743499756], [0.41995033621788025, 0.39752301573753357], [0.43446505069732666, 0.4125824272632599], [0.3997948169708252, 0.4236763119697571], [0.38517269492149353, 0.4439588189125061], [0.40838077664375305, 0.4572678804397583], [0.43737101554870605, 0.4423237442970276], [0.4045952558517456, 0.458785742521286], [0.4070442020893097, 0.39946621656417847], [0.3798184394836426, 0.4207713305950165], [0.37580662965774536, 0.43597304821014404], [0.38744792342185974, 0.43076634407043457], [0.43594691157341003, 0.4300806522369385], [0.4148309528827667, 0.39142081141471863], [0.39635345339775085, 0.4210047423839569], [0.3846634030342102, 0.42630770802497864], [0.4164024293422699, 0.4415704905986786], [0.38112372159957886, 0.4505031406879425], [0.38843008875846863, 0.4464144706726074], [0.41480326652526855, 0.40102940797805786], [0.37150630354881287, 0.42912521958351135], [0.4046766459941864, 0.4253641366958618], [0.4025843143463135, 0.442141056060791], [0.3910077214241028, 0.4283415973186493], [0.41316643357276917, 0.38559892773628235], [0.40584060549736023, 0.39353135228157043], [0.3784528076648712, 0.45596057176589966], [0.408722847700119, 0.40335848927497864], [0.379131019115448, 0.42760664224624634], [0.3921773433685303, 0.41517454385757446], [0.4002484083175659, 0.45920872688293457], [0.409362256526947, 0.42277824878692627]]	0.8282667326204705	28.18263004819552
42	Bingsemöl	emo	['when you compulsively repeat an activity because you want to master it perfectly.', 'when one repeats an activity in order to be able to perform it sufficiently well.']	"['maid of honor, girlfriend, uni, leaving', 'exhausting, nervous, hardly any sleep, constant thoughts but also success, well thought out, words at the ready for conversation', 'warmth, conversations, sharing, happiness, contentment, belonging, time, memories, fun', 'pride, competence, work, effort, success, helping, projects, achievement', 'joy, happiness, plane, beach, relaxation, abroad, tourism, friends, new, variety, summer, sun, pack, travel', 'anticipation, encounter, friendship, confidence', 'window, waiting, impatience, cellphone message, when, delay, hurry up', 'ambition, joy, tunnel vision, not being able to think of anything else', 'exciting, difficult, beautiful, hope, uncertainty', 'luck, surprise, joy, unexpected, blessed, coincidence, happy, momentary, short term', 'empathy, compassion, sharing the excitement, empathetic, letting yourself be infected, joy', 'routine, training, improvement', 'mother-in-law, job, colleagues, pissed, subliminal aggression', 'sure, efficiency, quick-wittedness, preparation', 'overwhelming grief', 'english, uncomfortable, school', 'tension, palpitations, hope, expectation, jittery, insecure, overthinking', 'going crazy, crankiness, annoying, um, brain', 'empathy', 'happiness, security, love, being calm, warmth, silence', 'worried, insecure, negative, fear, sick, ephemeral', 'lecture, conversation, exhausting, work, dialogue, remember, vocabulary, difficult', 'practice, be sure, insecurity, nervous, unrest, help, illusion of security, uncover mistakes, counteract, preparation, possible improvement, become aware of what you want, learn objectivity, support subjective attitude, argumentation', 'empathy, compassion, like-minded, share thoughts, similarities, empathize', 'noticeable, strong, warm feeling', ""keep it out, sensible, i didn't ask you, i don't want to hear, you're right, didn't even think about it, thanks"", 'joy, flashbacks', 'happy, expectant, exciting, exciting', 'excitement, hope, avoiding problems', 'planning, important, goals, job, studies, school', 'stress, not being able to let go, biting down, planning, perfectionism, uncertainty', 'cro, make it easy, incomprehensible, dare, life is so short', 'deceive, hide, secret, occupation, undesirable']"	33	[[0, 3], [4, 3], [3, 4], [33, 44], [3, 2], [6, 17], [31, 21], [27, 39], [2, 10], [3, 2], [3, 4], [51, 58], [30, 36], [3, 16], [3, 16], [19, 54], [3, 6], [0, 4], [7, 14], [18, 27], [44, 56], [22, 26], [1, 5], [35, 40], [48, 56], [32, 34], [2, 14], [28, 48], [51, 56], [1, 11], [4, 5], [27, 53], [3, 12]]	[0, 0, 1, 1, 2, 2, 2, 2, 3, 3, 3, 3, 3, 3, 3, 3, 3, 3, 4, 4, 4, 4, 4, 5, 5, 6, 6, 7, 10, 11, 12, 14, 14, 16, 16, 17, 18, 19, 21, 22, 26, 27, 27, 27, 28, 30, 31, 32, 33, 34, 35, 36, 39, 40, 44, 44, 48, 48, 51, 51, 53, 54, 56, 56, 56, 58]	20	15.0	41.0	60	[[0.4809173345565796, 0.4639758765697479], [0.49143752455711365, 0.4973944425582886], [0.45976242423057556, 0.45601096749305725], [0.432721883058548, 0.4253171980381012], [0.5003093481063843, 0.506774365901947], [0.45039102435112, 0.43572595715522766], [0.4376075267791748, 0.44296470284461975], [0.4179585874080658, 0.41169673204421997], [0.46896618604660034, 0.44611167907714844], [0.482211709022522, 0.4841231107711792], [0.4561035931110382, 0.45276153087615967], [0.41590219736099243, 0.3875100016593933], [0.42061662673950195, 0.4152258038520813], [0.4555714428424835, 0.4304601550102234], [0.45652803778648376, 0.4373825788497925], [0.44434672594070435, 0.4128609299659729], [0.4831559658050537, 0.4596721827983856], [0.4793446660041809, 0.4587550163269043], [0.454617977142334, 0.44119691848754883], [0.4411117434501648, 0.4279204308986664], [0.4400967061519623, 0.41421887278556824], [0.44704359769821167, 0.44376787543296814], [0.4677354693412781, 0.45281901955604553], [0.4232320785522461, 0.41980937123298645], [0.41357848048210144, 0.3889443874359131], [0.4538406431674957, 0.4536408483982086], [0.4638056457042694, 0.44460147619247437], [0.4399316608905792, 0.4224092960357666], [0.41722339391708374, 0.39655977487564087], [0.4663269519805908, 0.441272497177124], [0.4677818715572357, 0.4657917022705078], [0.43099546432495117, 0.400687575340271], [0.4680652320384979, 0.4412834346294403]]	0.8911783767469001	28.18263004819552
43	Bingsemöl	neu	['when one repeats an activity in order to be able to perform it sufficiently well.', 'when you compulsively repeat an activity because you want to master it perfectly.']	"['friends, encounter, home, date, anticipation, waiting, impatient', 'anger, being annoyed, other people, unpleasant, annoying person, knowing everything better, distinguishing oneself, advice, unwanted', 'important decisions, lecture, work, school, friendship, relationship, everyday, evaluation', 'darts, practice, repetition, focus, study', 'neutral, prerequisite for cooperation, desirable', 'rare, calm, pleasant, relaxing, spring, summer, bed, lying, sitting', 'motivation, wanting something, ambitious, goal in mind, joy, passion, important, willingness to help', 'tension, why, why, why, tachycardia, nausea, fear', 'have to work on yourself', ""little self-esteem, others are more important, wrong assessment of one's own performance, bad feeling for a clear conscience, manipulation, unnecessary courtesy, exhausting"", 'surprised', 'rest, relaxation, forget stress, switch off, love, happiness, friends, partner, grandma', 'overreact, needlessly, think, change, emotions, uncontrolled, regret, cry, argument, conflict', 'lonely, introvert, hiding, fear, insecurity', 'drunk, scared, tired, incapable, problems, thoughts, sickness', 'communication, sign, connection, desire, uncomfortable', 'energy, focus, desire, want, zeal, joy, fun, ease and focus, flow, good, progress, development, growth, curiosity, challenge, strength, creativity', 'frustration, confusion, annoying, excited, lecture, different language', 'frustration, annoyance, grumpy, in a bad mood, angry', ""discussion, battle, explanation, paraphrase, disappointment, technical term, furry, oh, what's it called"", 'can be negative or positive, motivated, overreacting, precaution, arguing, fear of consequences if not reacting', 'bad previous experiences, being irritable, had a bad day, even small things bother, stressed, you want peace, fear something bad could happen', 'smooching, partner, partner, being excited, love, passion, lips, nervousness, new experiences, butterflies in the stomach, palpitations, increased heart rate, boyfriend, girlfriend', 'degrading people, uncomfortable, communication needed, arrogant, humiliated, annoying', 'structure, palpitations, fear of doing something wrong, lack of self-confidence, being well prepared, some tension is good', 'love, trust, rest, relaxation, peace, happiness, joy', 'decision, important, happy, relief, joy, new chapter, it goes on, positive feeling, expectations', 'avoidance brings relief, uncomfortable, uncontrollable, tense, jittery, worrying too much', 'joy, surprise, amazement, happiness, annoy, hide', 'familiarity, comfort, routine, known', 'pressure, stress, ambition, wanting to prove, perfectionism, bragging, showing off, pain, effort, talent, investing time, success, rewarding', 'weird, strange']"	32	[[30, 16], [55, 17], [36, 23], [8, 3], [58, 51], [1, 7], [10, 6], [19, 18], [57, 33], [28, 23], [32, 6], [2, 4], [13, 6], [11, 3], [42, 17], [18, 9], [4, 2], [23, 14], [42, 25], [53, 23], [35, 13], [5, 0], [16, 9], [51, 44], [3, 2], [33, 15], [21, 10], [6, 3], [10, 0], [20, 8], [17, 12], [43, 9]]	[0, 0, 1, 2, 2, 2, 3, 3, 3, 3, 4, 4, 5, 6, 6, 6, 6, 7, 8, 8, 9, 9, 9, 10, 10, 10, 11, 12, 13, 13, 14, 15, 16, 16, 17, 17, 17, 18, 18, 19, 20, 21, 23, 23, 23, 23, 25, 28, 30, 32, 33, 33, 35, 36, 42, 42, 43, 44, 51, 51, 53, 55, 57, 58]	19	15.5	27.0	60	[[0.43947046995162964, 0.4564136862754822], [0.43349534273147583, 0.46547242999076843], [0.42950239777565, 0.438222199678421], [0.43758049607276917, 0.45713675022125244], [0.3869650959968567, 0.41200628876686096], [0.4601151943206787, 0.44648391008377075], [0.4468015134334564, 0.45663565397262573], [0.44126632809638977, 0.4429307281970978], [0.3942054212093353, 0.4270339906215668], [0.44501838088035583, 0.4482545852661133], [0.43800100684165955, 0.4629405736923218], [0.4827467203140259, 0.47219979763031006], [0.44611722230911255, 0.4649185538291931], [0.44989898800849915, 0.47726210951805115], [0.4204658567905426, 0.44387713074684143], [0.44762545824050903, 0.45671653747558594], [0.4875270426273346, 0.4893711507320404], [0.43065837025642395, 0.44574201107025146], [0.4175945222377777, 0.4365241825580597], [0.4180173873901367, 0.4435029923915863], [0.4342399835586548, 0.4578055739402771], [0.468375027179718, 0.4851292669773102], [0.4503665566444397, 0.459484338760376], [0.4177636504173279, 0.4276268780231476], [0.46827465295791626, 0.4700145423412323], [0.4243510663509369, 0.44161704182624817], [0.4409711956977844, 0.45463937520980835], [0.4575255215167999, 0.47480079531669617], [0.4343297779560089, 0.4657939672470093], [0.4378189444541931, 0.4557914435863495], [0.4633338749408722, 0.47130054235458374], [0.41337844729423523, 0.4518602788448334]]	0.8944784756749868	28.18263004819552
44	Ferandsor	emo	['fear of trusting someone and being hurt because of bad experiences.', 'when you are withdrawn because you prefer to keep to yourself than to be among other people.']	['rolling around, uncomfortable, worry, fear, panic', 'joy, great feeling, self-affirmation', 'excitement, adventure, experiences, train, ship, culture, acquaintances, food, suitcases, documents, camera, uncertainty', 'cheating, relationship, trust issues, hurt, thinking back, fear of rejection, bad person, self esteem, resentful', 'tired, tired, everything sucks, why did i stay up so late, gambling, youtube, power nap, heavy eyelids, falling asleep on the train or car, powerless, irritable, longing for bed', 'perfectionism, self esteem, disappointment, sadness, self hate', 'not in the mood, excuse, unpleasant, detour, dark, gone home, date, acquaintance', 'beautiful, baby, special, family as priority, irreplaceable', 'forgetfulness, annoying, stupid, situational', 'tired, drained, sleepless, tense, keeping awake, sugar, coffee, bed, relax', 'cinema of thought, going in circles, weighing up, advantages/disadvantages, restlessness, discrepancy', 'uncertainty, excitement, nervousness, fear, restless', 'bus stop, baby, mother, touch, caring, feel good', 'joy, indulgence, warmth, love, longing, good day', 'imposition of outsiders', 'concentration, excited, important event', 'racing heart, tension, bad mood, silence, adrenaline, malaise', 'hard to get, fake, confusion, confusion, lies, manipulative', 'inappropriate', 'planning, preparation, anticipation, stress, checklist, organization, read in', 'heart leap, empathy, joy, happiness, warmth, love, positive, change, desires', 'practice, hands, content, development, frustration, rest, time', 'positive experience, affirmation, right choice, pursuing goal, working towards it, perseverance, contentment, determination', 'awkward, flirting, drawing attention to something, attention, hinting', 'alert, careful, quiet, thrill, fear, overwhelmed', 'drinking, playing, toasting, having fun, laughing, joy, security, security, eating, spending time, enjoying', 'calm, contentment, serenity, warm', 'make an effort, think, empathize, cognitive, communicative', 'happy, relaxed, expecting', 'incomprehensible, sad, depression, thoughts, actions, crying, exhaustion', 'stress, repetition, unhealthy, perfectionism, grinding, unnecessary, depression', 'love, public, relationship, sweet, romantic like bookseller', 'empathy, cheerful, sharing, friendship, family']	33	[[55, 46], [48, 41], [36, 5], [52, 5], [48, 26], [26, 57], [29, 42], [18, 40], [40, 29], [43, 22], [33, 7], [33, 58], [23, 57], [22, 57], [20, 59], [47, 34], [30, 18], [22, 57], [46, 56], [33, 30], [47, 28], [33, 51], [24, 45], [19, 20], [45, 56], [38, 11], [41, 53], [25, 56], [2, 57], [51, 24], [26, 51], [36, 53], [48, 42]]	[2, 5, 5, 7, 11, 18, 18, 19, 20, 20, 22, 22, 22, 23, 24, 24, 25, 26, 26, 26, 28, 29, 29, 30, 30, 33, 33, 33, 33, 34, 36, 36, 38, 40, 40, 41, 41, 42, 42, 43, 45, 45, 46, 46, 47, 47, 48, 48, 48, 51, 51, 51, 52, 53, 53, 55, 56, 56, 56, 57, 57, 57, 57, 57, 58, 59]	36	39.0	5.0	60	[[0.3990011513233185, 0.4061589241027832], [0.3900001347064972, 0.40369465947151184], [0.46068230271339417, 0.49822694063186646], [0.4322872757911682, 0.4883756935596466], [0.3729386031627655, 0.4213089048862457], [0.43621698021888733, 0.40378716588020325], [0.42608407139778137, 0.41863200068473816], [0.44063499569892883, 0.4196339249610901], [0.4285576641559601, 0.44100457429885864], [0.3907243311405182, 0.4185740053653717], [0.4522067606449127, 0.4725818634033203], [0.4121105968952179, 0.3778391182422638], [0.4394347071647644, 0.4023698568344116], [0.41539594531059265, 0.3792323172092438], [0.43938547372817993, 0.3816462457180023], [0.4171922206878662, 0.4243263900279999], [0.43608638644218445, 0.4497803747653961], [0.43993473052978516, 0.40339919924736023], [0.41668376326560974, 0.4013790488243103], [0.436924546957016, 0.43818724155426025], [0.4039413034915924, 0.42989373207092285], [0.42474299669265747, 0.4068562090396881], [0.42610445618629456, 0.40821370482444763], [0.44626978039741516, 0.44523295760154724], [0.4095526933670044, 0.3907831609249115], [0.44981086254119873, 0.4771279990673065], [0.39728420972824097, 0.38385069370269775], [0.417387455701828, 0.3853546380996704], [0.45969918370246887, 0.4050195813179016], [0.41407886147499084, 0.4437251687049866], [0.44417712092399597, 0.4241052567958832], [0.4244258999824524, 0.41156652569770813], [0.39336317777633667, 0.4000297486782074]]	0.8440975293968663	28.18263004819552
