47	Odef	neu	humility, spirituality, infinity, evolution, optimism, enlightenment	"['contentment, pride, goal, confidence, joy, hard work, new', 'worries, feelings, doubts, fears, thoughts, insomnia', 'listening, insecurity', 'uncertainty, patience, tension, consideration', 'lusche', 'strange, temporary, physicality', 'wanderlust, longing, anticipation is the most beautiful joy, i also want, relaxation, pack my suitcase, plan my trip, adventures, experiences, memories, precious, mature, family, friends, culture', 'annoying, overbearing, inappropriate, naughty, getting angry, being polite, mansplaining, belittling, disrespectful', ""excitement, walk away, don't want to, fear, dislike, be quiet, as quiet as a mouse"", 'preparation, training', 'love, desire, movies, suspense, embarrassing, blushing, lips, heartbeat, imagination, friends, saliva, smacking, uncomfortable', 'death, love, faith', 'positive, motivating, pride, sport, university, personality, friends, family, being tidy', 'parents, relationship, important, love, closeness, connectedness, safe, security, trust, childhood', 'anticipation, packing, planning, booking, excitement, being jittery', 'anger, sadness, accident, problem, not that important, outburst, screaming, blushing', 'memory, look, help, rub off, connectedness', ""uncomfortable, avoidance, i don't want to, repression, politeness, respect, shame, guilt, please don't, grumbling, conflict avoidance"", 'feeling unwell, fear, oral exam, abroad, vacation, embarrassment', 'excitement, irritability, annoyance, fear, brooding, being still, hope', 'trust, security, joy, relief, job, task, goals, gain experience, apply experience', 'tired, heavy eyes, bad mood, slept badly, hangover, unproductive day, body aches, headache, unmotivated', 'unexpected, money in the jacket pocket, positive prediction error, finally something good is happening, nice', 'brooding, nervousness, being excited, thinking, forgetfulness, tension, inner restlessness, feeling of trepidation', 'humanity, interpersonal relationship, important, mirror neurons, empathy h being built on water, sometimes strenuous to empathize, deadening through social media', ""smile, approach, look away, oh no... don't talk to me..., hope, embarrassed"", 'relaxation, rest, all good, no stress, happiness, vacation, bliss', 'reaction, exaggerate, surprise, inappropriate', 'palpitations, elated, curiosity, joy, exhilaration, being a little hyper, ignoring other problems, cloud 7', 'introverted, calm, alone, lonely, cold, harmony, relaxation', 'control, prevention, routine, planning', 'anger, one regrets, wishes back, to do better, arguments, failure, forgiving oneself, new goals, ambition, expectations of others, comparison with others, self-image, hurt pride', 'caring, empathy, humanity, love, helpfulness']"	33	[545, 741, 1535, 814, 1848, 1476, 188, 319, 542, 1758, 742, 1331, 960, 489, 724, 1121, 841, 102, 1114, 333, 756, 224, 540, 57, 306, 377, 386, 1498, 296, 718, 1307, 11, 821]	[11, 57, 102, 188, 224, 296, 306, 319, 333, 377, 386, 489, 540, 542, 545, 718, 724, 741, 742, 756, 814, 821, 841, 960, 1114, 1121, 1307, 1331, 1476, 1498, 1535, 1758, 1848]	752	724.0	6.0	1953	[0.4055825471878052, 0.3941596448421478, 0.35845059156417847, 0.38987997174263, 0.33494833111763, 0.3607581853866577, 0.4334501028060913, 0.42165687680244446, 0.4059055745601654, 0.3442443609237671, 0.39413926005363464, 0.36773744225502014, 0.3837857246398926, 0.40934231877326965, 0.39500653743743896, 0.3765610456466675, 0.38864728808403015, 0.4449317455291748, 0.37691929936408997, 0.42017826437950134, 0.39328551292419434, 0.4298332631587982, 0.40596094727516174, 0.45383143424987793, 0.42259031534194946, 0.4166702330112457, 0.41626477241516113, 0.359649658203125, 0.42343756556510925, 0.3956572115421295, 0.36825287342071533, 0.47573143243789673, 0.38940897583961487]	0.3986927063176126	0.3843884454249125
48	Skibt	neu	empathy, depression, kindness, friendship, jealousy, bullying	"['anxiety, nervousness, sadness, loneliness, tired, bed, lying, stress', 'family, attachment, parents, secure, contentment, love, help, touch, unconditional, affection, trust', 'fatigue, dissatisfaction, bad dream, waking up, light sleep', 'stress, restlessness, exhaustion, worries, tiredness, dissatisfied, irritated', 'self-efficacy, pride, self-determination', 'tired, exhausting day, coffee, slower than usual, either night was great, or you are annoyed that you stayed up so long', 'basic trust, love, affection, security, family, security, growing up, breastfeeding, upbringing', 'desire, physical attraction, sexual arousal, attractiveness, excitement, joy', 'romantic, close, intense', 'small talk, awkward, smiling, anticipation, fear, annoying, detour, nice, potential friends, in love, indifferent', 'despair', 'good feeling, teamwork, help, sharing', 'tidy room, beautiful, memories, childhood, money, happiness, looking forward, unexpected, missing, feelings', ""putting yourself in someone else's shoes, envy, comparison, self-reflection"", ""desire, countermeasures, hide, don't report, phone off, be alone, hesitate, unwell, thoughts, anger, sadness"", 'excitement, tension, control, tremors, adrenaline, fear', 'beautiful, surreal, wanting to go back, not wanting to wake up properly, lost in thought, what was that, uncomfortable, suppression, sinking feeling, disoriented, why am i dreaming something like this, what is that trying to tell me, do i want n', 'tension, daydreams, unrealistic, control, planning, security', 'nerd, guilty conscience, procrastinated, nerd, disciplined, lazy', 'hope, energy, excitement, challenge, task, support, job, colleagues, moving, conflict, communication, phone call, discuss', 'excitement, uncertainty, anticipation, courage, intense', 'failure, fear of failure, perfectionism, in the creative field, feeling of failure, i have to make it, you keep getting worse', 'tired, oversleeping, sluggish, bad start to the day, partying, partying, netflix, guilty conscience, sleepy, afternoon nap', 'neutral, positive, in self-actualization, negative in most other cases, consequence thinking less pronounced in adolescents, develops over the course of life', 'overwrought, uncomfortable afterwards especially, rocking up, angry, uncomfortable, howling with anger', 'euphoria, diligence, joy, happiness, commitment, give everything, motivation, anticipation', 'insecurity, self protection, relationships, friendships, memories, past', 'anticipation, excitement, planning, going through, whether everything has been thought of, a little stressful, hyper', 'disappointment, task, realization, logic, thinking, aha moment', 'joy, pride, knowledge, warmth, self-confidence', 'excitement, love, crush, not daring, regret, taking heart, thoughts, hoping, courage, crush, daydreams', 'help, social, children, donations, work, pride, persistent, goal, together']"	32	[416, 205, 1030, 773, 1077, 897, 1044, 825, 1759, 81, 1825, 1836, 547, 807, 418, 999, 42, 1097, 1417, 591, 1144, 7, 594, 353, 423, 545, 926, 614, 913, 1109, 75, 944]	[7, 42, 75, 81, 205, 353, 416, 418, 423, 545, 547, 591, 594, 614, 773, 807, 825, 897, 913, 926, 944, 999, 1030, 1044, 1077, 1097, 1109, 1144, 1417, 1759, 1825, 1836]	791	816.0	12.0	1953	[0.4064233601093292, 0.42454230785369873, 0.3720742166042328, 0.38493812084198, 0.37005704641342163, 0.37798061966896057, 0.3715675473213196, 0.38197141885757446, 0.3335112929344177, 0.4403764307498932, 0.3268350660800934, 0.32590457797050476, 0.39780664443969727, 0.38313549757003784, 0.40633782744407654, 0.3733236789703369, 0.451389878988266, 0.36918482184410095, 0.3537519872188568, 0.39524587988853455, 0.36715415120124817, 0.4725295603275299, 0.3950977325439453, 0.41078266501426697, 0.4057590663433075, 0.3979121744632721, 0.3763134181499481, 0.3937193751335144, 0.3773307204246521, 0.368762344121933, 0.4418863356113434, 0.37560585141181946]	0.38841286301612854	0.3843884454249125
49	Mölauzegt	neu	oneself, depression, myself, schizophrenia, negativity, happiness	"['searching for information, decision, smart, frustration, waiting', 'ambition, proving something to oneself, eagerness, learning, talent, practice, repetition, trying, success, failure, effort', 'excitement, happiness, anticipation, cheering, checking', 'frustrating, standstill, information, level of knowledge', 'negative, brooding, worry, stress, depression', ""i actually want to, but i can't not, be considerate of others, cut corners, in order to achieve my own goals, determined, it's a shame, you could miss out on something great"", 'reflection, self-awareness, self-knowledge, improve, change, get to know, development, feedback', 'frustration, annoyance, doggedness, tension', 'celebration, fun, sickness', 'feeling good, good times, good conversations, energy, talking about old times, security, inspiring, exhausting, annoying, being fake friendly, doing something together', 'nothing', 'negative, weak, bitchy, unlikable, childish, lying to yourself', 'evaluation, ideal self, think, revise, review, judge, improve, be tough, deviate, actions, thoughts', ""reflection, aware of one's own actions, objectivity, positive, head person"", 'joy, sadness, understand, understanding, dismay, shame', 'embarrassing, mistakes, unwanted attention, worries, checking, gaps', ""embarrassing, oh jeee, where's the hole in the ground, bad, shame, amusement, insecurity, repression, avoidance, stop, i don't want to, feel stupid, feel small, seem stupid"", 'security, familiar, pleasant, orientation, am calm, comfort zone, conversations, informal', 'surprised, thoughtful, uncomfortable', 'listen, pack, planning, anticipation, vacation, beach, sun, flight, car trip, motorcycle vacation, mountains, beach, luggage', 'tension, uncomfortable, annoyed by person, actually silly', ""can't wait, can't sit still, you've waited a long time, it's finally happening, you're prepared, looking at the clock, smiling, excited"", 'modesty, not being honest, friends, acquaintances, knowing what you want, rejection, taking advantage of offers, being grateful', 'comfortable feeling, warmth, family, love, pleasant, friendship, emotional closeness, security, trust, search for it, positive, happiness', 'serenity, relaxation, feeling good, pressure, feeling not good enough, hoping, that you make the other feel the same way', 'anticipation, uncertainty, being excited, tension, excitement, expectation', 'hardworking, work, household, to-do list, study, someone to rely on, responsibility', 'serenity, joy, deep connection, inner peace and harmony, boisterous laughter, acceptance, you can be yourself, carefree, secure, trust, at home', 'anticipation, nervous, excited, hope, joy, imagination, dreaming, packing, waiting, impatience', 'compulsion, control, perfection, discipline, security', ""fear, worry, uncomfortable, conflicts, bad experiences, colleagues, circle of friends, ex-partners, arguments, make detours, neighbors, don't want to talk, often not each other"", 'work, parents, university, lecturers, trust, reliability']"	32	[1173, 88, 1757, 1539, 1793, 39, 357, 1112, 923, 124, 1833, 556, 343, 585, 1372, 1195, 36, 831, 1510, 825, 1356, 113, 119, 399, 318, 963, 639, 216, 735, 1542, 62, 941]	[36, 39, 62, 88, 113, 119, 124, 216, 318, 343, 357, 399, 556, 585, 639, 735, 825, 831, 923, 941, 963, 1112, 1173, 1195, 1356, 1372, 1510, 1539, 1542, 1757, 1793, 1833]	793	780.0	12.0	1953	[0.37842145562171936, 0.46188294887542725, 0.3493625819683075, 0.3616678714752197, 0.3467774987220764, 0.4752621650695801, 0.4268815219402313, 0.38094258308410645, 0.3908553719520569, 0.45427626371383667, 0.34395113587379456, 0.41159847378730774, 0.4280349612236023, 0.410048246383667, 0.36929985880851746, 0.37756451964378357, 0.4773164391517639, 0.3954581022262573, 0.3627886474132538, 0.39561134576797485, 0.36989814043045044, 0.45644357800483704, 0.45575588941574097, 0.42321833968162537, 0.43059828877449036, 0.3887084126472473, 0.40540605783462524, 0.4404338002204895, 0.40017685294151306, 0.3616117537021637, 0.4669179320335388, 0.390143483877182]	0.4058535788208246	0.3843884454249125
50	Troff	neu	betrayal, treason, certainty, humility, fear, fascism	"['tense, excited, train, packing, anticipation, waiting, vacation, nervous, stress', 'fear, escape, avoidance, uncomfortable, love, embarrassment, reunion, panic', 'positive or negative, inspiration, reminding of own needs, fellow human beings', 'coincidence, encounter, love at first sight, attraction, attractiveness', 'nice, friendly', 'exciting feeling, realistic dream?, processing, introspection', 'nice encounter, person maybe lives near me, part of my social environment, have something in common, so you probably see each other more often', 'anxiety, nervousness, panic, tiredness, nightmare, weak, restless, shaky, lacking energy, sadness, tension', 'tense, tired, sluggish, gummy eyes, eyes closed, yawning, tired muscles, have to sit down, afternoon nap', 'practice, master, novice, hard work', 'bad past, lack of processing, therapy, reflection, approach, difficult, suffering, others have a greater influence on self-esteem', 'feelings, togetherness, love, being in love, tingling in the stomach', 'kiss, hold hands, sit on lap, protect, comfort', 'job interview, separation interview, nervousness, training, important appointment, significant, restlessness, sweating, palpitations', 'love, trust, caregivers, family', 'excited, impatient, perseverance, questions, relaxed, tactics, attentive, ready', 'harmony, bliss, arrived, motivation, peace', 'pride, joy, relief, security, strength, hope, faith, focus, comfortable, good, very good, i can do this, well done, i stand for myself one, more of it, achieve goal, freedom', 'wanderlust, happiness, change of scenery, excited, new, memories, euphoria, highlight', 'insecure, sad, distrust, breach of trust, cautious, shy, sensitive, withdrawn', 'lazy, boredom, mail, church, neighbor, city, sleep', 'gratitude, work, household, pride, content', ""free, independent, mind is free, you don't have to do anything, without obligation, calm, still, safe, secure"", 'mistakes, promises, word finding disorder, embarrassment, self-consciousness, fear, strangers, doubt', 'observation, to infer feelings, insecurity, self-definition, self-reflection, sometimes misleading', ""annoying and corrosive, clear expression better, you shouldn't stand in your own way, stand by yourself, self-esteem, represent your own opinion"", 'community, compassion, togetherness, empathy', 'uncomfortable, avoid, self-protection, social contacts, flee, small talk, humane', 'relying on someone, relaxed, trusting, good friendship and family, best friend, colleagues, sense of duty and responsibility', 'joy, excitement, fidgety, missing, family, long time no see, anticipation', 'forgetfulness, stupidity, irritation, anger', 'anticipation, plans, long wait, gifts, deliveries, worry, fear of missing out, overnight stay, reunion, nervousness', 'money, partner, photos, letters, clothes, box, cellar']"	33	[1749, 656, 1137, 631, 1717, 1923, 448, 183, 717, 1678, 319, 395, 1153, 224, 1757, 908, 1761, 14, 615, 397, 961, 1598, 379, 203, 584, 491, 1056, 744, 613, 901, 1050, 504, 1386]	[14, 183, 203, 224, 319, 379, 395, 397, 448, 491, 504, 584, 613, 615, 631, 656, 717, 744, 901, 908, 961, 1050, 1056, 1137, 1153, 1386, 1598, 1678, 1717, 1749, 1757, 1761, 1923]	874	717.0	3.0	1953	[0.36578962206840515, 0.4200410842895508, 0.3980958163738251, 0.4217830300331116, 0.3680926263332367, 0.34207943081855774, 0.4328049123287201, 0.4525710642337799, 0.4165506660938263, 0.3708328604698181, 0.440664142370224, 0.43548402190208435, 0.3974568545818329, 0.44837838411331177, 0.36527323722839355, 0.4082486033439636, 0.36468616127967834, 0.49643996357917786, 0.4226173162460327, 0.43539100885391235, 0.40507328510284424, 0.375646710395813, 0.436583012342453, 0.4507574737071991, 0.42437461018562317, 0.43044254183769226, 0.4016169011592865, 0.4154251217842102, 0.42268791794776917, 0.40868693590164185, 0.40175530314445496, 0.4297245144844055, 0.38727816939353943]	0.41191919102813257	0.3843884454249125
51	Bingsemöl	neu	meditation, repetition, mindfulness, cheating, boredom, relaxation	"['friends, encounter, home, date, anticipation, waiting, impatient', 'anger, being annoyed, other people, unpleasant, annoying person, knowing everything better, distinguishing oneself, advice, unwanted', 'important decisions, lecture, work, school, friendship, relationship, everyday, evaluation', 'darts, practice, repetition, focus, study', 'neutral, prerequisite for cooperation, desirable', 'rare, calm, pleasant, relaxing, spring, summer, bed, lying, sitting', 'motivation, wanting something, ambitious, goal in mind, joy, passion, important, willingness to help', 'tension, why, why, why, tachycardia, nausea, fear', 'have to work on yourself', ""little self-esteem, others are more important, wrong assessment of one's own performance, bad feeling for a clear conscience, manipulation, unnecessary courtesy, exhausting"", 'surprised', 'rest, relaxation, forget stress, switch off, love, happiness, friends, partner, grandma', 'overreact, needlessly, think, change, emotions, uncontrolled, regret, cry, argument, conflict', 'lonely, introvert, hiding, fear, insecurity', 'drunk, scared, tired, incapable, problems, thoughts, sickness', 'communication, sign, connection, desire, uncomfortable', 'energy, focus, desire, want, zeal, joy, fun, ease and focus, flow, good, progress, development, growth, curiosity, challenge, strength, creativity', 'frustration, confusion, annoying, excited, lecture, different language', 'frustration, annoyance, grumpy, in a bad mood, angry', ""discussion, battle, explanation, paraphrase, disappointment, technical term, furry, oh, what's it called"", 'can be negative or positive, motivated, overreacting, precaution, arguing, fear of consequences if not reacting', 'bad previous experiences, being irritable, had a bad day, even small things bother, stressed, you want peace, fear something bad could happen', 'smooching, partner, partner, being excited, love, passion, lips, nervousness, new experiences, butterflies in the stomach, palpitations, increased heart rate, boyfriend, girlfriend', 'degrading people, uncomfortable, communication needed, arrogant, humiliated, annoying', 'structure, palpitations, fear of doing something wrong, lack of self-confidence, being well prepared, some tension is good', 'love, trust, rest, relaxation, peace, happiness, joy', 'decision, important, happy, relief, joy, new chapter, it goes on, positive feeling, expectations', 'avoidance brings relief, uncomfortable, uncontrollable, tense, jittery, worrying too much', 'joy, surprise, amazement, happiness, annoy, hide', 'familiarity, comfort, routine, known', 'pressure, stress, ambition, wanting to prove, perfectionism, bragging, showing off, pain, effort, talent, investing time, success, rewarding', 'weird, strange']"	32	[1067, 231, 1085, 1887, 643, 906, 1228, 412, 1849, 270, 1856, 1339, 618, 1743, 695, 1148, 668, 1511, 1192, 1040, 616, 836, 93, 1231, 573, 492, 307, 784, 1384, 1000, 276, 1925]	[93, 231, 270, 276, 307, 412, 492, 573, 616, 618, 643, 668, 695, 784, 836, 906, 1000, 1040, 1067, 1085, 1148, 1192, 1228, 1231, 1339, 1384, 1511, 1743, 1849, 1856, 1887, 1925]	965	953.0	3.0	1953	[0.3898621201515198, 0.43853339552879333, 0.3890393078327179, 0.33756470680236816, 0.4115041196346283, 0.39709243178367615, 0.3819864094257355, 0.42506143450737, 0.3437057137489319, 0.43528857827186584, 0.3428661525249481, 0.376830130815506, 0.413047730922699, 0.35432499647140503, 0.4084025025367737, 0.38574808835983276, 0.4101526439189911, 0.36863645911216736, 0.38362476229667664, 0.3910107910633087, 0.4130818843841553, 0.40048062801361084, 0.45571598410606384, 0.3818371593952179, 0.41501760482788086, 0.41976848244667053, 0.43189820647239685, 0.40349024534225464, 0.37444671988487244, 0.39282700419425964, 0.4348679184913635, 0.3297967314720154]	0.39492222014814615	0.3843884454249125
52	Ferandsor	neu	loneliness, solitude, isolation, abandonment, insecurity, boredom	"['talk, strangers, initiative', 'procrastination, hesitation, regret, realization, stupidity, short-term, reward, consequence, unpleasant, long-term, decide', 'calm, contentment, aspiring', 'suitcase, pack, ready, vacation, journey, train, plane, farewell, silence, nervousness, serenity, backpack, bags', 'filmerisch, romantic comedy', ""don't want, bad, unsatisfactory, difficult to get out of it quickly, depressing, when you've worked hard for something and it just doesn't work out, you want it"", 'empathy, compassion, compassion, friendship, sadness, joy, connection, concern', 'beautiful, warm, love, closeness, protecting, guarding, affection, joy', 'can be beautiful, mysterious, imprecise', 'world domination, empowered, strong, power, contentment, pride, independence, adulthood, life transformation', 'jackpot', 'love, effort, positive, beautiful, motivated, dedication, happy, fulfillment', 'conversation, stare, want, make contact, social interaction, waiter, assert, eyes', 'dishonest, game, untrustworthy, taking advantage of the situation', 'beaten off, exhausted, being alone, cold, emptiness, thoughtful, meaning', 'regret, doubt, hard realization, disappointment in myself', ""question mark, why, why, where from, uncomfortable, worry, insecurity, confusion, never mind, let's see, no idea, stupid, annoying, funny, wait a while, ask someone, worry, wait, amazement, pleasant, irritated"", 'exciting, frustrating, fear, tension, impatience, regret, disappearance, flirt', 'joy, excitement, excitement, laughter, good mood', 'date, joy, butterflies, trip, studies, hobbies, fear of failure, weird, fate, coincidence, wing man', 'shame, wanting to be alone, annoyed with person, uncomfortable', 'warm, happy, something good happened, want to celebrate, smile, the world is beautiful!', 'reaction, discomfort, questioning, analyzing, feelings, stimuli, finding causes', 'partying, waking up tomorrow and getting over it, going to work, sleep disorder, work stress, uncomfortable, exposed, vicious cycle, sleep exercises', 'annoying, sucks, wondering how to deal with it, ignore, go your own way, confidence, accept?, want to avoid contact', 'sleep, relaxation, rest, peaceful, think back on dream, rested, relaxed', 'empathy, compassion, generous, support, friends, no envy, success from others, indulge', 'external influence, imitation, observational learning, empathizing, empathizing with a situation, attentive', 'nature, meditation, happiness, joy, still, calm, serenity, alone, relaxation', 'overthinking, restlessness, fear, distrust, torment', 'honor, proud, aloof, reserved, hostility, avoiding, making amends, love, relationships, friendships, talking to each other, forgiving, youthful', 'depression, anxiety, loss, unexplained, emotions, surge, hormones']"	32	[1640, 157, 1120, 586, 748, 631, 547, 513, 1652, 205, 1945, 954, 1928, 454, 733, 885, 5, 1224, 699, 285, 479, 1082, 524, 316, 1419, 802, 1139, 1227, 184, 939, 31, 1283]	[5, 31, 157, 184, 205, 285, 316, 454, 479, 513, 524, 547, 586, 631, 699, 733, 748, 802, 885, 939, 954, 1082, 1120, 1139, 1224, 1227, 1283, 1419, 1640, 1652, 1928, 1945]	823	740.5	6.0	1953	[0.3704970180988312, 0.45063599944114685, 0.3957267701625824, 0.4203017055988312, 0.41275522112846375, 0.41847899556159973, 0.42253199219703674, 0.4249410033226013, 0.3696599006652832, 0.44594886898994446, 0.3234245181083679, 0.4030751585960388, 0.33510780334472656, 0.4287629723548889, 0.4134981632232666, 0.4060875177383423, 0.502682626247406, 0.3913083076477051, 0.41544482111930847, 0.43918028473854065, 0.4271077811717987, 0.3977797329425812, 0.4240076541900635, 0.43697452545166016, 0.3826717138290405, 0.4101438820362091, 0.395050972700119, 0.3912268280982971, 0.4479551613330841, 0.40390536189079285, 0.4783744812011719, 0.38855040073394775]	0.41168119199573994	0.3843884454249125
