30	Mege	emo	['the sure trust in someone who reliably fulfills his duties.', 'taking note that someone has completed all of their duties.']	"['reliability, security, professional, dividing tasks, facilitation, relaxation', 'alone, lonely, no contacts, no friends, boredom, netflix, relaxation', 'bliss, can stay like this, desire', 'nervousness, worry, restless, phone call, promise, formulate', 'blush, attraction, attractive, dare, courage', ""forgotten, language, uncomfortable, annoying, it's on the tip of my tongue, i'm sure i'll remember right away, what could it be related to, distracted"", 'depression, unexpected, overwhelming, scary, hormones, mood swings, powerless, powerless, unwell, despair, seeking help', 'already there, when finally, bell, clock', 'beautiful, childish, dreamlike', 'restless, thinks of nothing else, fades out, embarrassing, disturbing, feeling stupid, joy when you remember word, fill silence', 'nice', 'lonely, negative', 'wait, hide, missed, insecure, unwanted visit, unexpected, postman, bell, hear, couch', 'anger, despair, anger, roll eyes, reflection', 'relaxation, sleep, breathe easy, warmth, friends, calm, no stress, few thoughts, no arguments, letting go', 'anger, unasked, helpless, exposed, escape, avoid', 'mega, great, respect, wow, success, pride, joy, relief, strength, freedom, air, goal achieved', 'tension, who is there, desire for rest, uncomfortable, bothers me', 'frustrated, devastated, sad, awkward, depressed, cheerless, unmotivated, listless', 'routine, joy, experience, challenge, learn, job, meeting, meeting, hobby, improve, learn skills, school, sport', 'uncomfortable, when nervous, memory, tense, annoying', 'awkward, awkward, hiding, authorities, awkward', 'superfluous, nice, strangers, friends, depending on the situation, independence, tip', 'happiness, joy, good group work, important personality trait, trust, should be looked for in other people, reliable', 'amusing, self-recognizing, annoying, hoping you misheard', 'frustration, being annoyed, speech impediments, stammering, searching', 'tranquility, solitude, focus on yourself, without others, freedom, independent, self-determined', 'bad mood, exhaustion, dismissive of others, trouble concentrating and having trouble thinking about something else', 'reflection, realization, pressure, stress, fear of making mistakes, planning, anticipating', 'regret, irritation, anger', 'worry, inexplicable, search for causes, mostly physical, listen to yourself, keep observing, pain, subconscious processes, strange thoughts', 'thoughts, lost, peaceful, calm, summer meadow, vacation, pleasant']"	32	[[8, 20], [32, 49], [40, 36], [34, 37], [41, 47], [22, 57], [33, 54], [35, 42], [46, 26], [33, 57], [41, 31], [21, 6], [21, 47], [41, 50], [43, 56], [10, 27], [46, 48], [28, 35], [18, 28], [33, 57], [13, 43], [42, 54], [39, 55], [38, 51], [8, 19], [36, 51], [11, 39], [30, 58], [43, 52], [38, 9], [43, 51], [35, 54]]	[6, 8, 8, 9, 10, 11, 13, 18, 19, 20, 21, 21, 22, 26, 27, 28, 28, 30, 31, 32, 33, 33, 33, 34, 35, 35, 35, 36, 36, 37, 38, 38, 39, 39, 40, 41, 41, 41, 42, 42, 43, 43, 43, 43, 46, 46, 47, 47, 48, 49, 50, 51, 51, 51, 52, 54, 54, 54, 55, 56, 57, 57, 57, 58]	36	38.5	2.0	60	[[0.4557380676269531, 0.4425069987773895], [0.4439544975757599, 0.43157127499580383], [0.42081913352012634, 0.4276444613933563], [0.43558916449546814, 0.4304015338420868], [0.4262829124927521, 0.4189768135547638], [0.44284743070602417, 0.37225720286369324], [0.4564376175403595, 0.43244633078575134], [0.4123245179653168, 0.4023565649986267], [0.42324480414390564, 0.4324207603931427], [0.41711342334747314, 0.3864770829677582], [0.42388013005256653, 0.43432509899139404], [0.44299304485321045, 0.4569466710090637], [0.4622657299041748, 0.4371235966682434], [0.4070640504360199, 0.39627569913864136], [0.4263283908367157, 0.40681901574134827], [0.4547368884086609, 0.43223080039024353], [0.4454803466796875, 0.4418177008628845], [0.4324358403682709, 0.4277024567127228], [0.468031644821167, 0.45486950874328613], [0.437770277261734, 0.4089219868183136], [0.4400278627872467, 0.412705659866333], [0.4194014072418213, 0.40546831488609314], [0.4232300817966461, 0.40765684843063354], [0.439616322517395, 0.42955875396728516], [0.44789108633995056, 0.42989033460617065], [0.4309212267398834, 0.4216591417789459], [0.4501359164714813, 0.41752445697784424], [0.41568639874458313, 0.35982751846313477], [0.41614580154418945, 0.40200814604759216], [0.4268938899040222, 0.44398078322410583], [0.42644640803337097, 0.4153662323951721], [0.4167478680610657, 0.3924195170402527]]	0.85314498282969	28.18263004819552
31	Mege	neu	['taking note that someone has completed all of their duties.', 'the sure trust in someone who reliably fulfills his duties.']	"['surprise, joy, lost', 'couch, bed, yoga, sunday, doing things together separately in a shared apartment', 'limiting, compulsion, impatience, time standing still, attention, concentration, expectation', 'crowd, to-do list, interesting, i should do my own tasks, guilt, joy for other person, effort, motivating', 'good, keep it up, nice, impressed, need to catch up, urgency, to-do list, productive, mature, in control, competent, work', 'loss, tiredness, weak, unfocused', ""quietly, go, don't feel like it, mail, neighbor"", 'introverted, avoiding socializing, beautiful, being alone, am i missing something?, lonely, calm, easygoing, afraid of unpleasant conversations', 'happiness, joy, lightheartedness, fun, beautiful', 'blockade, looking for memory gaps, convulsive, amazed, headless, shame', 'excitement, preparation, uncertainty, hyper, being excited, upbeat', 'happiness, love, affection, trust', 'luck, money, tidying up, find', 'excitement, tension, hope, spark, exciting', 'learn through repetition', 'secretly, wait and choose another way', 'satisfaction, success, congratulations, gratitude', 'decency, respect, intuition, stress, education', 'practice creates masters', 'calm, melancholy, exhaustion, not wanting to disappoint anyone, tiredness, silence, depression', ""unnecessary, permanently, don't forget, come to rest, regret, change, lack of understanding, thoughts, in bed, alone, insecure"", 'insecure, complex, body, soul', ""misperforming, wishful thinking, mostly doesn't work, holding back, wish, hoping, hoping, that someone will get the message, not standing by themselves, no self-confidence, variable behavior, not natural, restriction, no maximizing utility"", 'disinterest, laziness, no desire', 'excited, nervous, uncomfortable, afraid, restless, not relaxed', 'too much, exaggerated, franzi, argument, sneeze, irritated, skipped action, react', 'funny, interesting, exciting', 'exciting, curiosity, infatuation', 'calm, happy, proud, celebrate', 'important, few do, practice, repetition, pro', 'joy, surprise, beauty, unexpected, coincidence', 'mansplaining, assault, sometimes nice, well intentioned, possibly unreflective, depending on the situation', 'mosquito/elephant, overreact, be sensitive, frantic']"	33	[[9, 41], [58, 36], [56, 41], [58, 35], [36, 13], [45, 42], [33, 12], [57, 8], [42, 25], [54, 41], [25, 10], [37, 47], [47, 36], [45, 40], [40, 25], [40, 47], [44, 52], [56, 38], [43, 27], [58, 31], [45, 13], [43, 45], [28, 8], [46, 43], [30, 7], [36, 12], [7, 24], [40, 46], [36, 50], [55, 39], [49, 48], [16, 10], [14, 8]]	[7, 7, 8, 8, 8, 9, 10, 10, 12, 12, 13, 13, 14, 16, 24, 25, 25, 25, 27, 28, 30, 31, 33, 35, 36, 36, 36, 36, 36, 37, 38, 39, 40, 40, 40, 40, 41, 41, 41, 42, 42, 43, 43, 43, 44, 45, 45, 45, 45, 46, 46, 47, 47, 47, 48, 49, 50, 52, 54, 55, 56, 56, 57, 58, 58, 58]	35	40.0	0.0	60	[[0.44896605610847473, 0.4244358241558075], [0.4063473045825958, 0.4393056631088257], [0.39112529158592224, 0.41117560863494873], [0.41571468114852905, 0.44303762912750244], [0.435801237821579, 0.45376482605934143], [0.42809292674064636, 0.43105548620224], [0.4189119338989258, 0.4445354640483856], [0.42835527658462524, 0.49071204662323], [0.40104493498802185, 0.41616785526275635], [0.41017434000968933, 0.4288387894630432], [0.4341496229171753, 0.4553377032279968], [0.42350664734840393, 0.4155018925666809], [0.41436517238616943, 0.420462042093277], [0.4059336185455322, 0.4118789732456207], [0.4226485788822174, 0.4351019561290741], [0.4385722279548645, 0.43286585807800293], [0.41477417945861816, 0.410403847694397], [0.3865714371204376, 0.40950626134872437], [0.4158884584903717, 0.4282211363315582], [0.3897418677806854, 0.41948333382606506], [0.4394938051700592, 0.46635234355926514], [0.4134058952331543, 0.4129321575164795], [0.4001840651035309, 0.41849958896636963], [0.4159219264984131, 0.4175876975059509], [0.42314913868904114, 0.45373281836509705], [0.424751341342926, 0.45181161165237427], [0.4687916338443756, 0.44607850909233093], [0.42168858647346497, 0.41892072558403015], [0.42829182744026184, 0.4164966344833374], [0.3924878239631653, 0.41364696621894836], [0.4151769280433655, 0.4153299629688263], [0.4466901421546936, 0.45543646812438965], [0.45770448446273804, 0.4693385064601898]]	0.8532236236514468	28.18263004819552
32	Faube	emo	['the eye contact two people share while both hoping the other person will make the first move.', 'the possibility that eye contact with another person will result in a conversation that they initiate.']	['culture, abroad, friends, travel, learn', 'discomfort, envy but also a feeling of well-being to see it in others', 'exaggeration, actionism, insecurity, nervousness, experience, cause, inappropriate', 'love, family, baby, mother, sister, hug, cuddle, need, the most beautiful feeling, affection, support, hold, father, attachment, heart', 'prevention, neuroticism, sleepless night, unknown, circling thoughts, unnecessary, noise, no rest', 'interest, contentment, compassion, pride', 'money, joy, beautiful, yay, share, tell', 'oh crap, thoughtful, angry, desperate', 'excitement, preparation, avoiding awkward situations, scenarios', 'planning, future, fulfillment, self-realization, talent, idea, original, have, status', 'introspective, silence, independence, rest, having time, stress-free', 'loneliness, isolation, calm, sometimes pleasant, silence, headache', 'waiting, waiting time, impatient, too early, traveling, airport, train station, summer vacation', 'love, tension, ravishing, longing, warm', 'security in familiar surroundings', 'satisfied, self-confidence', 'preparation, restlessness, stress, uncertainty, goal, calming down', 'self-reflection, further development, intelligence', 'contentment, happiness, joy', 'unwanted, annoying, annoying, annoying, bothersome, unnecessary, dismiss, ignore', 'satisfied, happy, relieved, insecure, next step, change, own, decision', 'warmth, security, peace, happiness, trust, calm', 'restlessness, joy, excited, elation, great people are coming, event is important, special, starting, wanting to start, waiting position, not so great but nice, anticipation makes everything nicer', 'self-criticism, self-evaluation, negative, positive, reflect, claims', 'fulfilled, satisfied, rest, alone', 'friends, fun, anticipation, excitement, optimism, see ahead, oracle, see through, neighbors', 'serenity, crazy', 'excitement, nervousness, insecurity, stage fright', 'shit, thoughts, overthinking, self-blame, influences, helplessness', 'sometimes, only if allowed', 'stress, planning, uncomfortable, hiding, closeness', 'no idea, very neutral', 'dutiful, virtuous, diligent, hard work, structured']	33	[[0, 20], [0, 10], [0, 14], [0, 28], [5, 31], [0, 25], [5, 30], [0, 22], [3, 23], [5, 20], [0, 30], [3, 41], [0, 9], [3, 21], [10, 53], [0, 46], [0, 48], [1, 29], [1, 51], [0, 8], [1, 8], [8, 40], [2, 45], [0, 9], [0, 20], [1, 15], [9, 53], [3, 21], [0, 20], [17, 51], [2, 19], [23, 53], [4, 32]]	[0, 0, 0, 0, 0, 0, 0, 0, 0, 0, 0, 0, 0, 0, 1, 1, 1, 1, 2, 2, 3, 3, 3, 3, 4, 5, 5, 5, 8, 8, 8, 9, 9, 9, 10, 10, 14, 15, 17, 19, 20, 20, 20, 20, 21, 21, 22, 23, 23, 25, 28, 29, 30, 30, 31, 32, 40, 41, 45, 46, 48, 51, 51, 53, 53, 53]	15	9.0	42.0	60	[[0.49739870429039, 0.44217362999916077], [0.4897620975971222, 0.43978092074394226], [0.5042094588279724, 0.4549230933189392], [0.49631860852241516, 0.4462968409061432], [0.46252337098121643, 0.42734190821647644], [0.4704916179180145, 0.42010194063186646], [0.4606466591358185, 0.42947858572006226], [0.4878629148006439, 0.45139363408088684], [0.46514731645584106, 0.42885804176330566], [0.4803304672241211, 0.44636157155036926], [0.517296552658081, 0.4525673985481262], [0.47341686487197876, 0.42109620571136475], [0.4856879413127899, 0.44771015644073486], [0.4652961492538452, 0.432282954454422], [0.4382942318916321, 0.40003514289855957], [0.48598286509513855, 0.42286455631256104], [0.48237526416778564, 0.4180806577205658], [0.46625804901123047, 0.41371285915374756], [0.4658532440662384, 0.41097959876060486], [0.5197646021842957, 0.4803600311279297], [0.4862152636051178, 0.450564444065094], [0.45498761534690857, 0.41540035605430603], [0.46620550751686096, 0.42490822076797485], [0.4944196045398712, 0.4539836347103119], [0.4746600389480591, 0.44199955463409424], [0.46131229400634766, 0.42613455653190613], [0.4547366201877594, 0.41050249338150024], [0.480670303106308, 0.4424634277820587], [0.501958966255188, 0.4544766843318939], [0.444741427898407, 0.40658092498779297], [0.47050976753234863, 0.4348217248916626], [0.44164136052131653, 0.40813642740249634], [0.4550706148147583, 0.4089130461215973]]	0.9081009572202509	28.18263004819552
33	Faube	neu	['the possibility that eye contact with another person will result in a conversation that they initiate.', 'the eye contact two people share while both hoping the other person will make the first move.']	['at home, vacation, outside, quiet, security, self-care', 'love, intimacy, contentment, partnership, friendship, family, togetherness, community, beautiful, in love, happy, secure', 'excitement, pure joy, butterflies in the stomach, curiosity about getting to know each other, can hardly believe it', 'uncertainty, conversation, gaze, looking away, intense', 'happiness, joy, pleasant', 'great feeling, i wish everyone, that they can be proud of themselves, you only see them from a distance, you want to tell everyone about it, when you find yourself, betri', 'worry, not wanting to do anything wrong, decisive, planning, excited, mistakes, self-presentation', 'satisfaction, smile, i want too, warm feeling', 'english, french, new challenge', 'anger, self harm, evil thoughts, calm down, breathe deeply, reset, challenges, change, self love, figure out what triggered it', 'rest, peace, love, togetherness', 'old acquaintances, work colleagues, former enemies', 'training, practice, develop, improve, start, dedicated, self-test, strive', 'home, family, friends, partner, love, trust, happy, free, easy', 'alarming, excited, amazed, anxious, frightened, satisfied, happy, worth seeing, imitate, learn', 'panic, bad conscience, concerns, wait and see, unsure', 'insecure, cautious, unrelaxed, tension, shame, anxiety, avoidance, conforming, wanting to please, fear of rejection and rejection, weak, unstable, unconfident, dependent', 'wanting to be safe, sensitive, overly cautious, hypersensitive', 'anticipation, excitement, tension, longing, hope, joy, fear', 'drained, worries, thoughts, lack of concentration, support, hope, friends, partner, fateful event', 'family, love, reference persons, pride, not a matter of course', 'interesting, comparison to self, diligence of the other person', 'neighbors, postman, being excited, weird feeling, restless, silence, pretending, uncomfortable feeling, hiding, confrontation', 'balance, harmony, happiness, relaxation, rarely, desire, the feeling stays, sometimes also desire to go back to sleep', 'love, tenderness, strange, exciting, reserved, annoyed', 'depression, sudden, crying, unstoppable, depressed', 'children, neighbors, isolation, no desire, apartment, house, privacy', 'impulsive, irritable, charged, energized, stressed, angry, hormonal imbalances', 'difficult, understanding, effort, concentration, despair, failure', 'love, confidence, trust, well-being, empathy', 'rain, rest, being alone, eternity, carefree, no plans, difficult to force, nervousness is the opposite, aimless, rushing, giving in to thoughts, looking afar', 'annoying, unnecessary, annoying, mom']	32	[[54, 1], [10, 0], [41, 1], [35, 5], [53, 1], [30, 4], [46, 6], [29, 6], [44, 2], [18, 4], [23, 0], [22, 0], [13, 0], [14, 0], [28, 4], [33, 8], [39, 4], [52, 12], [49, 0], [24, 5], [45, 5], [19, 4], [7, 0], [42, 0], [33, 8], [19, 3], [46, 6], [9, 1], [35, 7], [31, 4], [19, 1], [17, 0]]	[0, 0, 0, 0, 0, 0, 0, 0, 0, 1, 1, 1, 1, 1, 2, 3, 4, 4, 4, 4, 4, 4, 5, 5, 5, 6, 6, 6, 7, 7, 8, 8, 9, 10, 12, 13, 14, 17, 18, 19, 19, 19, 22, 23, 24, 28, 29, 30, 31, 33, 33, 35, 35, 39, 41, 42, 44, 45, 46, 46, 49, 52, 53, 54]	16	8.5	44.0	60	[[0.41478052735328674, 0.4791617691516876], [0.4608601927757263, 0.5099729895591736], [0.43226340413093567, 0.4847213625907898], [0.4064202308654785, 0.4474135935306549], [0.4092581868171692, 0.4623563587665558], [0.4306577444076538, 0.4650294780731201], [0.4207044541835785, 0.46741408109664917], [0.4341352880001068, 0.4546186923980713], [0.43906813859939575, 0.48441267013549805], [0.4453606903553009, 0.4784505367279053], [0.4314606785774231, 0.47181975841522217], [0.42451211810112, 0.4774465560913086], [0.4531017243862152, 0.50716233253479], [0.45900601148605347, 0.5098975300788879], [0.41923078894615173, 0.4568847715854645], [0.42968568205833435, 0.45274198055267334], [0.44266557693481445, 0.48435941338539124], [0.4100263714790344, 0.4552755653858185], [0.4090523421764374, 0.4727206528186798], [0.42901527881622314, 0.4623025953769684], [0.4042503237724304, 0.44725868105888367], [0.43031519651412964, 0.44788479804992676], [0.4873379170894623, 0.5323521494865417], [0.4263356626033783, 0.4857834279537201], [0.42351382970809937, 0.45420369505882263], [0.4399174749851227, 0.46879488229751587], [0.4164075255393982, 0.4623294472694397], [0.45987221598625183, 0.49145442247390747], [0.4001843333244324, 0.4439614415168762], [0.4155682325363159, 0.44612154364585876], [0.44307154417037964, 0.4724259376525879], [0.4335101842880249, 0.4731837213039398]]	0.9028583345934749	28.18263004819552
34	Odef	emo	['the pride when you realize that you have developed in the right direction.', 'the realization that you have evolved in the direction you envisioned.']	"['shopping, child care, annoying', ""signs of depression, overwhelming feeling, you don't know what to do, take countermeasures, do something that distracts, take responsibility, cultivate your emotional world"", 'joy, embarrassment, tension, excitement, impatience, life', 'interesting, dream diary, wanting to go back to sleep, thinking further of dream, like a good movie, vivid, joy, nightmare, reality, surreal, vivid, hidden', 'inappropriate, or helpful, from behind, excuse me, tip, rarely occurs, unusual, rude, older people', 'proud, relief, sublime, courageous, zest for action', 'men, relationships, attachment, sex, letting go', 'crappy, annoying, headache, feeling flabby, not ready for the day, heavy body, caffeine thirst', 'proud, creative', 'annoyed, amazed, grateful, ambivalent, know-it-all, authority, pejorative, friendly, useful, annoying, superfluous', 'avoiding, uncomfortable, avoidance, conflict of interest, disagreement', 'trust, well-being, friendship, love', 'love, butterflies, happiness, joy', 'possibly annoying, sometimes useful, depending on the situation', 'waiting period', 'waiting, coffee, looking at the phone', 'gratitude, appreciation, love, hug, happiness, warmth, laughter, smile, contentment, being at home', 'security, no need to adjust, quiet', 'reflect', 'reliability, calm, serenity, confidence, professionalism, pillar, partner', 'love, security, closeness, belonging, warm, forever, heart, limitless, connected', 'lazy, shy, insecure, alone, stay, house, corridor, noise', 'rest, happiness, being one, yoga, rarely, peaceful, secure, without rushing, for oneself, individually different, happy place', 'need help, uncertainty, insight', 'empathy, treat, love, friendship, happy', 'ohm, yoga, meditation, bed, relax, rest, alone, calm, relaxed, lying, eyes closed, spread out', 'boredom, stress, listless', 'confirmation, fulfillment, perspective, joyful, successful', 'rest, meditate, relaxed, within yourself, no thoughts', 'overthinking, young people, often, exhausting, planning, thinking, acting out', 'uncomfortable, thinking, standing on the hose, looking at the ground, looking for synonyms, paraphrasing', 'studies, career, relationship, religion, personality, strength, self-confidence', 'love, affection, security, bond, trust']"	33	[[59, 42], [59, 37], [29, 23], [55, 47], [59, 16], [49, 19], [57, 56], [59, 24], [30, 13], [54, 9], [30, 20], [59, 49], [59, 44], [29, 43], [20, 28], [59, 49], [59, 36], [59, 25], [41, 57], [59, 34], [54, 51], [59, 46], [59, 48], [55, 13], [54, 55], [59, 45], [59, 50], [50, 45], [31, 18], [59, 51], [59, 34], [59, 52], [59, 50]]	[9, 13, 13, 16, 18, 19, 20, 20, 23, 24, 25, 28, 29, 29, 30, 30, 31, 34, 34, 36, 37, 41, 42, 43, 44, 45, 45, 46, 47, 48, 49, 49, 49, 50, 50, 50, 51, 51, 52, 54, 54, 54, 55, 55, 55, 56, 57, 57, 59, 59, 59, 59, 59, 59, 59, 59, 59, 59, 59, 59, 59, 59, 59, 59, 59, 59]	44	49.5	0.0	60	[[0.3972019851207733, 0.4393838047981262], [0.3893217444419861, 0.4417681396007538], [0.406589150428772, 0.41278061270713806], [0.4280340373516083, 0.43657222390174866], [0.39576229453086853, 0.4477943778038025], [0.3949194848537445, 0.424761027097702], [0.389211505651474, 0.3909982740879059], [0.4050429165363312, 0.45514023303985596], [0.4267677366733551, 0.44040217995643616], [0.41827839612960815, 0.4674062430858612], [0.4063658118247986, 0.4165354073047638], [0.3879130184650421, 0.40659329295158386], [0.3934730291366577, 0.43078044056892395], [0.42304834723472595, 0.40869301557540894], [0.4404715597629547, 0.4334205090999603], [0.3831404745578766, 0.40276259183883667], [0.4042731523513794, 0.43926411867141724], [0.3967050313949585, 0.44178104400634766], [0.4268147945404053, 0.40732863545417786], [0.37857991456985474, 0.4263438880443573], [0.3951839804649353, 0.40049228072166443], [0.4041626453399658, 0.44003477692604065], [0.3948628902435303, 0.41946661472320557], [0.4174056947231293, 0.4546361267566681], [0.3956241011619568, 0.3936552405357361], [0.40811923146247864, 0.4547533094882965], [0.390389621257782, 0.42138344049453735], [0.38903865218162537, 0.3943530023097992], [0.4107549786567688, 0.420756995677948], [0.37062904238700867, 0.41228172183036804], [0.3809566795825958, 0.43381020426750183], [0.37921416759490967, 0.4157741367816925], [0.3851143419742584, 0.40450453758239746]]	0.8257509957660328	28.18263004819552
