15	Ismiprämpf	neu	['assuming someone is coming to visit and regularly checking to see if the person has arrived.', 'the anticipation when you are expecting visitors and are constantly impatiently checking whether the person has arrived.']	"['excitement, test, application, uncomfortable, fear', ""useless, funny, i wouldn't check all the time, i know when it's coming"", 'meditation, rest, balance, freedom, contemplation, time, relaxation', ""silence, avoid, neighbors, postman, tense, don't feel like talking, taking a shower, eating, in pajamas or naked, looking through window, incompetence, childish, afraid, annoyed"", 'zen, buddha, buddhism, calm, stillness, free, connected, in the here and now, soul, being one', 'nervous, mental, stage fright, organized, in control, insecure', 'growing up, important, meta, good feeling, empowerment, me, great', 'inwardly listening, surprised, thoughtful, irritated, amazed, stopping, wants to hide', 'beautiful, lust, fun, necessary, gone, new', 'impatient, waiting, searching, window, looking out, clock, walking around, door, restless, anticipation', 'empathy, encouragement, cheering, sharing and giving joy, warmth, support', 'communication, interaction, exchange, friendly, interesting, learn something new, make contacts', 'dream, blissful, mad, sleep', 'joy, warm feeling, fullness, good day, life', 'hypocritical behavior', 'postman, garbage collector, hope for neighbors', 'joy, gratitude, appreciation, warmth, smile, laugh', 'relaxation, melancholy, memory', 'relaxed, confidence', 'contentment, rest, peace, rested, energy, joy, security', 'uncertainty, fear, trust, nervous, sweat, strange, inhibition, mouth, hearing, speaking, classroom, presentation', 'planning, positive, development, happiness, study, work, learn', ""annoying, time-consuming, emotional imbalance, devastating, groundless, suddenly, for no reason, trying to see, where it's coming from, help, attitude change, slow, tired, sadness"", 'harmony, relaxation, calm, contentment, serenity', 'happiness, joy, community, fun, genuine, carefree', 'pack your suitcase, corona, joy, excitement, excited, noise, pull, zipper', 'fear, husslen, focus, training, anger, envy', 'passion, love, warmth', 'productive, proud, start up', 'rude, ringing, lazy, slow', 'unable to get going, stress, been up too long, slept poorly, tossing and turning, lying down, staring at the ceiling, headache', 'look at the window, check whatsapp status, wait at the door, anticipation, expectations', 'exam, be well prepared, orderly, structured']"	33	[[4, 29], [15, 32], [41, 1], [2, 9], [23, 9], [10, 2], [19, 4], [4, 7], [15, 11], [27, 2], [19, 2], [7, 1], [3, 9], [27, 18], [45, 10], [5, 23], [18, 24], [11, 2], [35, 3], [30, 4], [1, 2], [29, 4], [7, 5], [37, 8], [26, 8], [5, 7], [27, 3], [23, 5], [25, 3], [1, 10], [23, 4], [3, 8], [5, 19]]	[1, 1, 1, 1, 2, 2, 2, 2, 2, 2, 3, 3, 3, 3, 3, 4, 4, 4, 4, 4, 4, 5, 5, 5, 5, 5, 7, 7, 7, 7, 8, 8, 8, 9, 9, 9, 10, 10, 10, 11, 11, 15, 15, 18, 18, 19, 19, 19, 23, 23, 23, 23, 24, 25, 26, 27, 27, 27, 29, 29, 30, 32, 35, 37, 41, 45]	13	8.5	39.0	60	[[0.45459794998168945, 0.4225744605064392], [0.45054250955581665, 0.4253579378128052], [0.41115787625312805, 0.4607234001159668], [0.4860236346721649, 0.47336986660957336], [0.4446953237056732, 0.46538856625556946], [0.4548735022544861, 0.48532673716545105], [0.4546896517276764, 0.47563478350639343], [0.4540131986141205, 0.44889479875564575], [0.4280116558074951, 0.4366423487663269], [0.4346441328525543, 0.46681439876556396], [0.42813757061958313, 0.4507102370262146], [0.47569403052330017, 0.48900553584098816], [0.466552197933197, 0.4572761356830597], [0.40998825430870056, 0.4164150655269623], [0.4030681252479553, 0.42348185181617737], [0.45377448201179504, 0.42641937732696533], [0.42209383845329285, 0.4133688509464264], [0.43499085307121277, 0.44672301411628723], [0.4293895959854126, 0.4569380283355713], [0.42283695936203003, 0.45701128244400024], [0.49922701716423035, 0.4906482994556427], [0.4336439073085785, 0.4782002568244934], [0.45266255736351013, 0.45517823100090027], [0.40188488364219666, 0.43856948614120483], [0.4277793765068054, 0.4546303451061249], [0.4879581928253174, 0.4855784773826599], [0.44151046872138977, 0.4839652478694916], [0.43542683124542236, 0.45530083775520325], [0.4512065052986145, 0.4753493070602417], [0.4712255895137787, 0.4554060697555542], [0.42411166429519653, 0.4654780626296997], [0.4903489947319031, 0.4813444912433624], [0.4503437876701355, 0.4275062084197998]]	0.9009799126422766	28.18263004819552
16	Glühm	emo	"[""pretending to be out of the house when there's a knock on the door and hoping the person will leave."", 'when there is a knock on the door, sit still and wait to see if it knocks again.']"	['massage, relaxation, friend, love, wellness', 'happy, money, old things from before, sorting out, tidying up', 'joy, desire, butterflies in the stomach, excitement, imagination, closeness, gratitude', 'cheering, brighten day, surprise, money, reminder of other person, grin, happy, gift', 'self-confident, proud, adult, determined, competent, important, hopeful, clarity, clear head, no more headaches (vul), finally, free', 'closed, sad, introverted, desperate, loss of confidence, pain', 'why, explanation, uncertainty, tingles', 'uncomfortable, sweat, practicing again and again, queasy feeling, palpitations, perfectionism, wanting to push back', 'tired, lazy, bad mood', 'worry, fear, apprehension, apprehension, thinking, mind circles, trapped, over worried, imprisoned', 'waiting for better offers, indecisiveness, please others', 'empathy, feel into it', 'nightmares, insomnia, discomfort, tired, sleep', 'too bad, escaped', 'waiting impatiently, a person you like', 'unpleasant, feeling you get away badly, doubting where you got this feeling from', 'laugh, hug, congratulations, inspiration, love, friendship, happiness, deserved, success', 'calm, still, tension, alert, senses, waiting', 'anger, anger', 'novice, learning process, insight, wisdom, experience, realism, plan', 'room, dreaming, bed, sleeping, long night, tired, sluggish, short', 'hands, skin, love, affection, trust, together', 'training, practicing, getting better, mastering, perfecting, beginning, learning, skill, improving, engaging, only things of interest, time, intention, comparing, self-interest', 'tired, exhausted, broken, listless, depressed, worried, restless', 'trauma, insecurity, lonely, sad', 'we forever together, mom, dad, baby, family, warmth, sofa, hug, chips, blanket, support, always there, phone, advice, help, tools, spices, great, not all have', 'mourning, alone, crying, looking ahead', 'surprising, happy, exciting', 'sweet, cringe, uncomfortable, envy', 'relief, trust, security, rare', 'pride, self-confidence, happiness, joy, future, work', 'love, money, happiness, security', 'getting too close, unasked, know-it-all, helpful, problem']	33	[[11, 33], [58, 13], [42, 21], [5, 9], [25, 4], [9, 2], [13, 29], [9, 19], [45, 10], [3, 18], [7, 14], [28, 4], [18, 27], [5, 25], [22, 27], [55, 24], [14, 11], [5, 15], [13, 48], [10, 1], [58, 10], [3, 28], [5, 32], [58, 8], [21, 15], [47, 41], [28, 26], [15, 4], [31, 10], [44, 24], [6, 5], [26, 6], [17, 10]]	[1, 2, 3, 3, 4, 4, 4, 5, 5, 5, 5, 5, 6, 6, 7, 8, 9, 9, 9, 10, 10, 10, 10, 10, 11, 11, 13, 13, 13, 14, 14, 15, 15, 15, 17, 18, 18, 19, 21, 21, 22, 24, 24, 25, 25, 26, 26, 27, 27, 28, 28, 28, 29, 31, 32, 33, 41, 42, 44, 45, 47, 48, 55, 58, 58, 58]	20	15.0	21.0	60	[[0.44032609462738037, 0.4146331548690796], [0.38059863448143005, 0.444381982088089], [0.4128607511520386, 0.43315771222114563], [0.46141672134399414, 0.4513956606388092], [0.4471820294857025, 0.46645089983940125], [0.46343129873275757, 0.47082167863845825], [0.4419287443161011, 0.4263986349105835], [0.47655344009399414, 0.4617740213871002], [0.43189963698387146, 0.4597826302051544], [0.464507520198822, 0.42750903964042664], [0.45017391443252563, 0.428193062543869], [0.43933865427970886, 0.4642833471298218], [0.4404316842556, 0.4330553412437439], [0.4709157943725586, 0.4510670006275177], [0.4324565827846527, 0.42527613043785095], [0.40062952041625977, 0.4306963384151459], [0.45512810349464417, 0.46078670024871826], [0.44778600335121155, 0.42950955033302307], [0.4377906918525696, 0.4045674502849579], [0.455645889043808, 0.48634278774261475], [0.39976805448532104, 0.46399110555648804], [0.45795440673828125, 0.41635021567344666], [0.46322283148765564, 0.42637404799461365], [0.40266886353492737, 0.4641849398612976], [0.45202285051345825, 0.45839154720306396], [0.41141781210899353, 0.41849908232688904], [0.42106589674949646, 0.4234459102153778], [0.4539472162723541, 0.4655863046646118], [0.43469738960266113, 0.45416560769081116], [0.42904239892959595, 0.4433688223361969], [0.4696473479270935, 0.47123265266418457], [0.4412478506565094, 0.460556298494339], [0.43367090821266174, 0.44334498047828674]]	0.8848772780461744	28.18263004819552
17	Glühm	neu	"['when there is a knock on the door, sit still and wait to see if it knocks again.', ""pretending to be out of the house when there's a knock on the door and hoping the person will leave.""]"	"['nervous, interview, important, fear, practice, prepare, get better, good impression', 'random, joy, rediscovery, happiness, idea, key, search, find', 'plan, satisfaction, pride, achieve goal, celebrate success', 'unwanted, pushy, annoying, irritable, negative, tip, well intentioned, unhelpful, useless', 'far too often, exhausting', ""nice feeling, it's the little things, being happy for others, treating yourself, cheering, relief, when something great worked out, cozy gut feeling, smile, joy, fam"", 'need to talk, shyness, give up initiative, give up responsibility, expectations, hope, order, unknown, get to know, strange', 'negative feeling', 'bad past, more likely to hope for a better future, distrust, individuality', 'tired, reproach, staying in bed, stress, nice evening, series, closing eyes, not responsive', 'exciting, sweating, stage fright', 'positive, learning, being able to master', 'foreign language, technical term, frustration, thinking, going through it again and again, excited, scratching your head, come back later', 'anger, desperation, hard thinking, on the tip of the tongue, stupid', 'effort, learn, drive, stimulus, happiness, pride, sweat, practice, excited, obstacles', ""surprise, joy, new, unexpected, doesn't matter"", 'mind circles, alienation, restlessness, tension, stiff, unrelaxed, agitated, restless, helpless, cramped, no physical contact, stuck in the head, no way out, exhausting, aimless', 'freedom, power, feels good, free will, independent, strong', ""nervous, embarrassed, embarrassed, feels stupid, watches out for mistakes, doesn't dare, shaky, sweating, insecure"", 'fit, expectation, relaxation, energy, hope, warm, sensation, wanting to relive, realize, share', 'pride, motivation, excitement, nervousness, insecurity, courage', 'why?, insecure, uncomfortable, whimsical, anxious, seeking causes', 'pride, satisfaction, future, success, review, evaluation, go your own way, good feeling', 'incomprehension, helplessness, period, hormones, anger, reflection, feelings of guilt', ""often frustrating, afterwards you have the feeling that you can do it better, vocabulary that doesn't come to mind, exhausting, want to be able to"", 'unpleasant, stress, waiting, uncertainty, hearing, inner restlessness, excitement', 'personal development, own performance, reflection, life path, good feeling, future', 'repetition, excitement and nervousness, uncomfortable, thought circles, acting out every possible situation, weighing up, preparation, concentration, focus', 'fear, annoyed, neighbors, desire for quiet, introverted, shy of confrontation', 'expectation, fear of rejection, disappointment', 'insecure, communication, fear, worry, embarrassed, study, school, classes, embarrass, pressure, vacation, forget', 'kitsch, stupid']"	32	[[18, 6], [5, 20], [42, 4], [3, 24], [3, 5], [56, 58], [26, 5], [55, 9], [6, 30], [3, 5], [6, 28], [17, 28], [23, 18], [6, 57], [13, 3], [10, 6], [17, 48], [4, 6], [6, 21], [2, 1], [4, 1], [2, 4], [16, 3], [7, 3], [19, 11], [5, 23], [3, 12], [17, 3], [16, 45], [28, 9], [1, 14], [19, 4]]	[1, 1, 1, 2, 2, 3, 3, 3, 3, 3, 3, 3, 3, 4, 4, 4, 4, 4, 5, 5, 5, 5, 5, 6, 6, 6, 6, 6, 6, 6, 7, 9, 9, 10, 11, 12, 13, 14, 16, 16, 17, 17, 17, 18, 18, 19, 19, 20, 21, 23, 23, 24, 26, 28, 28, 28, 30, 42, 45, 48, 55, 56, 57, 58]	15	9.0	47.0	60	[[0.433015376329422, 0.4550609886646271], [0.47934025526046753, 0.45772677659988403], [0.4060461223125458, 0.45390379428863525], [0.5036882162094116, 0.4702538251876831], [0.4612811505794525, 0.46094292402267456], [0.38911911845207214, 0.3802737891674042], [0.45933225750923157, 0.4919009804725647], [0.39917370676994324, 0.44268861413002014], [0.4580891728401184, 0.44056567549705505], [0.47486168146133423, 0.47186142206192017], [0.4551941752433777, 0.43604159355163574], [0.4424207806587219, 0.43066418170928955], [0.4560297131538391, 0.461846262216568], [0.4566185772418976, 0.39776647090911865], [0.4438921809196472, 0.4625757038593292], [0.4334067702293396, 0.4493906795978546], [0.4611299932003021, 0.4408569037914276], [0.4453890323638916, 0.4413783848285675], [0.47887229919433594, 0.464684396982193], [0.47993147373199463, 0.48607805371284485], [0.4762991964817047, 0.48540276288986206], [0.47983646392822266, 0.47801461815834045], [0.42759791016578674, 0.4561449885368347], [0.4575417637825012, 0.46882426738739014], [0.43441200256347656, 0.439883291721344], [0.4648054540157318, 0.4425523579120636], [0.4738956093788147, 0.4458983838558197], [0.44272100925445557, 0.4806768596172333], [0.4383656978607178, 0.40883398056030273], [0.42920759320259094, 0.45026445388793945], [0.5073163509368896, 0.47819435596466064], [0.43751558661460876, 0.455280601978302]]	0.9053993448615074	28.18263004819552
18	Rugliebast	emo	['nervously replay an important conversation in your head to avoid making mistakes.', 'mentally rehearse a future conversation to prepare for it.']	"['bold, anger, insecurity, meddling, pushy', 'insecurity, shyness, interest, speaking, silence, gestures, looks', 'well-being, love, warmth, security, feels good, watch out', 'learn, influence, imitation, empathy', 'social pressure, trust more, become more tolerant of mistakes, understandable', 'disturbing, you immediately start thinking, overinterpret, think about what it could be, you look for a reason, fear, that it could be something bad, mostly nothing bad at all, often happens quickly', ""don't care, unimportant, lazy, don't want to get up, avoid contact, don't want to be disturbed"", 'why, pain, trembling, feeling', 'nice, annoying, helpful', 'love, childhood, happiness, contentment, well prepared for the future, unfortunately not for everyone, every child deserves love and closeness and warmth, mother, hug, laughter, carefree, avoidance of disturbances', 'coward', 'annoying, provocative, corrosive, parents, teachers', 'relationships, social interactions, people, influencing, observing, changing behavior, thinking, calling parents, empathy, important, lonely', 'joy, excitement, relief, hiding', 'warmth, letting go, joy, happy, relaxed, carefree, fun, good conversations, listening ear, problem solving, no stress', 'anger, embarrassment, demonstration effect, maddening, self-reproach, restless', 'fuck, not now, who is that, not in the mood, avoidance, reluctance, excitement, unpleasant, wait and see, nervousness, rigidity, persevere, be hopeful', 'lust, palpitations, tense, desire, sometimes unreachable, frustration, waiting', 'frustration, irritability, dissatisfaction, sad, grumpy, angry, morose, ashamed, frustrated, crying', 'fear, distance, isolation, introverted, calm, stress, experiences, expectations, strangers, basement, cold', 'anticipation, curiosity, excited, demotivated', 'expectation, feeling of closeness, obligation, wanting to be nice', 'proverbs, foreign words, embarrassed, pause, emptiness in the head, brooding, thinking, one gets angry, restlessness, stuttering, silence, guessing', 'helplessness, overwhelm, lack of understanding, hormones, periods, reflection necessary, writing in a diary, injustice towards others', 'heart palpitations, excitement, tingling, joy, mental cinema, excitement', 'curiosity, joy, the unexpected', 'work, free time, effort, performance, invest, reward, be enthusiastic', 'trust, harmony, stability, feel safe, security, protection, carefree', 'friends, family, partner, love, warmth, cuddle, loved, accepted', 'satisfaction, sense of duty', 'dependent on the dream, wishes to return, relief, still accompanies the day, bizarre, few memories, fragmentary, fleeting, often in childhood, dependent on the person', 'work, stress, panic, exam, failure, anxiety']"	32	[[20, 31], [8, 10], [9, 3], [16, 5], [1, 11], [29, 9], [20, 18], [25, 2], [15, 19], [41, 15], [29, 25], [0, 15], [13, 17], [29, 8], [7, 45], [20, 34], [5, 34], [21, 22], [4, 8], [4, 9], [8, 36], [13, 5], [31, 11], [20, 14], [22, 20], [28, 9], [6, 4], [6, 4], [21, 13], [24, 10], [35, 21], [10, 36]]	[0, 1, 2, 3, 4, 4, 4, 4, 5, 5, 5, 6, 6, 7, 8, 8, 8, 8, 9, 9, 9, 9, 10, 10, 10, 11, 11, 13, 13, 13, 14, 15, 15, 15, 16, 17, 18, 19, 20, 20, 20, 20, 20, 21, 21, 21, 22, 22, 24, 25, 25, 28, 29, 29, 29, 31, 31, 34, 34, 35, 36, 36, 41, 45]	16	15.0	20.0	60	[[0.44150614738464355, 0.4338985085487366], [0.4552950859069824, 0.45512256026268005], [0.45322558283805847, 0.4601873457431793], [0.4440762996673584, 0.46048039197921753], [0.48007825016975403, 0.44993269443511963], [0.4153120815753937, 0.4313316345214844], [0.4571603238582611, 0.45891043543815613], [0.43594956398010254, 0.46059703826904297], [0.45433273911476135, 0.45103755593299866], [0.43300020694732666, 0.45595836639404297], [0.43258196115493774, 0.4354664087295532], [0.4580994248390198, 0.42490312457084656], [0.45491841435432434, 0.4502643942832947], [0.4262717366218567, 0.4441021680831909], [0.4534511864185333, 0.4107237458229065], [0.44720569252967834, 0.4323119819164276], [0.4624379575252533, 0.43273597955703735], [0.45027199387550354, 0.4502670168876648], [0.48607274889945984, 0.4806077778339386], [0.4962502717971802, 0.48351335525512695], [0.4449220299720764, 0.4076820909976959], [0.4433913826942444, 0.45503032207489014], [0.4690730571746826, 0.48593491315841675], [0.44597339630126953, 0.45377615094184875], [0.4413275122642517, 0.4439302384853363], [0.433888703584671, 0.4515213370323181], [0.463473916053772, 0.46547263860702515], [0.46435970067977905, 0.47356805205345154], [0.4414818584918976, 0.4541662335395813], [0.4264419972896576, 0.4382043480873108], [0.42857277393341064, 0.4375685453414917], [0.451696515083313, 0.42035526037216187]]	0.8981769727542996	28.18263004819552
19	Rugliebast	neu	['mentally rehearse a future conversation to prepare for it.', 'nervously replay an important conversation in your head to avoid making mistakes.']	"['unlikely, rare, love, friend', ""don't feel any frustration, rather a neutral feeling if it doesn't occur to you, it's not bad either"", 'rare, interesting, meaning, diffuse, short', 'ocd, wanting to succeed, perfectionism, learning, counterproductive, tension, anger, despair, self-loathing, exercise, pressure to perform, tension', 'seduction, fear, attractive, insecure, interested, erotic, flirting, beautiful, shame, sex', 'empathy, compassion, love, affection, dreams, sadness', 'unnecessary, do it, why, conscientiousness', 'pleasant, girlfriend, no stress, no arguments, always there for you, friendship, essential', 'ok', 'surprise, wonder, exaggerate, being sensitive, sensitivity, tingling', 'to be unnoticeable, ashamed, uncomfortable', 'unnecessary, cowardly, dishonest', 'home way, rain, clouds, bad weather, malaise', 'great joy, smile, treat yourself', 'getting to know each other through eye contact and resulting in conversations', 'fun, big meetings, barbecue', 'frustration, dissatisfied, bad mood, feeling drained', 'estimate, planning, consideration, estimate, mind', 'love, care', 'joy, surprise, gift, useful, memories, stories, nostalgia', 'sleep, two worlds, room, bed, remember, positive, process, reality', 'happiness, balanced, positive, peace, tranquility, lying, leisure, paradise', 'beautiful, cozy, pleasant, high spirits, positive start, gives strength, inner desire, memory, dreamlike, warm, daydream, at night, sleep, relaxation, high, energizer, energizing, thinking about it throughout the day', 'sadness, listlessness, helplessness, dissatisfaction, feeling empty, alone', 'delighted, excited, surprise, expectations, positive', ""um, do i speak german?, german language difficult language, doesn't exist, i actually know, omitted, forgotten, school, stupid, uh, knowing makes ah, remember, pause, search"", 'stress, annoyed', 'security, trust, honesty, reliability, loyalty', 'blushing, nervousness, lack of relaxation', 'excitement, planning, long wait, tingles, friends, countries, travel, pack, count days', 'new, known, repeat', 'archive, work, colleague, unpleasant, contradiction, avoidance behavior', 'being good, perfectionism, stubborn, best, compulsion, ambivalent']"	33	[[14, 35], [10, 6], [30, 18], [11, 4], [27, 2], [22, 1], [33, 25], [22, 24], [21, 36], [12, 29], [24, 36], [3, 16], [13, 1], [6, 30], [23, 4], [6, 17], [27, 24], [36, 23], [22, 11], [12, 0], [11, 20], [27, 14], [17, 36], [8, 18], [35, 7], [5, 9], [35, 15], [21, 27], [25, 35], [31, 5], [12, 7], [22, 0], [10, 3]]	[0, 0, 1, 1, 2, 3, 3, 4, 4, 5, 5, 6, 6, 6, 7, 7, 8, 9, 10, 10, 11, 11, 11, 12, 12, 12, 13, 14, 14, 15, 16, 17, 17, 18, 18, 20, 21, 21, 22, 22, 22, 22, 23, 23, 24, 24, 24, 25, 25, 27, 27, 27, 27, 29, 30, 30, 31, 33, 35, 35, 35, 35, 36, 36, 36, 36]	17	17.5	21.0	60	[[0.4485088884830475, 0.4273320734500885], [0.4514368772506714, 0.45601069927215576], [0.417552649974823, 0.4292639195919037], [0.4774920344352722, 0.48385515809059143], [0.43638935685157776, 0.48556962609291077], [0.4232047200202942, 0.46411627531051636], [0.4098825454711914, 0.41559112071990967], [0.44071272015571594, 0.4377056956291199], [0.439397931098938, 0.42116108536720276], [0.4539926052093506, 0.43902069330215454], [0.4285601079463959, 0.4164266586303711], [0.45144644379615784, 0.4376188814640045], [0.44892439246177673, 0.4866328239440918], [0.4503421187400818, 0.4302118122577667], [0.4330379068851471, 0.46785804629325867], [0.46341845393180847, 0.45208391547203064], [0.431337833404541, 0.4323752224445343], [0.4016191363334656, 0.41380423307418823], [0.4311933219432831, 0.443916380405426], [0.44597017765045166, 0.48671332001686096], [0.4644254744052887, 0.44967347383499146], [0.4365723431110382, 0.4446171820163727], [0.4201025664806366, 0.40728262066841125], [0.4555942714214325, 0.4373515844345093], [0.40957581996917725, 0.4426407516002655], [0.4703925549983978, 0.46634092926979065], [0.42734724283218384, 0.4471398890018463], [0.43932971358299255, 0.430929034948349], [0.4193100035190582, 0.40924379229545593], [0.4502663314342499, 0.4853731393814087], [0.4575291872024536, 0.4632854759693146], [0.42657262086868286, 0.4745236337184906], [0.4528888165950775, 0.4664655029773712]]	0.8868624793760704	28.18263004819552
