26	Weforshank	emo	parenting, friendship, kindness, love, empathy, gratitude	"['escalator, push away, annoying', 'depends on interaction, nice, bad, happy, sad, melancholic', 'commitment, perfection, joy, meaningfulness, production, implementation, creativity, success', ""social anxiety, avoid, don't want to talk, dislike person, want quiet, loner, hallway, office, old acquaintance, hide"", 'scared, or annoyed, annoying neighbor, bother, wrong time, get lost, neighbor', 'conflict, regret, chance, insecure, conscience', 'bad, stop, no, acceptance', 'annoying, leave me alone, know-it-all, unnecessary', 'slightly rude, pointless, weird', 'disappointment, pain, distrust, jealousy, fear, bias, attachment problems, attachment anxiety', 'restlessness, not wanting to miss, control, anticipation', 'reliability, security', 'window, looking out, waiting, anticipation', 'uncertainty, tension, uncomfortable', 'form an opinion', 'ex, guy (fernando) is easy to remember, cheated on', 'insecurity, fear, guilt, overthinking, racing heart, self-esteem, lack of confidence, unease', 'heaviness, despair, depression, crying, lonely, helpless', 'family, friends, partner, animals, love, happiness', 'exhaustion, heavy limbs, dark circles, slow movements, taciturn, dry throat, no drive', 'joy, relief, positive, development, self, pride, stage of life, change, career', 'luck, see, hidden, time, gain, important', 'difficult, learn, intention, want to understand, be understood, work, long learning process, goal helps, practice, understanding, skill, retrieval process, grammar', 'pressure, discomfort, uncomfortable, anger, being outraged, being annoyed, showing no insight', 'undecided, overwhelmed', ""party, alarm clock too early, don't feel like getting up no, bed, laziness, eyes close, sticky eyes, long night, get through, friends"", 'anger, wild, stress, fear, anger, boring', 'restless, annoying, thoughtful', 'fear, language barrier, spanish, unfounded, stupid', 'annoying, dismissive, arrogance, unhelpful, feeling bad', 'affection, closeness, security, love, caring, dependency', 'corona, neutral, person-dependent, celebration, restaurant, cafe, university', 'affection, love, desire/addiction, impulsive, lust']"	33	[1246, 776, 803, 1035, 1615, 1576, 1042, 639, 1723, 140, 569, 1821, 1471, 1161, 1949, 21, 146, 1203, 1372, 341, 860, 1109, 268, 696, 1897, 260, 1324, 1418, 1459, 1616, 297, 1408, 368]	[21, 140, 146, 260, 268, 297, 341, 368, 569, 639, 696, 776, 803, 860, 1035, 1042, 1109, 1161, 1203, 1246, 1324, 1372, 1408, 1418, 1459, 1471, 1576, 1615, 1616, 1723, 1821, 1897, 1949]	1019	1109.0	3.0	1953	[0.3555317521095276, 0.3758072257041931, 0.37457507848739624, 0.36421725153923035, 0.33794254064559937, 0.3400546610355377, 0.36392301321029663, 0.3827207386493683, 0.33147624135017395, 0.4203914403915405, 0.38583987951278687, 0.3213787078857422, 0.3458176851272583, 0.35905921459198, 0.28746169805526733, 0.44984763860702515, 0.41938310861587524, 0.3572254776954651, 0.3504011332988739, 0.4011845886707306, 0.3725317716598511, 0.361478716135025, 0.40722009539604187, 0.37982550263404846, 0.3104734718799591, 0.4078002870082855, 0.3522786498069763, 0.3481145203113556, 0.34633445739746094, 0.3379206657409668, 0.4043436348438263, 0.3487813174724579, 0.39936062693595886]	0.36668796340624493	0.3843884454249125
27	Plüpp	emo	misogyny, homophobia, insecurity, depression, anxiety, racism	['excitement, travel fever, excitement, fun, joy', 'i do not know', 'despair, resentment, impatience, annoyance, amusing, charming, unsorted', 'fear of flying, excitement, anticipation, other countries, travel, adventure, experiences, new, happy, nervous', 'neutral, getting to know, strange, feeling, anticipation, curiosity, interested, contact, encounter, school', 'annoyed, insecure, invisible', 'mansplaining, let me, bugs, know', 'crap, research, dead end, look for a solution, no goal in sight, reconsider, find another way', 'stupid, sad, anger, hate', 'modesty, discouraged, holding back, consideration, empathetic, selfless, disappointment', 'on the fingertip, tongue, block, mind game, paraphrase, blackout', 'misunderstanding, suddenly, tears, comfort', 'relaxation, massage, sleeping, resting, closing time', 'fear, tension, guilt, stress, detours, save the day', 'coincidence, found, not mindful', 'unnecessary, negative, annoying, shopping (employees)', 'joy, security, self-esteem, positive charisma, contentment, privilege', 'practice, learn, interest, commitment', 'effort, patience', 'active, committed, dreams, fulfill wishes, implement plans, drive, goals', 'perfectionism, tingling fingers, effort, goal, frustration, tired, wanting to achieve, task, repetition', 'alone, complicated, shy, talk, afraid', 'rest, be with yourself, undisturbed, no problem, switch off, be on your own, rejection, enjoy', 'get angry, be annoyed, feel humiliated, thirst for knowledge', 'tired, weak, lacking energy, sad, from the wind, confused', 'check, wait, the day before yesterday, anticipation, always too late, bored, when will it finally come?, 5 more minutes', 'merciless', 'disrespectful, angry, overbearing, annoying', 'tough, alone, feminism, happiness, right, self-determined', 'avoidance, awkward, dodging, argument, embarrassing, hiding, turning around', 'proximity, silence, eye contact, uncomfortable, opportunity, uncertainty, cowardly, insecure', 'mom, word finding disorder, icd10, memory, uncomfortable, difficult', 'avoid, dislike, unpopular, trouble']	33	[1491, 1874, 568, 247, 698, 1263, 1922, 398, 1663, 342, 1290, 1202, 1805, 682, 1441, 1751, 424, 1670, 1431, 1523, 26, 1873, 236, 1617, 854, 510, 1854, 1608, 808, 1235, 1040, 629, 1868]	[26, 236, 247, 342, 398, 424, 510, 568, 629, 682, 698, 808, 854, 1040, 1202, 1235, 1263, 1290, 1431, 1441, 1491, 1523, 1608, 1617, 1663, 1670, 1751, 1805, 1854, 1868, 1873, 1874, 1922]	1146	1263.0	3.0	1953	[0.3534366488456726, 0.32525795698165894, 0.39702466130256653, 0.4191534221172333, 0.3894335925579071, 0.3630407452583313, 0.31520605087280273, 0.407671719789505, 0.34296974539756775, 0.4111482501029968, 0.3618801534175873, 0.3662697374820709, 0.3321787416934967, 0.3900958001613617, 0.35603806376457214, 0.33626481890678406, 0.4060671627521515, 0.342541366815567, 0.3564808666706085, 0.351504385471344, 0.4604541063308716, 0.3253712058067322, 0.4199163019657135, 0.3457612097263336, 0.3816441297531128, 0.4004659950733185, 0.32711061835289, 0.34607601165771484, 0.38401535153388977, 0.3648604452610016, 0.3730303943157196, 0.39306238293647766, 0.3260081112384796]	0.36883151982769824	0.3843884454249125
28	Bisknirgo	emo	peace, happiness, meditation, joy, relaxation, bliss	"['compassion, inspiration, social, society', 'german, english, spanish, ambition, searching for words, memory, gestures, grammar, effort, thinking', 'sun, window, warmth, smile, well rested, good day, energy, indulge in dreams', 'trust, reliability, connectedness, binding, secured', 'incongruent, goofy, selfless?, uncomfortable', 'usually unnecessary, one only sees afterwards, that it was exaggerated, often under stress, can affect me and others too, maybe because it is important to me', 'anger, emotionality, dissatisfaction, maladjusted, unexpected, deeper problems, repress, project, emotional instability', 'adult, independent, master of my life, important decision, change, taking responsibility', 'relaxation, come to rest', 'love, happy, perfection, sister, sharing makes happy, contagious, world is beautiful, closer bond, smile, hug, warm heart', 'influenceable', 'relaxed, beautiful, stress free, carefree, well rested, peace, love, friends', 'commitment, lifeblood, time-consuming, passion, voluntary, intrinsic motivation, for others, absorbed in it, interested, social, successful', 'depression, despair, menstruation, crying, comfort, shaking', 'dissatisfied, searching, impatient, nervous, disappointed', 'relaxed, calm, perfectly happy', 'strategic, plan, overview, control, security, sovereignty, planning, good, helpful, structure, strong, clarity', 'proud, reassured, takes the load off, joy, hats off, thank you', ""thinking, brooding, getting angry, doesn't let you rest, thoughts circling, blaming yourself"", 'weigh, points of view, experiences, perspectives', 'joy for the persons, thought of loved one, envy', ""uncomfortable, often by older people, someone is listening, you don't necessarily want to follow advice, embarrassing"", 'shyness, love, passion, contentment, strangers, getting to know each other, racing heart, attraction, nervousness, experiencing something new', 'passion, energy, alleged altruism, expensive, joy, fulfillment, happiness', ""annoying, won't let you rest, uncomfortable situation, embarrassing, funny, depends on the other person"", 'imposing, exhausting, invasive, being annoyed, frustration', 'traveling, abroad, experiencing new things, anticipating, adventure, not being able to sleep, on the road, plane', 'empathy, empathy, understanding the other, comforting or being happy for the person, enthusiasm is contagious, understanding', 'laziness, indecisive, waiting, curiosity, busy, not in the mood', 'confusion', 'proud, restraint, wanting to spare others, regretting it, avoiding stress, not being a burden, not trusting, forgiving, fear, worry', 'closeness, affection, love, interest, passion, sex, caring, comforting, laughing, dancing']"	32	[1225, 345, 960, 919, 1284, 303, 86, 675, 1406, 885, 1783, 933, 275, 964, 1543, 1774, 121, 132, 1178, 1760, 1051, 983, 118, 672, 839, 1836, 666, 451, 615, 1869, 489, 832]	[86, 118, 121, 132, 275, 303, 345, 451, 489, 615, 666, 672, 675, 832, 839, 885, 919, 933, 960, 964, 983, 1051, 1178, 1225, 1284, 1406, 1543, 1760, 1774, 1783, 1836, 1869]	905	902.0	3.0	1953	[0.3668975234031677, 0.4127775728702545, 0.3781528174877167, 0.38033148646354675, 0.36328864097595215, 0.4162904918193817, 0.44467830657958984, 0.3917294144630432, 0.35760635137557983, 0.381377637386322, 0.3348905146121979, 0.37956559658050537, 0.41914474964141846, 0.37802591919898987, 0.3512977361679077, 0.3359402120113373, 0.43781593441963196, 0.4365929365158081, 0.36849671602249146, 0.3370904326438904, 0.3744044303894043, 0.3770270049571991, 0.4386027455329895, 0.3917965888977051, 0.383463978767395, 0.3298248052597046, 0.39229586720466614, 0.40606871247291565, 0.3954933285713196, 0.3257370889186859, 0.4030417501926422, 0.3836462199687958]	0.38354354724287987	0.3843884454249125
29	Iberletsch	emo	love, intimacy, kissing, romance, affection, loneliness	['fear, panic, death, family', 'exhausting, embarrassing if you use the wrong word or the words are missing, but also enjoy entertainment that works', 'autonomy, future, trend-setting, being, experience, growth, independence, freedom, character', 'love, crush, actor, stranger, fantasies, mental cinema, closeness, touch, butterflies in the stomach, exciting, desire', 'friends, acquaintances, family, feel good, warm, games, fun, laugh, familiar, joy, food, social, community', 'tension, memory, restlessness, imagination, strength, strain, stress', 'spanish, awkward, expression, not being myself, nervous, insecure', 'relaxation, good feeling, at peace with yourself, content, music', 'hide, social contact, be alone', 'curiosity, pack, dream, plan, anticipation, suitcase, clothes, toilet bag, plane, ship, car, vacation, free', 'blockade, underdeveloped, room for improvement, pent-up demand, not communicative', 'anticipation, travel fever, friends, planning a trip, packing your suitcase, serving time, i like, excitement, excitement, relaxation', 'tv, waiting, impatient, volume', 'looking back, indulging, lying there for a moment', 'frustrated reaction to thoughts that are not spoken', 'happy, strong, confident', 'tension, doggedness, discomfort, being annoyed, anger, pressure to succeed, success, recognition', 'togetherness, social', 'fate', 'lying, difficult to deal with, childish, false modesty, unnecessary', 'remorse, conflict, decide, insecure, dare, other way', 'eagerness, luck, commitment, tackle, time, entertaining, task, goal', 'gesture, community, attachment, social interaction, social cohesion, love, security, connection, family, context, active process, frequent, normal, unobtrusive, unconscious, conscious', 'unnecessary, being sensitive, touchy, emotional, battered', 'happiness, love, fulfilled, satisfied, compassion, empathy', 'english, swedish, insecure, embarrassed, fear, failure, presentation, reading, school, stutter, promise, muddle, red', 'stress, but also feelings of happiness, joy', 'restlessness, tension, nervousness, malaise, imbalance', 'love, bliss, relaxed, rest', 'special, strong bond, lasts very long, family, children, small, young', 'proximity, relationship, friends, happiness', 'meditation, sound of the sea, waves, freedom, inner peace, contentment, master yi, yoga, flow experience', 'cheating, cheating, careful, pain']	33	[1031, 1561, 944, 630, 666, 797, 960, 898, 1324, 537, 228, 411, 1511, 1811, 1538, 1909, 531, 1737, 1883, 730, 1568, 1246, 264, 1140, 1263, 282, 678, 566, 1404, 255, 1120, 231, 1401]	[228, 231, 255, 264, 282, 411, 531, 537, 566, 630, 666, 678, 730, 797, 898, 944, 960, 1031, 1120, 1140, 1246, 1263, 1324, 1401, 1404, 1511, 1538, 1561, 1568, 1737, 1811, 1883, 1909]	1001	960.0	0.0	1953	[0.3616871237754822, 0.3365213871002197, 0.36574092507362366, 0.3808690011501312, 0.3787732422351837, 0.37225285172462463, 0.36465537548065186, 0.36741694808006287, 0.34806743264198303, 0.3871396780014038, 0.41140440106391907, 0.39560240507125854, 0.3392236828804016, 0.3192475438117981, 0.338041216135025, 0.30583444237709045, 0.38745903968811035, 0.3261694312095642, 0.31197306513786316, 0.37571266293525696, 0.33633092045783997, 0.35164010524749756, 0.4077121317386627, 0.35637137293815613, 0.3506372570991516, 0.40626466274261475, 0.37810659408569336, 0.3852215111255646, 0.3445689380168915, 0.40843671560287476, 0.3574133813381195, 0.41113877296447754, 0.34471023082733154]	0.3640104378714706	0.3843884454249125
30	Wunicher	neu	stalking, paranoia, schizophrenia, racism, autism, PTSD	['diary, reflect, write, think', 'reminiscent of depression, otherwise dramatic person, over the top, inner child conflict', 'practice, pressure to perform, perfection, control, willpower, goal', 'tense, socially incompetent, compulsive, anticipation, excited, family, friends, meeting someone, having someone visit for the first time, cleaning the apartment, postman, window, balcony', 'circling thoughts, neuroticism, annoying, unnecessary, not changing, uncomfortable, negative situation, problem, should go away, no sleep', 'unrest, conflict, problem, uneasiness, anger, guilt', 'meditation, rest, bed, me, being, nothing, neutral, it is what it is, presence', 'surprised, joy, memory', 'warmth, cuddle, innocent', 'relaxation, speaking, conversations, interaction, attention, listening, watching', 'be positive, be surprised, joy, not expect anything, cheer up', 'friendship, communication, informative, encounter, exchange', 'elevator, shop, shopping, work, meeting', 'stress, negative fullness, bursting, tense', 'avoid encounters as much as possible', 'excited, overreacted, dissatisfied', 'joy, anger, routine, everyday life, friendship', 'do not want, help, hide, detour, embarrassed, shame', 'happiness, joy, gratitude', 'reality, plan, organize, responsibility, reliability, drive, self-determination', 'together, together, acquaintance, friends, gentleman, joy, see you again, have fun, at home, cafe, spend time, familiar, play', 'calmed down, peace, work, delegate, team, together, mate', 'ignorance, not properly prepared, human, current level of knowledge, annoying, preparation, work process, level of knowledge, delaying, perfectionism, improvement', 'calm, security, relaxed, trust, contentment', 'feeling, anticipation, warm', 'learning, no time, fear, society, sports, friends, stupid, head against heart, wrong people', 'criticism, improvement', 'fear, discomfort, shy, insecurity', 'beautiful or bad, rem, sleep, cloud, calm, history', 'positive or negative, important, bad evaluation of oneself, evaluate, judge, thoughts, optimistic, pessimistic, self-image', 'repetition, stress, checking, checking, anxiety', 'love, family, sweet, little comrades, cuddly', 'brood, forgetful, memory, think, blackout']	33	[1951, 1126, 1159, 319, 126, 837, 228, 1372, 1136, 1395, 1182, 1805, 1887, 1565, 1866, 754, 1494, 1061, 1281, 537, 529, 1005, 25, 1127, 1079, 503, 1071, 1232, 989, 277, 1216, 1607, 1792]	[25, 126, 228, 277, 319, 503, 529, 537, 754, 837, 989, 1005, 1061, 1071, 1079, 1126, 1127, 1136, 1159, 1182, 1216, 1232, 1281, 1372, 1395, 1494, 1565, 1607, 1792, 1805, 1866, 1887, 1951]	1076	1127.0	3.0	1953	[0.29172244668006897, 0.36150017380714417, 0.36003127694129944, 0.41506192088127136, 0.4384450912475586, 0.3763103783130646, 0.4241480827331543, 0.35086846351623535, 0.36107662320137024, 0.34980955719947815, 0.35920462012290955, 0.3273298442363739, 0.31949880719184875, 0.3424350917339325, 0.32197266817092896, 0.3814558684825897, 0.3456915020942688, 0.36451834440231323, 0.3553476333618164, 0.39723294973373413, 0.3977401852607727, 0.3680933117866516, 0.4684637188911438, 0.36140286922454834, 0.3637790083885193, 0.39943835139274597, 0.3641152083873749, 0.35719701647758484, 0.36892199516296387, 0.41915664076805115, 0.3578168451786041, 0.3400225341320038, 0.3285426199436188]	0.3678288378498771	0.3843884454249125
31	Neif	neu	entrepreneurship, creativity, innovation, ethics, optimism, skepticism	['emotional, imagination', 'courage, effort, anticipation, self-confidence but also fears of failure, sometimes feeling of being alone', 'review, personality, goals, challenges, growth, autonomy, success, happiness, gratitude', 'new, get to know, sympathy, unlikeable, known situation, people, socially incompetent, forgot names, hello', 'short, unclear, different world, lucid dreaming, weird, very confused, foggy, interesting, subconscious, processing, curiosity', 'joy, wanderlust, abroad, cultures, fear, farewell, possibility, opportunity, contact', 'juhuuuuuu, warm, sun, car, pack, nervous, stress, great, finally', 'practice, discipline, ambition, success, pride', 'curious, excited, exciting', 'exhausting, talent, discipline, over the top, compulsiveness, whimsy, fear of failure, perfectionism, pride, fluid, oil', 'anger, incomprehension, looking for solutions, feeling weak, distress, blocked', 'reflection, feedback, positive', 'mathematics, problems, tasks, solve, solution', 'strange, caution', 'bliss', 'tired, sluggish, last friday', 'uncertainty, discomfort, confusion, adrenaline, tension, being still, fear', 'worry, jitters, time, stomach ache, excitement', 'hormone', 'joy, excitement, stress, heat, turmoil, impatience, friendship', 'palace, uncertainty, preparation, unnecessary, compulsion, conversation, uncertainty, control, imagination', 'worry, excitement, tired, dull, restless', 'over the top, annoying, emotionally charged, derailing, overpowering, unimportant, taking up space, delay, corrosive, negative, upsetting, prolonged, busy', 'love, security, security, contact, attachment', 'anticipation, nervous, excited, impatient', 'quantity, cleaning plan, flat share, finally, relief, about time, joy, well done, praise', 'proud, will, happy, determined', 'empathetic, happy, familiar', 'excitement, hope, fear, joy', 'tiring, nervous, sad, demotivated, often, tired, no recovery', 'labor, planning, talent, skill, experience, creation, materials, tools', 'constantly, ssri, annika gieselmann, pietrowsky, nightmare, dream diary', 'desperate, bad, frustration']	33	[1656, 69, 1034, 351, 888, 1021, 618, 1622, 1804, 138, 741, 1166, 1435, 1759, 1806, 1887, 728, 1305, 1507, 381, 638, 1734, 541, 680, 1870, 119, 1903, 1344, 1055, 386, 840, 261, 1446]	[69, 119, 138, 261, 351, 381, 386, 541, 618, 638, 680, 728, 741, 840, 888, 1021, 1034, 1055, 1166, 1305, 1344, 1435, 1446, 1507, 1622, 1656, 1734, 1759, 1804, 1806, 1870, 1887, 1903]	1052	1034.0	3.0	1953	[0.3424510359764099, 0.43913039565086365, 0.3733876049518585, 0.40465402603149414, 0.37887969613075256, 0.3739174008369446, 0.39066991209983826, 0.3443005383014679, 0.3304550051689148, 0.4258759319782257, 0.3854214549064636, 0.3676796853542328, 0.35471421480178833, 0.3342238664627075, 0.3304208815097809, 0.3212622404098511, 0.3859963119029999, 0.3606022596359253, 0.3510541021823883, 0.40299731492996216, 0.38990920782089233, 0.3365514576435089, 0.39407584071159363, 0.3882797360420227, 0.32359451055526733, 0.42943239212036133, 0.3179008364677429, 0.35890474915504456, 0.3724800944328308, 0.40286657214164734, 0.3808678388595581, 0.41144147515296936, 0.3535364270210266]	0.3714525762832526	0.3843884454249125
32	Zimerhubst	neu	insomnia, fatigue, depression, exhaustion, anxiety, sleep	"['compassion, caring, love, friendship', 'unexpected, happiness, reward, joy', 'anxiety, fear, talk', 'uncomfortable, annoying, run off, chatterbox, actually friendly, but annoying, make a bow around it, get out of the way', 'life path, challenge, courage, confidence, trust, reflection', 'shared flat, at home, beautiful, being yourself, laughing, listening, friends, family', 'strange, effort, learn, much thought, patience', 'beautiful, sweet, pleasant, togetherness', 'barrier, obstacle, fear, shame, stupid, inhibited, social anxiety', 'present thoughts, realistic, stirring', 'physical contact, connection', 'fear, love, feelings, participation, togetherness, cohesion, solidarity', 'cheer, happiness, excited, grin, drive, tremble', 'introvert, shy, outsider, withdrawn', 'corona end, maybe trip to iceland in summer', 'effort, exhausting, palpitations, being annoyed, unwell', 'stomach ache, body sensation, excitement, anticipation', 'positive thinking, contentment, patience', 'comfortable, lazy, internal dialogue, soothe, mental scenarios, consider, listlessness', 'annoyed, rubbish, negative, why, dissatisfied, change, self-reflection, closed', 'understand, touch, equal, understanding, together, v', 'stupid, annoying, meddling, person should shut up, unasked, embarrassing, crossing private borders, unasked', 'deception, pretend, opposite, dishonest, tricks', 'purposeful, innovative, visionary, optimistic, ambitious, plan, structured', 'toilet, neighbors, uncomfortable, not a nice feeling, argument, ignorance, reluctance, no motivation to talk, peace, being alone', 'wild, confused', 'security, warmth, familiarity', 'neutral, good, relaxed', 'angry, anger, embarrassed, talk, thoughts, try to avoid, rewrite', ""stress, hide, watch, listen, be quiet, wait, don't move, hope"", 'false modesty, not indulging, standing up for yourself, accepting things', 'social, pleasant, joy, protection']"	32	[843, 1220, 1580, 634, 1044, 1064, 1115, 885, 735, 1171, 1440, 300, 1811, 1736, 1578, 1363, 1560, 911, 505, 876, 307, 90, 1004, 1442, 156, 1862, 1010, 1525, 652, 783, 685, 801]	[90, 156, 300, 307, 505, 634, 652, 685, 735, 783, 801, 843, 876, 885, 911, 1004, 1010, 1044, 1064, 1115, 1171, 1220, 1363, 1440, 1442, 1525, 1560, 1578, 1580, 1736, 1811, 1862]	1021	1007.0	3.0	1953	[0.38866567611694336, 0.3708333373069763, 0.352621853351593, 0.40075111389160156, 0.37921789288520813, 0.3783781826496124, 0.375782310962677, 0.3863680958747864, 0.39474427700042725, 0.3732127845287323, 0.3591320812702179, 0.42330440878868103, 0.3353903293609619, 0.34311890602111816, 0.3528197705745697, 0.3635316491127014, 0.353865385055542, 0.38511234521865845, 0.4090670049190521, 0.38696908950805664, 0.42273399233818054, 0.44681671261787415, 0.3810819685459137, 0.3590984642505646, 0.43789243698120117, 0.3294777274131775, 0.3807109594345093, 0.35553738474845886, 0.3994888663291931, 0.39158207178115845, 0.397790789604187, 0.3904525339603424]	0.38142345007508993	0.3843884454249125
